[I 2026-06-01 17:25:29,797] Trial 11 finished with value: -10.0 and parameters: {'momentum_lookback': 4, 'momentum_threshold': 0.00035000000000000005, 'volume_lookback': 192, 'volume_ratio_min': 0.7, 'atr_period': 14, 'vol_lookback': 144, 'vol_ratio_min': 0.6, 'max_hold_bars': 4, 'sl_atr_mult': 2.0, 'tp_atr_mult': 3.0, 'start_hour': 13, 'end_hour': 21, 'direction_mode': 'fade', 'include_first_day': False}. Best is trial 0 with value: 1.4694444753080798.
C:\Users\הלל\Desktop\algo projects\trading-research-factory\walk forward engine\src\strategies\month_end_rebalance_eurusd.py:36: UserWarning: Converting to PeriodArray/Index representation will drop timezone information.
  month_key = index.to_period("M")
C:\Users\הלל\Desktop\algo projects\trading-research-factory\walk forward engine\src\strategies\month_end_rebalance_eurusd.py:36: UserWarning: Converting to PeriodArray/Index representation will drop timezone information.
  month_key = index.to_period("M")
C:\Users\הלל\Desktop\algo projects\trading-research-factory\walk forward engine\.venv\lib\site-packages\optuna\samplers\_tpe\sampler.py:319: ExperimentalWarning: ``multivariate`` option is an experimental feature. The interface can change in the future.
  warnings.warn(
[I 2026-06-01 17:25:30,442] A new study created in memory with name: no-name-d45b37e7-02f5-434b-8884-d9b85a55ad79
C:\Users\הלל\Desktop\algo projects\trading-research-factory\walk forward engine\.venv\lib\site-packages\optuna\distributions.py:685: UserWarning: The distribution is specified by [0.00015, 0.0006] and step=0.00010000000000000002, but the range is not divisible by `step`. It will be replaced by [0.00015, 0.00055].
  warnings.warn(
C:\Users\הלל\Desktop\algo projects\trading-research-factory\walk forward engine\.venv\lib\site-packages\optuna\distributions.py:685: UserWarning: The distribution is specified by [0.7, 1.1] and step=0.20000000000000007, but the range is not divisible by `step`. It will be replaced by [0.7, 0.9].
  warnings.warn(
C:\Users\הלל\Desktop\algo projects\trading-research-factory\walk forward engine\.venv\lib\site-packages\optuna\distributions.py:700: UserWarning: The distribution is specified by [10, 20] and step=4, but the range is not divisible by `step`. It will be replaced by [10, 18].
  warnings.warn(
C:\Users\הלל\Desktop\algo projects\trading-research-factory\walk forward engine\.venv\lib\site-packages\optuna\distributions.py:685: UserWarning: The distribution is specified by [0.6, 1.0] and step=0.20000000000000007, but the range is not divisible by `step`. It will be replaced by [0.6, 0.8].
  warnings.warn(
C:\Users\הלל\Desktop\algo projects\trading-research-factory\walk forward engine\.venv\lib\site-packages\optuna\distributions.py:700: UserWarning: The distribution is specified by [19, 22] and step=2, but the range is not divisible by `step`. It will be replaced by [19, 21].
  warnings.warn(
C:\Users\הלל\Desktop\algo projects\trading-research-factory\walk forward engine\.venv\lib\site-packages\optuna\distributions.py:685: UserWarning: The distribution is specified by [0.00015, 0.0006] and step=0.00010000000000000002, but the range is not divisible by `step`. It will be replaced by [0.00015, 0.00055].
  warnings.warn(
C:\Users\הלל\Desktop\algo projects\trading-research-factory\walk forward engine\.venv\lib\site-packages\optuna\distributions.py:685: UserWarning: The distribution is specified by [0.7, 1.1] and step=0.20000000000000007, but the range is not divisible by `step`. It will be replaced by [0.7, 0.9].
  warnings.warn(
C:\Users\הלל\Desktop\algo projects\trading-research-factory\walk forward engine\.venv\lib\site-packages\optuna\distributions.py:700: UserWarning: The distribution is specified by [19, 22] and step=2, but the range is not divisible by `step`. It will be replaced by [19, 21].
  warnings.warn(
C:\Users\הלל\Desktop\algo projects\trading-research-factory\walk forward engine\.venv\lib\site-packages\optuna\distributions.py:700: UserWarning: The distribution is specified by [10, 20] and step=4, but the range is not divisible by `step`. It will be replaced by [10, 18].
  warnings.warn(
C:\Users\הלל\Desktop\algo projects\trading-research-factory\walk forward engine\.venv\lib\site-packages\optuna\distributions.py:685: UserWarning: The distribution is specified by [0.7, 1.1] and step=0.20000000000000007, but the range is not divisible by `step`. It will be replaced by [0.7, 0.9].
  warnings.warn(
C:\Users\הלל\Desktop\algo projects\trading-research-factory\walk forward engine\.venv\lib\site-packages\optuna\distributions.py:700: UserWarning: The distribution is specified by [10, 20] and step=4, but the range is not divisible by `step`. It will be replaced by [10, 18].
  warnings.warn(
C:\Users\הלל\Desktop\algo projects\trading-research-factory\walk forward engine\.venv\lib\site-packages\optuna\distributions.py:685: UserWarning: The distribution is specified by [0.6, 1.0] and step=0.20000000000000007, but the range is not divisible by `step`. It will be replaced by [0.6, 0.8].
  warnings.warn(
C:\Users\הלל\Desktop\algo projects\trading-research-factory\walk forward engine\.venv\lib\site-packages\optuna\distributions.py:685: UserWarning: The distribution is specified by [0.6, 1.0] and step=0.20000000000000007, but the range is not divisible by `step`. It will be replaced by [0.6, 0.8].
  warnings.warn(
C:\Users\הלל\Desktop\algo projects\trading-research-factory\walk forward engine\.venv\lib\site-packages\optuna\distributions.py:700: UserWarning: The distribution is specified by [19, 22] and step=2, but the range is not divisible by `step`. It will be replaced by [19, 21].
  warnings.warn(
C:\Users\הלל\Desktop\algo projects\trading-research-factory\walk forward engine\src\strategies\month_end_rebalance_eurusd.py:36: UserWarning: Converting to PeriodArray/Index representation will drop timezone information.
  month_key = index.to_period("M")
C:\Users\הלל\Desktop\algo projects\trading-research-factory\walk forward engine\src\strategies\month_end_rebalance_eurusd.py:36: UserWarning: Converting to PeriodArray/Index representation will drop timezone information.
  month_key = index.to_period("M")
C:\Users\הלל\Desktop\algo projects\trading-research-factory\walk forward engine\src\strategies\month_end_rebalance_eurusd.py:36: UserWarning: Converting to PeriodArray/Index representation will drop timezone information.
  month_key = index.to_period("M")
C:\Users\הלל\Desktop\algo projects\trading-research-factory\walk forward engine\src\strategies\month_end_rebalance_eurusd.py:36: UserWarning: Converting to PeriodArray/Index representation will drop timezone information.
  month_key = index.to_period("M")
C:\Users\הלל\Desktop\algo projects\trading-research-factory\walk forward engine\src\strategies\month_end_rebalance_eurusd.py:36: UserWarning: Converting to PeriodArray/Index representation will drop timezone information.
  month_key = index.to_period("M")
C:\Users\הלל\Desktop\algo projects\trading-research-factory\walk forward engine\src\strategies\month_end_rebalance_eurusd.py:36: UserWarning: Converting to PeriodArray/Index representation will drop timezone information.
  month_key = index.to_period("M")
C:\Users\הלל\Desktop\algo projects\trading-research-factory\walk forward engine\src\strategies\month_end_rebalance_eurusd.py:36: UserWarning: Converting to PeriodArray/Index representation will drop timezone information.
  month_key = index.to_period("M")
C:\Users\הלל\Desktop\algo projects\trading-research-factory\walk forward engine\src\strategies\month_end_rebalance_eurusd.py:36: UserWarning: Converting to PeriodArray/Index representation will drop timezone information.
  month_key = index.to_period("M")
[I 2026-06-01 17:25:31,990] Trial 0 finished with value: -10.0 and parameters: {'momentum_lookback': 16, 'momentum_threshold': 0.00035000000000000005, 'volume_lookback': 48, 'volume_ratio_min': 0.7, 'atr_period': 14, 'vol_lookback': 144, 'vol_ratio_min': 0.6, 'max_hold_bars': 16, 'sl_atr_mult': 1.0, 'tp_atr_mult': 2.0, 'start_hour': 14, 'end_hour': 21, 'direction_mode': 'fade', 'include_first_day': True}. Best is trial 0 with value: -10.0.
C:\Users\הלל\Desktop\algo projects\trading-research-factory\walk forward engine\.venv\lib\site-packages\optuna\distributions.py:685: UserWarning: The distribution is specified by [0.00015, 0.0006] and step=0.00010000000000000002, but the range is not divisible by `step`. It will be replaced by [0.00015, 0.00055].
  warnings.warn(
C:\Users\הלל\Desktop\algo projects\trading-research-factory\walk forward engine\.venv\lib\site-packages\optuna\distributions.py:685: UserWarning: The distribution is specified by [0.7, 1.1] and step=0.20000000000000007, but the range is not divisible by `step`. It will be replaced by [0.7, 0.9].
  warnings.warn(
C:\Users\הלל\Desktop\algo projects\trading-research-factory\walk forward engine\.venv\lib\site-packages\optuna\distributions.py:700: UserWarning: The distribution is specified by [10, 20] and step=4, but the range is not divisible by `step`. It will be replaced by [10, 18].
  warnings.warn(
C:\Users\הלל\Desktop\algo projects\trading-research-factory\walk forward engine\.venv\lib\site-packages\optuna\distributions.py:685: UserWarning: The distribution is specified by [0.6, 1.0] and step=0.20000000000000007, but the range is not divisible by `step`. It will be replaced by [0.6, 0.8].
  warnings.warn(
C:\Users\הלל\Desktop\algo projects\trading-research-factory\walk forward engine\.venv\lib\site-packages\optuna\distributions.py:700: UserWarning: The distribution is specified by [19, 22] and step=2, but the range is not divisible by `step`. It will be replaced by [19, 21].
  warnings.warn(
[I 2026-06-01 17:25:32,158] Trial 4 finished with value: -10.0 and parameters: {'momentum_lookback': 16, 'momentum_threshold': 0.00045, 'volume_lookback': 48, 'volume_ratio_min': 0.7, 'atr_period': 10, 'vol_lookback': 48, 'vol_ratio_min': 0.6, 'max_hold_bars': 16, 'sl_atr_mult': 1.0, 'tp_atr_mult': 2.0, 'start_hour': 12, 'end_hour': 19, 'direction_mode': 'fade', 'include_first_day': False}. Best is trial 0 with value: -10.0.
C:\Users\הלל\Desktop\algo projects\trading-research-factory\walk forward engine\.venv\lib\site-packages\optuna\distributions.py:685: UserWarning: The distribution is specified by [0.00015, 0.0006] and step=0.00010000000000000002, but the range is not divisible by `step`. It will be replaced by [0.00015, 0.00055].
  warnings.warn(
C:\Users\הלל\Desktop\algo projects\trading-research-factory\walk forward engine\.venv\lib\site-packages\optuna\distributions.py:685: UserWarning: The distribution is specified by [0.7, 1.1] and step=0.20000000000000007, but the range is not divisible by `step`. It will be replaced by [0.7, 0.9].
  warnings.warn(
[I 2026-06-01 17:25:32,196] Trial 2 finished with value: -0.846714593424169 and parameters: {'momentum_lookback': 12, 'momentum_threshold': 0.00025, 'volume_lookback': 48, 'volume_ratio_min': 0.7, 'atr_period': 10, 'vol_lookback': 192, 'vol_ratio_min': 0.6, 'max_hold_bars': 12, 'sl_atr_mult': 1.0, 'tp_atr_mult': 3.0, 'start_hour': 14, 'end_hour': 19, 'direction_mode': 'continuation', 'include_first_day': False}. Best is trial 2 with value: -0.846714593424169.
C:\Users\הלל\Desktop\algo projects\trading-research-factory\walk forward engine\.venv\lib\site-packages\optuna\distributions.py:700: UserWarning: The distribution is specified by [10, 20] and step=4, but the range is not divisible by `step`. It will be replaced by [10, 18].
  warnings.warn(
C:\Users\הלל\Desktop\algo projects\trading-research-factory\walk forward engine\.venv\lib\site-packages\optuna\distributions.py:685: UserWarning: The distribution is specified by [0.6, 1.0] and step=0.20000000000000007, but the range is not divisible by `step`. It will be replaced by [0.6, 0.8].
  warnings.warn(
[I 2026-06-01 17:25:32,234] Trial 1 finished with value: -0.44982146972228537 and parameters: {'momentum_lookback': 8, 'momentum_threshold': 0.00025, 'volume_lookback': 96, 'volume_ratio_min': 0.7, 'atr_period': 10, 'vol_lookback': 48, 'vol_ratio_min': 0.6, 'max_hold_bars': 8, 'sl_atr_mult': 1.5, 'tp_atr_mult': 3.0, 'start_hour': 13, 'end_hour': 21, 'direction_mode': 'continuation', 'include_first_day': True}. Best is trial 1 with value: -0.44982146972228537.
C:\Users\הלל\Desktop\algo projects\trading-research-factory\walk forward engine\.venv\lib\site-packages\optuna\distributions.py:685: UserWarning: The distribution is specified by [0.00015, 0.0006] and step=0.00010000000000000002, but the range is not divisible by `step`. It will be replaced by [0.00015, 0.00055].
  warnings.warn(
C:\Users\הלל\Desktop\algo projects\trading-research-factory\walk forward engine\.venv\lib\site-packages\optuna\distributions.py:700: UserWarning: The distribution is specified by [19, 22] and step=2, but the range is not divisible by `step`. It will be replaced by [19, 21].
  warnings.warn(
C:\Users\הלל\Desktop\algo projects\trading-research-factory\walk forward engine\.venv\lib\site-packages\optuna\distributions.py:685: UserWarning: The distribution is specified by [0.7, 1.1] and step=0.20000000000000007, but the range is not divisible by `step`. It will be replaced by [0.7, 0.9].
  warnings.warn(
C:\Users\הלל\Desktop\algo projects\trading-research-factory\walk forward engine\.venv\lib\site-packages\optuna\distributions.py:700: UserWarning: The distribution is specified by [10, 20] and step=4, but the range is not divisible by `step`. It will be replaced by [10, 18].
  warnings.warn(
C:\Users\הלל\Desktop\algo projects\trading-research-factory\walk forward engine\.venv\lib\site-packages\optuna\distributions.py:685: UserWarning: The distribution is specified by [0.6, 1.0] and step=0.20000000000000007, but the range is not divisible by `step`. It will be replaced by [0.6, 0.8].
  warnings.warn(
C:\Users\הלל\Desktop\algo projects\trading-research-factory\walk forward engine\.venv\lib\site-packages\optuna\distributions.py:685: UserWarning: The distribution is specified by [0.00015, 0.0006] and step=0.00010000000000000002, but the range is not divisible by `step`. It will be replaced by [0.00015, 0.00055].
  warnings.warn(
C:\Users\הלל\Desktop\algo projects\trading-research-factory\walk forward engine\.venv\lib\site-packages\optuna\distributions.py:700: UserWarning: The distribution is specified by [19, 22] and step=2, but the range is not divisible by `step`. It will be replaced by [19, 21].
  warnings.warn(
C:\Users\הלל\Desktop\algo projects\trading-research-factory\walk forward engine\.venv\lib\site-packages\optuna\distributions.py:685: UserWarning: The distribution is specified by [0.7, 1.1] and step=0.20000000000000007, but the range is not divisible by `step`. It will be replaced by [0.7, 0.9].
  warnings.warn(
C:\Users\הלל\Desktop\algo projects\trading-research-factory\walk forward engine\.venv\lib\site-packages\optuna\distributions.py:700: UserWarning: The distribution is specified by [10, 20] and step=4, but the range is not divisible by `step`. It will be replaced by [10, 18].
  warnings.warn(
C:\Users\הלל\Desktop\algo projects\trading-research-factory\walk forward engine\.venv\lib\site-packages\optuna\distributions.py:685: UserWarning: The distribution is specified by [0.6, 1.0] and step=0.20000000000000007, but the range is not divisible by `step`. It will be replaced by [0.6, 0.8].
  warnings.warn(
C:\Users\הלל\Desktop\algo projects\trading-research-factory\walk forward engine\.venv\lib\site-packages\optuna\distributions.py:700: UserWarning: The distribution is specified by [19, 22] and step=2, but the range is not divisible by `step`. It will be replaced by [19, 21].
  warnings.warn(
[I 2026-06-01 17:25:32,431] Trial 3 finished with value: -1.082075954079085 and parameters: {'momentum_lookback': 12, 'momentum_threshold': 0.00025, 'volume_lookback': 192, 'volume_ratio_min': 0.7, 'atr_period': 18, 'vol_lookback': 192, 'vol_ratio_min': 0.6, 'max_hold_bars': 8, 'sl_atr_mult': 1.5, 'tp_atr_mult': 2.5, 'start_hour': 14, 'end_hour': 19, 'direction_mode': 'continuation', 'include_first_day': True}. Best is trial 1 with value: -0.44982146972228537.
C:\Users\הלל\Desktop\algo projects\trading-research-factory\walk forward engine\src\strategies\month_end_rebalance_eurusd.py:36: UserWarning: Converting to PeriodArray/Index representation will drop timezone information.
  month_key = index.to_period("M")
[I 2026-06-01 17:25:32,466] Trial 5 finished with value: -1.2666838644944356 and parameters: {'momentum_lookback': 8, 'momentum_threshold': 0.00055, 'volume_lookback': 48, 'volume_ratio_min': 0.7, 'atr_period': 14, 'vol_lookback': 144, 'vol_ratio_min': 0.6, 'max_hold_bars': 12, 'sl_atr_mult': 1.5, 'tp_atr_mult': 3.0, 'start_hour': 14, 'end_hour': 21, 'direction_mode': 'continuation', 'include_first_day': True}. Best is trial 1 with value: -0.44982146972228537.
[I 2026-06-01 17:25:32,489] Trial 7 finished with value: 0.05255383604615207 and parameters: {'momentum_lookback': 4, 'momentum_threshold': 0.00025, 'volume_lookback': 192, 'volume_ratio_min': 0.7, 'atr_period': 10, 'vol_lookback': 96, 'vol_ratio_min': 0.6, 'max_hold_bars': 8, 'sl_atr_mult': 1.5, 'tp_atr_mult': 3.0, 'start_hour': 12, 'end_hour': 21, 'direction_mode': 'continuation', 'include_first_day': False}. Best is trial 7 with value: 0.05255383604615207.
[I 2026-06-01 17:25:32,602] Trial 6 finished with value: -0.808009834097064 and parameters: {'momentum_lookback': 12, 'momentum_threshold': 0.00025, 'volume_lookback': 48, 'volume_ratio_min': 0.7, 'atr_period': 10, 'vol_lookback': 96, 'vol_ratio_min': 0.6, 'max_hold_bars': 12, 'sl_atr_mult': 1.5, 'tp_atr_mult': 3.0, 'start_hour': 12, 'end_hour': 19, 'direction_mode': 'continuation', 'include_first_day': True}. Best is trial 7 with value: 0.05255383604615207.
C:\Users\הלל\Desktop\algo projects\trading-research-factory\walk forward engine\src\strategies\month_end_rebalance_eurusd.py:36: UserWarning: Converting to PeriodArray/Index representation will drop timezone information.
  month_key = index.to_period("M")
C:\Users\הלל\Desktop\algo projects\trading-research-factory\walk forward engine\src\strategies\month_end_rebalance_eurusd.py:36: UserWarning: Converting to PeriodArray/Index representation will drop timezone information.
  month_key = index.to_period("M")
C:\Users\הלל\Desktop\algo projects\trading-research-factory\walk forward engine\src\strategies\month_end_rebalance_eurusd.py:36: UserWarning: Converting to PeriodArray/Index representation will drop timezone information.
  month_key = index.to_period("M")
[I 2026-06-01 17:25:33,085] Trial 8 finished with value: -10.0 and parameters: {'momentum_lookback': 12, 'momentum_threshold': 0.00035000000000000005, 'volume_lookback': 144, 'volume_ratio_min': 0.7, 'atr_period': 18, 'vol_lookback': 48, 'vol_ratio_min': 0.6, 'max_hold_bars': 4, 'sl_atr_mult': 1.0, 'tp_atr_mult': 1.5, 'start_hour': 13, 'end_hour': 19, 'direction_mode': 'fade', 'include_first_day': True}. Best is trial 7 with value: 0.05255383604615207.
[I 2026-06-01 17:25:33,207] Trial 10 finished with value: -10.0 and parameters: {'momentum_lookback': 8, 'momentum_threshold': 0.00055, 'volume_lookback': 48, 'volume_ratio_min': 0.7, 'atr_period': 14, 'vol_lookback': 192, 'vol_ratio_min': 0.6, 'max_hold_bars': 4, 'sl_atr_mult': 1.0, 'tp_atr_mult': 3.0, 'start_hour': 12, 'end_hour': 19, 'direction_mode': 'fade', 'include_first_day': True}. Best is trial 7 with value: 0.05255383604615207.
[I 2026-06-01 17:25:33,208] Trial 9 finished with value: -10.0 and parameters: {'momentum_lookback': 12, 'momentum_threshold': 0.00055, 'volume_lookback': 192, 'volume_ratio_min': 0.7, 'atr_period': 14, 'vol_lookback': 192, 'vol_ratio_min': 0.6, 'max_hold_bars': 8, 'sl_atr_mult': 1.0, 'tp_atr_mult': 1.5, 'start_hour': 14, 'end_hour': 21, 'direction_mode': 'fade', 'include_first_day': True}. Best is trial 7 with value: 0.05255383604615207.
