[I 2026-06-01 17:24:43,636] Trial 11 finished with value: -10.0 and parameters: {'momentum_lookback': 4, 'momentum_threshold': 0.00045, 'volume_lookback': 192, 'volume_ratio_min': 0.7, 'atr_period': 10, 'vol_lookback': 96, 'vol_ratio_min': 0.6, 'max_hold_bars': 16, 'sl_atr_mult': 1.0, 'tp_atr_mult': 3.0, 'start_hour': 13, 'end_hour': 21, 'direction_mode': 'fade', 'include_first_day': True}. Best is trial 6 with value: -2.130702105292466.
C:\Users\הלל\Desktop\algo projects\trading-research-factory\walk forward engine\src\strategies\month_end_rebalance_eurusd.py:36: UserWarning: Converting to PeriodArray/Index representation will drop timezone information.
  month_key = index.to_period("M")
C:\Users\הלל\Desktop\algo projects\trading-research-factory\walk forward engine\src\strategies\month_end_rebalance_eurusd.py:36: UserWarning: Converting to PeriodArray/Index representation will drop timezone information.
  month_key = index.to_period("M")
C:\Users\הלל\Desktop\algo projects\trading-research-factory\walk forward engine\.venv\lib\site-packages\optuna\samplers\_tpe\sampler.py:319: ExperimentalWarning: ``multivariate`` option is an experimental feature. The interface can change in the future.
  warnings.warn(
[I 2026-06-01 17:24:43,993] A new study created in memory with name: no-name-b890e1ac-7a8e-4686-a440-7495bfdffe4c
C:\Users\הלל\Desktop\algo projects\trading-research-factory\walk forward engine\.venv\lib\site-packages\optuna\distributions.py:685: UserWarning: The distribution is specified by [0.00015, 0.0006] and step=0.00010000000000000002, but the range is not divisible by `step`. It will be replaced by [0.00015, 0.00055].
  warnings.warn(
C:\Users\הלל\Desktop\algo projects\trading-research-factory\walk forward engine\.venv\lib\site-packages\optuna\distributions.py:685: UserWarning: The distribution is specified by [0.7, 1.1] and step=0.20000000000000007, but the range is not divisible by `step`. It will be replaced by [0.7, 0.9].
  warnings.warn(
C:\Users\הלל\Desktop\algo projects\trading-research-factory\walk forward engine\.venv\lib\site-packages\optuna\distributions.py:700: UserWarning: The distribution is specified by [10, 20] and step=4, but the range is not divisible by `step`. It will be replaced by [10, 18].
  warnings.warn(
C:\Users\הלל\Desktop\algo projects\trading-research-factory\walk forward engine\.venv\lib\site-packages\optuna\distributions.py:685: UserWarning: The distribution is specified by [0.6, 1.0] and step=0.20000000000000007, but the range is not divisible by `step`. It will be replaced by [0.6, 0.8].
  warnings.warn(
C:\Users\הלל\Desktop\algo projects\trading-research-factory\walk forward engine\.venv\lib\site-packages\optuna\distributions.py:700: UserWarning: The distribution is specified by [19, 22] and step=2, but the range is not divisible by `step`. It will be replaced by [19, 21].
  warnings.warn(
C:\Users\הלל\Desktop\algo projects\trading-research-factory\walk forward engine\.venv\lib\site-packages\optuna\distributions.py:685: UserWarning: The distribution is specified by [0.6, 1.0] and step=0.20000000000000007, but the range is not divisible by `step`. It will be replaced by [0.6, 0.8].
  warnings.warn(
C:\Users\הלל\Desktop\algo projects\trading-research-factory\walk forward engine\.venv\lib\site-packages\optuna\distributions.py:700: UserWarning: The distribution is specified by [19, 22] and step=2, but the range is not divisible by `step`. It will be replaced by [19, 21].
  warnings.warn(
C:\Users\הלל\Desktop\algo projects\trading-research-factory\walk forward engine\src\strategies\month_end_rebalance_eurusd.py:36: UserWarning: Converting to PeriodArray/Index representation will drop timezone information.
  month_key = index.to_period("M")
C:\Users\הלל\Desktop\algo projects\trading-research-factory\walk forward engine\src\strategies\month_end_rebalance_eurusd.py:36: UserWarning: Converting to PeriodArray/Index representation will drop timezone information.
  month_key = index.to_period("M")
C:\Users\הלל\Desktop\algo projects\trading-research-factory\walk forward engine\src\strategies\month_end_rebalance_eurusd.py:36: UserWarning: Converting to PeriodArray/Index representation will drop timezone information.
  month_key = index.to_period("M")
C:\Users\הלל\Desktop\algo projects\trading-research-factory\walk forward engine\src\strategies\month_end_rebalance_eurusd.py:36: UserWarning: Converting to PeriodArray/Index representation will drop timezone information.
  month_key = index.to_period("M")
C:\Users\הלל\Desktop\algo projects\trading-research-factory\walk forward engine\src\strategies\month_end_rebalance_eurusd.py:36: UserWarning: Converting to PeriodArray/Index representation will drop timezone information.
  month_key = index.to_period("M")
C:\Users\הלל\Desktop\algo projects\trading-research-factory\walk forward engine\src\strategies\month_end_rebalance_eurusd.py:36: UserWarning: Converting to PeriodArray/Index representation will drop timezone information.
  month_key = index.to_period("M")
C:\Users\הלל\Desktop\algo projects\trading-research-factory\walk forward engine\src\strategies\month_end_rebalance_eurusd.py:36: UserWarning: Converting to PeriodArray/Index representation will drop timezone information.
  month_key = index.to_period("M")
[I 2026-06-01 17:24:45,497] Trial 7 finished with value: -10.0 and parameters: {'momentum_lookback': 12, 'momentum_threshold': 0.00055, 'volume_lookback': 48, 'volume_ratio_min': 0.7, 'atr_period': 10, 'vol_lookback': 192, 'vol_ratio_min': 0.6, 'max_hold_bars': 12, 'sl_atr_mult': 1.5, 'tp_atr_mult': 2.0, 'start_hour': 13, 'end_hour': 19, 'direction_mode': 'fade', 'include_first_day': False}. Best is trial 7 with value: -10.0.
[I 2026-06-01 17:24:45,523] Trial 5 finished with value: -10.0 and parameters: {'momentum_lookback': 4, 'momentum_threshold': 0.00055, 'volume_lookback': 48, 'volume_ratio_min': 0.7, 'atr_period': 10, 'vol_lookback': 48, 'vol_ratio_min': 0.6, 'max_hold_bars': 8, 'sl_atr_mult': 1.5, 'tp_atr_mult': 1.5, 'start_hour': 12, 'end_hour': 21, 'direction_mode': 'fade', 'include_first_day': True}. Best is trial 7 with value: -10.0.
[I 2026-06-01 17:24:45,545] Trial 2 finished with value: -10.0 and parameters: {'momentum_lookback': 16, 'momentum_threshold': 0.00035000000000000005, 'volume_lookback': 48, 'volume_ratio_min': 0.7, 'atr_period': 14, 'vol_lookback': 144, 'vol_ratio_min': 0.6, 'max_hold_bars': 12, 'sl_atr_mult': 1.0, 'tp_atr_mult': 3.0, 'start_hour': 14, 'end_hour': 21, 'direction_mode': 'fade', 'include_first_day': False}. Best is trial 7 with value: -10.0.
C:\Users\הלל\Desktop\algo projects\trading-research-factory\walk forward engine\.venv\lib\site-packages\optuna\distributions.py:685: UserWarning: The distribution is specified by [0.00015, 0.0006] and step=0.00010000000000000002, but the range is not divisible by `step`. It will be replaced by [0.00015, 0.00055].
  warnings.warn(
C:\Users\הלל\Desktop\algo projects\trading-research-factory\walk forward engine\.venv\lib\site-packages\optuna\distributions.py:685: UserWarning: The distribution is specified by [0.7, 1.1] and step=0.20000000000000007, but the range is not divisible by `step`. It will be replaced by [0.7, 0.9].
  warnings.warn(
C:\Users\הלל\Desktop\algo projects\trading-research-factory\walk forward engine\.venv\lib\site-packages\optuna\distributions.py:700: UserWarning: The distribution is specified by [10, 20] and step=4, but the range is not divisible by `step`. It will be replaced by [10, 18].
  warnings.warn(
[I 2026-06-01 17:24:45,561] Trial 1 finished with value: -3.153915669592564 and parameters: {'momentum_lookback': 12, 'momentum_threshold': 0.00055, 'volume_lookback': 192, 'volume_ratio_min': 0.7, 'atr_period': 14, 'vol_lookback': 48, 'vol_ratio_min': 0.6, 'max_hold_bars': 16, 'sl_atr_mult': 1.5, 'tp_atr_mult': 2.5, 'start_hour': 14, 'end_hour': 19, 'direction_mode': 'continuation', 'include_first_day': False}. Best is trial 1 with value: -3.153915669592564.
C:\Users\הלל\Desktop\algo projects\trading-research-factory\walk forward engine\.venv\lib\site-packages\optuna\distributions.py:685: UserWarning: The distribution is specified by [0.6, 1.0] and step=0.20000000000000007, but the range is not divisible by `step`. It will be replaced by [0.6, 0.8].
  warnings.warn(
C:\Users\הלל\Desktop\algo projects\trading-research-factory\walk forward engine\.venv\lib\site-packages\optuna\distributions.py:700: UserWarning: The distribution is specified by [19, 22] and step=2, but the range is not divisible by `step`. It will be replaced by [19, 21].
  warnings.warn(
[I 2026-06-01 17:24:45,595] Trial 0 finished with value: -4.759400009346623 and parameters: {'momentum_lookback': 12, 'momentum_threshold': 0.00025, 'volume_lookback': 96, 'volume_ratio_min': 0.7, 'atr_period': 10, 'vol_lookback': 96, 'vol_ratio_min': 0.6, 'max_hold_bars': 16, 'sl_atr_mult': 2.0, 'tp_atr_mult': 2.5, 'start_hour': 12, 'end_hour': 21, 'direction_mode': 'continuation', 'include_first_day': False}. Best is trial 1 with value: -3.153915669592564.
C:\Users\הלל\Desktop\algo projects\trading-research-factory\walk forward engine\.venv\lib\site-packages\optuna\distributions.py:685: UserWarning: The distribution is specified by [0.00015, 0.0006] and step=0.00010000000000000002, but the range is not divisible by `step`. It will be replaced by [0.00015, 0.00055].
  warnings.warn(
[I 2026-06-01 17:24:45,712] Trial 3 finished with value: -6.792723956862222 and parameters: {'momentum_lookback': 4, 'momentum_threshold': 0.00025, 'volume_lookback': 48, 'volume_ratio_min': 0.7, 'atr_period': 10, 'vol_lookback': 48, 'vol_ratio_min': 0.6, 'max_hold_bars': 16, 'sl_atr_mult': 2.0, 'tp_atr_mult': 3.0, 'start_hour': 13, 'end_hour': 21, 'direction_mode': 'continuation', 'include_first_day': True}. Best is trial 1 with value: -3.153915669592564.
C:\Users\הלל\Desktop\algo projects\trading-research-factory\walk forward engine\.venv\lib\site-packages\optuna\distributions.py:685: UserWarning: The distribution is specified by [0.7, 1.1] and step=0.20000000000000007, but the range is not divisible by `step`. It will be replaced by [0.7, 0.9].
  warnings.warn(
C:\Users\הלל\Desktop\algo projects\trading-research-factory\walk forward engine\.venv\lib\site-packages\optuna\distributions.py:700: UserWarning: The distribution is specified by [10, 20] and step=4, but the range is not divisible by `step`. It will be replaced by [10, 18].
  warnings.warn(
[I 2026-06-01 17:24:45,747] Trial 4 finished with value: -4.888014227132306 and parameters: {'momentum_lookback': 12, 'momentum_threshold': 0.00025, 'volume_lookback': 192, 'volume_ratio_min': 0.7, 'atr_period': 18, 'vol_lookback': 192, 'vol_ratio_min': 0.6, 'max_hold_bars': 4, 'sl_atr_mult': 1.5, 'tp_atr_mult': 3.0, 'start_hour': 14, 'end_hour': 19, 'direction_mode': 'continuation', 'include_first_day': True}. Best is trial 1 with value: -3.153915669592564.
C:\Users\הלל\Desktop\algo projects\trading-research-factory\walk forward engine\.venv\lib\site-packages\optuna\distributions.py:685: UserWarning: The distribution is specified by [0.6, 1.0] and step=0.20000000000000007, but the range is not divisible by `step`. It will be replaced by [0.6, 0.8].
  warnings.warn(
C:\Users\הלל\Desktop\algo projects\trading-research-factory\walk forward engine\.venv\lib\site-packages\optuna\distributions.py:700: UserWarning: The distribution is specified by [19, 22] and step=2, but the range is not divisible by `step`. It will be replaced by [19, 21].
  warnings.warn(
[I 2026-06-01 17:24:45,768] Trial 6 finished with value: -4.577698256534236 and parameters: {'momentum_lookback': 16, 'momentum_threshold': 0.00045, 'volume_lookback': 144, 'volume_ratio_min': 0.7, 'atr_period': 10, 'vol_lookback': 192, 'vol_ratio_min': 0.6, 'max_hold_bars': 16, 'sl_atr_mult': 2.0, 'tp_atr_mult': 1.5, 'start_hour': 13, 'end_hour': 19, 'direction_mode': 'continuation', 'include_first_day': True}. Best is trial 1 with value: -3.153915669592564.
C:\Users\הלל\Desktop\algo projects\trading-research-factory\walk forward engine\src\strategies\month_end_rebalance_eurusd.py:36: UserWarning: Converting to PeriodArray/Index representation will drop timezone information.
  month_key = index.to_period("M")
C:\Users\הלל\Desktop\algo projects\trading-research-factory\walk forward engine\src\strategies\month_end_rebalance_eurusd.py:36: UserWarning: Converting to PeriodArray/Index representation will drop timezone information.
  month_key = index.to_period("M")
C:\Users\הלל\Desktop\algo projects\trading-research-factory\walk forward engine\src\strategies\month_end_rebalance_eurusd.py:36: UserWarning: Converting to PeriodArray/Index representation will drop timezone information.
  month_key = index.to_period("M")
[I 2026-06-01 17:24:46,444] Trial 10 finished with value: -10.0 and parameters: {'momentum_lookback': 12, 'momentum_threshold': 0.00035000000000000005, 'volume_lookback': 144, 'volume_ratio_min': 0.7, 'atr_period': 10, 'vol_lookback': 48, 'vol_ratio_min': 0.6, 'max_hold_bars': 8, 'sl_atr_mult': 2.0, 'tp_atr_mult': 2.0, 'start_hour': 12, 'end_hour': 21, 'direction_mode': 'fade', 'include_first_day': True}. Best is trial 1 with value: -3.153915669592564.
[I 2026-06-01 17:24:46,596] Trial 9 finished with value: -5.577548716215982 and parameters: {'momentum_lookback': 4, 'momentum_threshold': 0.00055, 'volume_lookback': 192, 'volume_ratio_min': 0.7, 'atr_period': 14, 'vol_lookback': 96, 'vol_ratio_min': 0.6, 'max_hold_bars': 4, 'sl_atr_mult': 1.5, 'tp_atr_mult': 2.0, 'start_hour': 13, 'end_hour': 21, 'direction_mode': 'continuation', 'include_first_day': True}. Best is trial 1 with value: -3.153915669592564.
[I 2026-06-01 17:24:46,609] Trial 11 finished with value: -5.9191584074998715 and parameters: {'momentum_lookback': 8, 'momentum_threshold': 0.00025, 'volume_lookback': 48, 'volume_ratio_min': 0.7, 'atr_period': 14, 'vol_lookback': 96, 'vol_ratio_min': 0.6, 'max_hold_bars': 12, 'sl_atr_mult': 2.0, 'tp_atr_mult': 3.0, 'start_hour': 12, 'end_hour': 21, 'direction_mode': 'continuation', 'include_first_day': False}. Best is trial 1 with value: -3.153915669592564.
[I 2026-06-01 17:24:46,612] Trial 8 finished with value: -4.615489380995634 and parameters: {'momentum_lookback': 12, 'momentum_threshold': 0.00045, 'volume_lookback': 144, 'volume_ratio_min': 0.7, 'atr_period': 18, 'vol_lookback': 48, 'vol_ratio_min': 0.6, 'max_hold_bars': 16, 'sl_atr_mult': 2.0, 'tp_atr_mult': 2.0, 'start_hour': 12, 'end_hour': 21, 'direction_mode': 'continuation', 'include_first_day': False}. Best is trial 1 with value: -3.153915669592564.
C:\Users\הלל\Desktop\algo projects\trading-research-factory\walk forward engine\src\strategies\month_end_rebalance_eurusd.py:36: UserWarning: Converting to PeriodArray/Index representation will drop timezone information.
  month_key = index.to_period("M")
C:\Users\הלל\Desktop\algo projects\trading-research-factory\walk forward engine\src\strategies\month_end_rebalance_eurusd.py:36: UserWarning: Converting to PeriodArray/Index representation will drop timezone information.
  month_key = index.to_period("M")
C:\Users\הלל\Desktop\algo projects\trading-research-factory\walk forward engine\.venv\lib\site-packages\optuna\samplers\_tpe\sampler.py:319: ExperimentalWarning: ``multivariate`` option is an experimental feature. The interface can change in the future.
  warnings.warn(
[I 2026-06-01 17:24:46,960] A new study created in memory with name: no-name-a9b824db-031d-4077-9120-2acd6709beaa
C:\Users\הלל\Desktop\algo projects\trading-research-factory\walk forward engine\.venv\lib\site-packages\optuna\distributions.py:685: UserWarning: The distribution is specified by [0.00015, 0.0006] and step=0.00010000000000000002, but the range is not divisible by `step`. It will be replaced by [0.00015, 0.00055].
  warnings.warn(
C:\Users\הלל\Desktop\algo projects\trading-research-factory\walk forward engine\.venv\lib\site-packages\optuna\distributions.py:685: UserWarning: The distribution is specified by [0.7, 1.1] and step=0.20000000000000007, but the range is not divisible by `step`. It will be replaced by [0.7, 0.9].
  warnings.warn(
C:\Users\הלל\Desktop\algo projects\trading-research-factory\walk forward engine\.venv\lib\site-packages\optuna\distributions.py:700: UserWarning: The distribution is specified by [10, 20] and step=4, but the range is not divisible by `step`. It will be replaced by [10, 18].
  warnings.warn(
C:\Users\הלל\Desktop\algo projects\trading-research-factory\walk forward engine\.venv\lib\site-packages\optuna\distributions.py:685: UserWarning: The distribution is specified by [0.6, 1.0] and step=0.20000000000000007, but the range is not divisible by `step`. It will be replaced by [0.6, 0.8].
  warnings.warn(
C:\Users\הלל\Desktop\algo projects\trading-research-factory\walk forward engine\.venv\lib\site-packages\optuna\distributions.py:700: UserWarning: The distribution is specified by [19, 22] and step=2, but the range is not divisible by `step`. It will be replaced by [19, 21].
  warnings.warn(
C:\Users\הלל\Desktop\algo projects\trading-research-factory\walk forward engine\.venv\lib\site-packages\optuna\distributions.py:700: UserWarning: The distribution is specified by [19, 22] and step=2, but the range is not divisible by `step`. It will be replaced by [19, 21].
  warnings.warn(
C:\Users\הלל\Desktop\algo projects\trading-research-factory\walk forward engine\src\strategies\month_end_rebalance_eurusd.py:36: UserWarning: Converting to PeriodArray/Index representation will drop timezone information.
  month_key = index.to_period("M")
C:\Users\הלל\Desktop\algo projects\trading-research-factory\walk forward engine\src\strategies\month_end_rebalance_eurusd.py:36: UserWarning: Converting to PeriodArray/Index representation will drop timezone information.
  month_key = index.to_period("M")
C:\Users\הלל\Desktop\algo projects\trading-research-factory\walk forward engine\src\strategies\month_end_rebalance_eurusd.py:36: UserWarning: Converting to PeriodArray/Index representation will drop timezone information.
  month_key = index.to_period("M")
C:\Users\הלל\Desktop\algo projects\trading-research-factory\walk forward engine\src\strategies\month_end_rebalance_eurusd.py:36: UserWarning: Converting to PeriodArray/Index representation will drop timezone information.
  month_key = index.to_period("M")
C:\Users\הלל\Desktop\algo projects\trading-research-factory\walk forward engine\src\strategies\month_end_rebalance_eurusd.py:36: UserWarning: Converting to PeriodArray/Index representation will drop timezone information.
  month_key = index.to_period("M")
C:\Users\הלל\Desktop\algo projects\trading-research-factory\walk forward engine\src\strategies\month_end_rebalance_eurusd.py:36: UserWarning: Converting to PeriodArray/Index representation will drop timezone information.
  month_key = index.to_period("M")
C:\Users\הלל\Desktop\algo projects\trading-research-factory\walk forward engine\src\strategies\month_end_rebalance_eurusd.py:36: UserWarning: Converting to PeriodArray/Index representation will drop timezone information.
  month_key = index.to_period("M")
[I 2026-06-01 17:24:48,329] Trial 0 finished with value: -10.0 and parameters: {'momentum_lookback': 4, 'momentum_threshold': 0.00035000000000000005, 'volume_lookback': 48, 'volume_ratio_min': 0.7, 'atr_period': 10, 'vol_lookback': 192, 'vol_ratio_min': 0.6, 'max_hold_bars': 8, 'sl_atr_mult': 1.0, 'tp_atr_mult': 2.5, 'start_hour': 13, 'end_hour': 19, 'direction_mode': 'fade', 'include_first_day': False}. Best is trial 0 with value: -10.0.
[I 2026-06-01 17:24:48,338] Trial 7 finished with value: -10.0 and parameters: {'momentum_lookback': 4, 'momentum_threshold': 0.00025, 'volume_lookback': 48, 'volume_ratio_min': 0.7, 'atr_period': 14, 'vol_lookback': 192, 'vol_ratio_min': 0.6, 'max_hold_bars': 8, 'sl_atr_mult': 2.0, 'tp_atr_mult': 3.0, 'start_hour': 14, 'end_hour': 19, 'direction_mode': 'fade', 'include_first_day': True}. Best is trial 0 with value: -10.0.
C:\Users\הלל\Desktop\algo projects\trading-research-factory\walk forward engine\.venv\lib\site-packages\optuna\distributions.py:685: UserWarning: The distribution is specified by [0.00015, 0.0006] and step=0.00010000000000000002, but the range is not divisible by `step`. It will be replaced by [0.00015, 0.00055].
  warnings.warn(
C:\Users\הלל\Desktop\algo projects\trading-research-factory\walk forward engine\.venv\lib\site-packages\optuna\distributions.py:685: UserWarning: The distribution is specified by [0.7, 1.1] and step=0.20000000000000007, but the range is not divisible by `step`. It will be replaced by [0.7, 0.9].
  warnings.warn(
C:\Users\הלל\Desktop\algo projects\trading-research-factory\walk forward engine\.venv\lib\site-packages\optuna\distributions.py:700: UserWarning: The distribution is specified by [10, 20] and step=4, but the range is not divisible by `step`. It will be replaced by [10, 18].
  warnings.warn(
C:\Users\הלל\Desktop\algo projects\trading-research-factory\walk forward engine\.venv\lib\site-packages\optuna\distributions.py:685: UserWarning: The distribution is specified by [0.6, 1.0] and step=0.20000000000000007, but the range is not divisible by `step`. It will be replaced by [0.6, 0.8].
  warnings.warn(
