[I 2026-05-29 01:53:24,714] Trial 23 finished with value: -10.0 and parameters: {'sweep_pips': 50.0, 'reentry_pips': 0.0, 'stop_buffer_pips': 40.0, 'tp_mode': 'mid', 'min_range_pips': 120.0, 'max_range_pips': 350.0, 'min_daily_atr': 0}. Best is trial 0 with value: -10.0.
C:\Users\הלל\Desktop\algo projects\trading-research-factory\walk forward engine\.venv\lib\site-packages\optuna\distributions.py:700: UserWarning: The distribution is specified by [0, 500] and step=300, but the range is not divisible by `step`. It will be replaced by [0, 300].
  warnings.warn(
C:\Users\הלל\Desktop\algo projects\trading-research-factory\walk forward engine\.venv\lib\site-packages\optuna\distributions.py:700: UserWarning: The distribution is specified by [0, 500] and step=300, but the range is not divisible by `step`. It will be replaced by [0, 300].
  warnings.warn(
[I 2026-05-29 01:53:25,100] Trial 24 finished with value: -10.0 and parameters: {'sweep_pips': 40.0, 'reentry_pips': 0.0, 'stop_buffer_pips': 40.0, 'tp_mode': 'mid', 'min_range_pips': 120.0, 'max_range_pips': 350.0, 'min_daily_atr': 0}. Best is trial 0 with value: -10.0.
[I 2026-05-29 01:53:25,309] Trial 25 finished with value: -10.0 and parameters: {'sweep_pips': 30.0, 'reentry_pips': 0.0, 'stop_buffer_pips': 40.0, 'tp_mode': 'mid', 'min_range_pips': 120.0, 'max_range_pips': 350.0, 'min_daily_atr': 0}. Best is trial 0 with value: -10.0.
[I 2026-05-29 01:53:25,408] Trial 28 finished with value: -10.0 and parameters: {'sweep_pips': 40.0, 'reentry_pips': 0.0, 'stop_buffer_pips': 30.0, 'tp_mode': 'mid', 'min_range_pips': 80.0, 'max_range_pips': 350.0, 'min_daily_atr': 0}. Best is trial 0 with value: -10.0.
[I 2026-05-29 01:53:25,473] Trial 26 finished with value: -10.0 and parameters: {'sweep_pips': 40.0, 'reentry_pips': 0.0, 'stop_buffer_pips': 30.0, 'tp_mode': 'mid', 'min_range_pips': 80.0, 'max_range_pips': 250.0, 'min_daily_atr': 0}. Best is trial 0 with value: -10.0.
[I 2026-05-29 01:53:25,713] Trial 27 finished with value: -10.0 and parameters: {'sweep_pips': 30.0, 'reentry_pips': 0.0, 'stop_buffer_pips': 30.0, 'tp_mode': 'mid', 'min_range_pips': 80.0, 'max_range_pips': 350.0, 'min_daily_atr': 0}. Best is trial 0 with value: -10.0.
[I 2026-05-29 01:53:25,717] Trial 29 finished with value: -10.0 and parameters: {'sweep_pips': 40.0, 'reentry_pips': 0.0, 'stop_buffer_pips': 30.0, 'tp_mode': 'mid', 'min_range_pips': 80.0, 'max_range_pips': 250.0, 'min_daily_atr': 0}. Best is trial 0 with value: -10.0.
C:\Users\הלל\Desktop\algo projects\trading-research-factory\walk forward engine\.venv\lib\site-packages\optuna\samplers\_tpe\sampler.py:319: ExperimentalWarning: ``multivariate`` option is an experimental feature. The interface can change in the future.
  warnings.warn(
[I 2026-05-29 01:53:25,992] A new study created in memory with name: no-name-4b8d6e94-48a3-492a-bc72-af809390011f
C:\Users\הלל\Desktop\algo projects\trading-research-factory\walk forward engine\.venv\lib\site-packages\optuna\distributions.py:700: UserWarning: The distribution is specified by [0, 500] and step=300, but the range is not divisible by `step`. It will be replaced by [0, 300].
  warnings.warn(
C:\Users\הלל\Desktop\algo projects\trading-research-factory\walk forward engine\.venv\lib\site-packages\optuna\distributions.py:700: UserWarning: The distribution is specified by [0, 500] and step=300, but the range is not divisible by `step`. It will be replaced by [0, 300].
  warnings.warn(
C:\Users\הלל\Desktop\algo projects\trading-research-factory\walk forward engine\.venv\lib\site-packages\optuna\distributions.py:700: UserWarning: The distribution is specified by [0, 500] and step=300, but the range is not divisible by `step`. It will be replaced by [0, 300].
  warnings.warn(
[I 2026-05-29 01:53:26,891] Trial 0 finished with value: -10.0 and parameters: {'sweep_pips': 40.0, 'reentry_pips': 20.0, 'stop_buffer_pips': 30.0, 'tp_mode': 'mid', 'min_range_pips': 80.0, 'max_range_pips': 350.0, 'min_daily_atr': 0}. Best is trial 0 with value: -10.0.
C:\Users\הלל\Desktop\algo projects\trading-research-factory\walk forward engine\.venv\lib\site-packages\optuna\distributions.py:700: UserWarning: The distribution is specified by [0, 500] and step=300, but the range is not divisible by `step`. It will be replaced by [0, 300].
  warnings.warn(
[I 2026-05-29 01:53:27,067] Trial 3 finished with value: -10.0 and parameters: {'sweep_pips': 40.0, 'reentry_pips': 20.0, 'stop_buffer_pips': 30.0, 'tp_mode': 'mid', 'min_range_pips': 80.0, 'max_range_pips': 300.0, 'min_daily_atr': 300}. Best is trial 0 with value: -10.0.
C:\Users\הלל\Desktop\algo projects\trading-research-factory\walk forward engine\.venv\lib\site-packages\optuna\distributions.py:700: UserWarning: The distribution is specified by [0, 500] and step=300, but the range is not divisible by `step`. It will be replaced by [0, 300].
  warnings.warn(
[I 2026-05-29 01:53:27,183] Trial 4 finished with value: -10.0 and parameters: {'sweep_pips': 40.0, 'reentry_pips': 10.0, 'stop_buffer_pips': 40.0, 'tp_mode': 'mid', 'min_range_pips': 80.0, 'max_range_pips': 300.0, 'min_daily_atr': 0}. Best is trial 0 with value: -10.0.
[I 2026-05-29 01:53:27,195] Trial 6 finished with value: -10.0 and parameters: {'sweep_pips': 30.0, 'reentry_pips': 20.0, 'stop_buffer_pips': 30.0, 'tp_mode': 'opposite', 'min_range_pips': 120.0, 'max_range_pips': 250.0, 'min_daily_atr': 0}. Best is trial 0 with value: -10.0.
[I 2026-05-29 01:53:27,198] Trial 1 finished with value: -10.0 and parameters: {'sweep_pips': 30.0, 'reentry_pips': 10.0, 'stop_buffer_pips': 20.0, 'tp_mode': 'mid', 'min_range_pips': 80.0, 'max_range_pips': 300.0, 'min_daily_atr': 0}. Best is trial 0 with value: -10.0.
[I 2026-05-29 01:53:27,203] Trial 2 finished with value: -10.0 and parameters: {'sweep_pips': 30.0, 'reentry_pips': 0.0, 'stop_buffer_pips': 30.0, 'tp_mode': 'opposite', 'min_range_pips': 80.0, 'max_range_pips': 350.0, 'min_daily_atr': 0}. Best is trial 0 with value: -10.0.
[I 2026-05-29 01:53:27,231] Trial 5 finished with value: -10.0 and parameters: {'sweep_pips': 30.0, 'reentry_pips': 20.0, 'stop_buffer_pips': 30.0, 'tp_mode': 'opposite', 'min_range_pips': 100.0, 'max_range_pips': 350.0, 'min_daily_atr': 0}. Best is trial 0 with value: -10.0.
[I 2026-05-29 01:53:27,242] Trial 7 finished with value: -10.0 and parameters: {'sweep_pips': 40.0, 'reentry_pips': 10.0, 'stop_buffer_pips': 40.0, 'tp_mode': 'mid', 'min_range_pips': 100.0, 'max_range_pips': 250.0, 'min_daily_atr': 300}. Best is trial 0 with value: -10.0.
C:\Users\הלל\Desktop\algo projects\trading-research-factory\walk forward engine\.venv\lib\site-packages\optuna\distributions.py:700: UserWarning: The distribution is specified by [0, 500] and step=300, but the range is not divisible by `step`. It will be replaced by [0, 300].
  warnings.warn(
C:\Users\הלל\Desktop\algo projects\trading-research-factory\walk forward engine\.venv\lib\site-packages\optuna\distributions.py:700: UserWarning: The distribution is specified by [0, 500] and step=300, but the range is not divisible by `step`. It will be replaced by [0, 300].
  warnings.warn(
C:\Users\הלל\Desktop\algo projects\trading-research-factory\walk forward engine\.venv\lib\site-packages\optuna\distributions.py:700: UserWarning: The distribution is specified by [0, 500] and step=300, but the range is not divisible by `step`. It will be replaced by [0, 300].
  warnings.warn(
C:\Users\הלל\Desktop\algo projects\trading-research-factory\walk forward engine\.venv\lib\site-packages\optuna\distributions.py:700: UserWarning: The distribution is specified by [0, 500] and step=300, but the range is not divisible by `step`. It will be replaced by [0, 300].
  warnings.warn(
[I 2026-05-29 01:53:27,870] Trial 8 finished with value: -10.0 and parameters: {'sweep_pips': 50.0, 'reentry_pips': 0.0, 'stop_buffer_pips': 30.0, 'tp_mode': 'mid', 'min_range_pips': 100.0, 'max_range_pips': 350.0, 'min_daily_atr': 300}. Best is trial 0 with value: -10.0.
C:\Users\הלל\Desktop\algo projects\trading-research-factory\walk forward engine\.venv\lib\site-packages\optuna\distributions.py:700: UserWarning: The distribution is specified by [0, 500] and step=300, but the range is not divisible by `step`. It will be replaced by [0, 300].
  warnings.warn(
[I 2026-05-29 01:53:28,211] Trial 13 finished with value: -10.0 and parameters: {'sweep_pips': 30.0, 'reentry_pips': 20.0, 'stop_buffer_pips': 20.0, 'tp_mode': 'opposite', 'min_range_pips': 120.0, 'max_range_pips': 300.0, 'min_daily_atr': 0}. Best is trial 0 with value: -10.0.
[I 2026-05-29 01:53:28,232] Trial 9 finished with value: -10.0 and parameters: {'sweep_pips': 40.0, 'reentry_pips': 20.0, 'stop_buffer_pips': 30.0, 'tp_mode': 'opposite', 'min_range_pips': 100.0, 'max_range_pips': 300.0, 'min_daily_atr': 300}. Best is trial 0 with value: -10.0.
[I 2026-05-29 01:53:28,261] Trial 12 finished with value: -10.0 and parameters: {'sweep_pips': 20.0, 'reentry_pips': 0.0, 'stop_buffer_pips': 20.0, 'tp_mode': 'opposite', 'min_range_pips': 80.0, 'max_range_pips': 350.0, 'min_daily_atr': 0}. Best is trial 0 with value: -10.0.
[I 2026-05-29 01:53:28,266] Trial 11 finished with value: -10.0 and parameters: {'sweep_pips': 50.0, 'reentry_pips': 0.0, 'stop_buffer_pips': 20.0, 'tp_mode': 'opposite', 'min_range_pips': 120.0, 'max_range_pips': 300.0, 'min_daily_atr': 0}. Best is trial 0 with value: -10.0.
[I 2026-05-29 01:53:28,291] Trial 14 finished with value: -10.0 and parameters: {'sweep_pips': 50.0, 'reentry_pips': 20.0, 'stop_buffer_pips': 30.0, 'tp_mode': 'opposite', 'min_range_pips': 80.0, 'max_range_pips': 250.0, 'min_daily_atr': 0}. Best is trial 0 with value: -10.0.
[I 2026-05-29 01:53:28,389] Trial 15 finished with value: -10.0 and parameters: {'sweep_pips': 30.0, 'reentry_pips': 0.0, 'stop_buffer_pips': 20.0, 'tp_mode': 'mid', 'min_range_pips': 100.0, 'max_range_pips': 350.0, 'min_daily_atr': 0}. Best is trial 0 with value: -10.0.
C:\Users\הלל\Desktop\algo projects\trading-research-factory\walk forward engine\.venv\lib\site-packages\optuna\distributions.py:700: UserWarning: The distribution is specified by [0, 500] and step=300, but the range is not divisible by `step`. It will be replaced by [0, 300].
  warnings.warn(
[I 2026-05-29 01:53:28,426] Trial 10 finished with value: -10.0 and parameters: {'sweep_pips': 40.0, 'reentry_pips': 20.0, 'stop_buffer_pips': 30.0, 'tp_mode': 'opposite', 'min_range_pips': 120.0, 'max_range_pips': 300.0, 'min_daily_atr': 300}. Best is trial 0 with value: -10.0.
C:\Users\הלל\Desktop\algo projects\trading-research-factory\walk forward engine\.venv\lib\site-packages\optuna\distributions.py:700: UserWarning: The distribution is specified by [0, 500] and step=300, but the range is not divisible by `step`. It will be replaced by [0, 300].
  warnings.warn(
C:\Users\הלל\Desktop\algo projects\trading-research-factory\walk forward engine\.venv\lib\site-packages\optuna\distributions.py:700: UserWarning: The distribution is specified by [0, 500] and step=300, but the range is not divisible by `step`. It will be replaced by [0, 300].
  warnings.warn(
C:\Users\הלל\Desktop\algo projects\trading-research-factory\walk forward engine\.venv\lib\site-packages\optuna\distributions.py:700: UserWarning: The distribution is specified by [0, 500] and step=300, but the range is not divisible by `step`. It will be replaced by [0, 300].
  warnings.warn(
C:\Users\הלל\Desktop\algo projects\trading-research-factory\walk forward engine\.venv\lib\site-packages\optuna\distributions.py:700: UserWarning: The distribution is specified by [0, 500] and step=300, but the range is not divisible by `step`. It will be replaced by [0, 300].
  warnings.warn(
C:\Users\הלל\Desktop\algo projects\trading-research-factory\walk forward engine\.venv\lib\site-packages\optuna\distributions.py:700: UserWarning: The distribution is specified by [0, 500] and step=300, but the range is not divisible by `step`. It will be replaced by [0, 300].
  warnings.warn(
[I 2026-05-29 01:53:29,137] Trial 16 finished with value: -10.0 and parameters: {'sweep_pips': 50.0, 'reentry_pips': 10.0, 'stop_buffer_pips': 30.0, 'tp_mode': 'opposite', 'min_range_pips': 100.0, 'max_range_pips': 250.0, 'min_daily_atr': 300}. Best is trial 0 with value: -10.0.
C:\Users\הלל\Desktop\algo projects\trading-research-factory\walk forward engine\.venv\lib\site-packages\optuna\distributions.py:700: UserWarning: The distribution is specified by [0, 500] and step=300, but the range is not divisible by `step`. It will be replaced by [0, 300].
  warnings.warn(
[I 2026-05-29 01:53:29,814] Trial 18 finished with value: -10.0 and parameters: {'sweep_pips': 50.0, 'reentry_pips': 20.0, 'stop_buffer_pips': 30.0, 'tp_mode': 'mid', 'min_range_pips': 80.0, 'max_range_pips': 350.0, 'min_daily_atr': 0}. Best is trial 0 with value: -10.0.
[I 2026-05-29 01:53:29,830] Trial 17 finished with value: -10.0 and parameters: {'sweep_pips': 40.0, 'reentry_pips': 20.0, 'stop_buffer_pips': 20.0, 'tp_mode': 'mid', 'min_range_pips': 80.0, 'max_range_pips': 350.0, 'min_daily_atr': 0}. Best is trial 0 with value: -10.0.
[I 2026-05-29 01:53:29,961] Trial 20 finished with value: -10.0 and parameters: {'sweep_pips': 30.0, 'reentry_pips': 10.0, 'stop_buffer_pips': 20.0, 'tp_mode': 'mid', 'min_range_pips': 80.0, 'max_range_pips': 300.0, 'min_daily_atr': 0}. Best is trial 0 with value: -10.0.
[I 2026-05-29 01:53:30,035] Trial 23 finished with value: -10.0 and parameters: {'sweep_pips': 30.0, 'reentry_pips': 20.0, 'stop_buffer_pips': 20.0, 'tp_mode': 'mid', 'min_range_pips': 80.0, 'max_range_pips': 300.0, 'min_daily_atr': 0}. Best is trial 0 with value: -10.0.
[I 2026-05-29 01:53:30,063] Trial 22 finished with value: -10.0 and parameters: {'sweep_pips': 50.0, 'reentry_pips': 20.0, 'stop_buffer_pips': 30.0, 'tp_mode': 'mid', 'min_range_pips': 80.0, 'max_range_pips': 350.0, 'min_daily_atr': 0}. Best is trial 0 with value: -10.0.
[I 2026-05-29 01:53:30,069] Trial 19 finished with value: -10.0 and parameters: {'sweep_pips': 40.0, 'reentry_pips': 20.0, 'stop_buffer_pips': 20.0, 'tp_mode': 'mid', 'min_range_pips': 80.0, 'max_range_pips': 350.0, 'min_daily_atr': 0}. Best is trial 0 with value: -10.0.
[I 2026-05-29 01:53:30,136] Trial 21 finished with value: -10.0 and parameters: {'sweep_pips': 40.0, 'reentry_pips': 20.0, 'stop_buffer_pips': 20.0, 'tp_mode': 'mid', 'min_range_pips': 80.0, 'max_range_pips': 350.0, 'min_daily_atr': 0}. Best is trial 0 with value: -10.0.
C:\Users\הלל\Desktop\algo projects\trading-research-factory\walk forward engine\.venv\lib\site-packages\optuna\distributions.py:700: UserWarning: The distribution is specified by [0, 500] and step=300, but the range is not divisible by `step`. It will be replaced by [0, 300].
  warnings.warn(
C:\Users\הלל\Desktop\algo projects\trading-research-factory\walk forward engine\.venv\lib\site-packages\optuna\distributions.py:700: UserWarning: The distribution is specified by [0, 500] and step=300, but the range is not divisible by `step`. It will be replaced by [0, 300].
  warnings.warn(
[I 2026-05-29 01:53:30,555] Trial 24 finished with value: -10.0 and parameters: {'sweep_pips': 40.0, 'reentry_pips': 20.0, 'stop_buffer_pips': 20.0, 'tp_mode': 'mid', 'min_range_pips': 80.0, 'max_range_pips': 350.0, 'min_daily_atr': 0}. Best is trial 0 with value: -10.0.
C:\Users\הלל\Desktop\algo projects\trading-research-factory\walk forward engine\.venv\lib\site-packages\optuna\distributions.py:700: UserWarning: The distribution is specified by [0, 500] and step=300, but the range is not divisible by `step`. It will be replaced by [0, 300].
  warnings.warn(
[I 2026-05-29 01:53:31,014] Trial 25 finished with value: -10.0 and parameters: {'sweep_pips': 30.0, 'reentry_pips': 10.0, 'stop_buffer_pips': 20.0, 'tp_mode': 'mid', 'min_range_pips': 100.0, 'max_range_pips': 250.0, 'min_daily_atr': 0}. Best is trial 0 with value: -10.0.
[I 2026-05-29 01:53:31,093] Trial 26 finished with value: -10.0 and parameters: {'sweep_pips': 20.0, 'reentry_pips': 10.0, 'stop_buffer_pips': 20.0, 'tp_mode': 'mid', 'min_range_pips': 80.0, 'max_range_pips': 300.0, 'min_daily_atr': 0}. Best is trial 0 with value: -10.0.
[I 2026-05-29 01:53:31,094] Trial 27 finished with value: -10.0 and parameters: {'sweep_pips': 40.0, 'reentry_pips': 10.0, 'stop_buffer_pips': 20.0, 'tp_mode': 'mid', 'min_range_pips': 100.0, 'max_range_pips': 250.0, 'min_daily_atr': 0}. Best is trial 0 with value: -10.0.
[I 2026-05-29 01:53:31,098] Trial 28 finished with value: -10.0 and parameters: {'sweep_pips': 40.0, 'reentry_pips': 0.0, 'stop_buffer_pips': 30.0, 'tp_mode': 'opposite', 'min_range_pips': 80.0, 'max_range_pips': 350.0, 'min_daily_atr': 0}. Best is trial 0 with value: -10.0.
[I 2026-05-29 01:53:31,185] Trial 29 finished with value: -10.0 and parameters: {'sweep_pips': 30.0, 'reentry_pips': 0.0, 'stop_buffer_pips': 30.0, 'tp_mode': 'opposite', 'min_range_pips': 80.0, 'max_range_pips': 350.0, 'min_daily_atr': 300}. Best is trial 0 with value: -10.0.
C:\Users\הלל\Desktop\algo projects\trading-research-factory\walk forward engine\.venv\lib\site-packages\optuna\samplers\_tpe\sampler.py:319: ExperimentalWarning: ``multivariate`` option is an experimental feature. The interface can change in the future.
  warnings.warn(
[I 2026-05-29 01:53:31,484] A new study created in memory with name: no-name-798a1e4f-4d38-4f39-bbeb-5e7918768ed7
C:\Users\הלל\Desktop\algo projects\trading-research-factory\walk forward engine\.venv\lib\site-packages\optuna\distributions.py:700: UserWarning: The distribution is specified by [0, 500] and step=300, but the range is not divisible by `step`. It will be replaced by [0, 300].
  warnings.warn(
C:\Users\הלל\Desktop\algo projects\trading-research-factory\walk forward engine\.venv\lib\site-packages\optuna\distributions.py:700: UserWarning: The distribution is specified by [0, 500] and step=300, but the range is not divisible by `step`. It will be replaced by [0, 300].
  warnings.warn(
C:\Users\הלל\Desktop\algo projects\trading-research-factory\walk forward engine\.venv\lib\site-packages\optuna\distributions.py:700: UserWarning: The distribution is specified by [0, 500] and step=300, but the range is not divisible by `step`. It will be replaced by [0, 300].
  warnings.warn(
[I 2026-05-29 01:53:32,682] Trial 2 finished with value: -10.0 and parameters: {'sweep_pips': 30.0, 'reentry_pips': 20.0, 'stop_buffer_pips': 40.0, 'tp_mode': 'mid', 'min_range_pips': 100.0, 'max_range_pips': 350.0, 'min_daily_atr': 0}. Best is trial 2 with value: -10.0.
[I 2026-05-29 01:53:32,683] Trial 1 finished with value: -10.0 and parameters: {'sweep_pips': 20.0, 'reentry_pips': 20.0, 'stop_buffer_pips': 40.0, 'tp_mode': 'opposite', 'min_range_pips': 100.0, 'max_range_pips': 350.0, 'min_daily_atr': 300}. Best is trial 2 with value: -10.0.
C:\Users\הלל\Desktop\algo projects\trading-research-factory\walk forward engine\.venv\lib\site-packages\optuna\distributions.py:700: UserWarning: The distribution is specified by [0, 500] and step=300, but the range is not divisible by `step`. It will be replaced by [0, 300].
  warnings.warn(
[I 2026-05-29 01:53:32,805] Trial 5 finished with value: -10.0 and parameters: {'sweep_pips': 50.0, 'reentry_pips': 20.0, 'stop_buffer_pips': 40.0, 'tp_mode': 'opposite', 'min_range_pips': 120.0, 'max_range_pips': 250.0, 'min_daily_atr': 300}. Best is trial 2 with value: -10.0.
[I 2026-05-29 01:53:32,810] Trial 0 finished with value: -10.0 and parameters: {'sweep_pips': 30.0, 'reentry_pips': 0.0, 'stop_buffer_pips': 40.0, 'tp_mode': 'mid', 'min_range_pips': 120.0, 'max_range_pips': 300.0, 'min_daily_atr': 300}. Best is trial 2 with value: -10.0.
[I 2026-05-29 01:53:32,811] Trial 7 finished with value: -10.0 and parameters: {'sweep_pips': 50.0, 'reentry_pips': 0.0, 'stop_buffer_pips': 20.0, 'tp_mode': 'mid', 'min_range_pips': 80.0, 'max_range_pips': 300.0, 'min_daily_atr': 0}. Best is trial 2 with value: -10.0.
[I 2026-05-29 01:53:32,818] Trial 4 finished with value: -10.0 and parameters: {'sweep_pips': 30.0, 'reentry_pips': 10.0, 'stop_buffer_pips': 40.0, 'tp_mode': 'mid', 'min_range_pips': 80.0, 'max_range_pips': 350.0, 'min_daily_atr': 0}. Best is trial 2 with value: -10.0.
[I 2026-05-29 01:53:32,869] Trial 6 finished with value: -10.0 and parameters: {'sweep_pips': 50.0, 'reentry_pips': 20.0, 'stop_buffer_pips': 20.0, 'tp_mode': 'mid', 'min_range_pips': 120.0, 'max_range_pips': 250.0, 'min_daily_atr': 0}. Best is trial 2 with value: -10.0.
[I 2026-05-29 01:53:32,874] Trial 3 finished with value: -10.0 and parameters: {'sweep_pips': 50.0, 'reentry_pips': 10.0, 'stop_buffer_pips': 20.0, 'tp_mode': 'mid', 'min_range_pips': 120.0, 'max_range_pips': 250.0, 'min_daily_atr': 300}. Best is trial 2 with value: -10.0.
C:\Users\הלל\Desktop\algo projects\trading-research-factory\walk forward engine\.venv\lib\site-packages\optuna\distributions.py:700: UserWarning: The distribution is specified by [0, 500] and step=300, but the range is not divisible by `step`. It will be replaced by [0, 300].
  warnings.warn(
C:\Users\הלל\Desktop\algo projects\trading-research-factory\walk forward engine\.venv\lib\site-packages\optuna\distributions.py:700: UserWarning: The distribution is specified by [0, 500] and step=300, but the range is not divisible by `step`. It will be replaced by [0, 300].
  warnings.warn(
C:\Users\הלל\Desktop\algo projects\trading-research-factory\walk forward engine\.venv\lib\site-packages\optuna\distributions.py:700: UserWarning: The distribution is specified by [0, 500] and step=300, but the range is not divisible by `step`. It will be replaced by [0, 300].
  warnings.warn(
[I 2026-05-29 01:53:33,537] Trial 8 finished with value: -10.0 and parameters: {'sweep_pips': 20.0, 'reentry_pips': 20.0, 'stop_buffer_pips': 20.0, 'tp_mode': 'mid', 'min_range_pips': 120.0, 'max_range_pips': 250.0, 'min_daily_atr': 0}. Best is trial 2 with value: -10.0.
