2026-05-29 01:52:04,850 - HighSpeedSmokeTest - [INFO] - 🚀 HIGH-SPEED SMOKE TEST STARTING
2026-05-29 01:52:04,851 - HighSpeedSmokeTest - [INFO] - ================================================================================
2026-05-29 01:52:04,851 - HighSpeedSmokeTest - [INFO] - CONFIGURABLE WALK-FORWARD ANALYSIS TEST RUNNER
2026-05-29 01:52:04,851 - HighSpeedSmokeTest - [INFO] - ================================================================================
2026-05-29 01:52:04,851 - HighSpeedSmokeTest - [INFO] - Start time: 2026-05-29 01:52:04.851079
2026-05-29 01:52:04,851 - HighSpeedSmokeTest - [INFO] - ================================================================================
2026-05-29 01:52:04,883 - HighSpeedSmokeTest - [INFO] - [01:52:04.883] === SMOKE TEST CHECKPOINT: CONFIGURABLE TEST RUNNER INITIALIZATION ===
C:\Users\הלל\Desktop\algo projects\trading-research-factory\walk forward engine\.venv\lib\site-packages\optuna\samplers\_tpe\sampler.py:319: ExperimentalWarning: ``multivariate`` option is an experimental feature. The interface can change in the future.
  warnings.warn(
[I 2026-05-29 01:52:33,312] A new study created in memory with name: no-name-51ec6cac-b37b-49aa-b1c3-83d5d32f2dd8
C:\Users\הלל\Desktop\algo projects\trading-research-factory\walk forward engine\.venv\lib\site-packages\optuna\distributions.py:700: UserWarning: The distribution is specified by [0, 500] and step=300, but the range is not divisible by `step`. It will be replaced by [0, 300].
  warnings.warn(
C:\Users\הלל\Desktop\algo projects\trading-research-factory\walk forward engine\.venv\lib\site-packages\optuna\distributions.py:700: UserWarning: The distribution is specified by [0, 500] and step=300, but the range is not divisible by `step`. It will be replaced by [0, 300].
  warnings.warn(
C:\Users\הלל\Desktop\algo projects\trading-research-factory\walk forward engine\.venv\lib\site-packages\optuna\distributions.py:700: UserWarning: The distribution is specified by [0, 500] and step=300, but the range is not divisible by `step`. It will be replaced by [0, 300].
  warnings.warn(
C:\Users\הלל\Desktop\algo projects\trading-research-factory\walk forward engine\.venv\lib\site-packages\optuna\distributions.py:700: UserWarning: The distribution is specified by [0, 500] and step=300, but the range is not divisible by `step`. It will be replaced by [0, 300].
  warnings.warn(
C:\Users\הלל\Desktop\algo projects\trading-research-factory\walk forward engine\.venv\lib\site-packages\optuna\distributions.py:700: UserWarning: The distribution is specified by [0, 500] and step=300, but the range is not divisible by `step`. It will be replaced by [0, 300].
  warnings.warn(
C:\Users\הלל\Desktop\algo projects\trading-research-factory\walk forward engine\.venv\lib\site-packages\optuna\distributions.py:700: UserWarning: The distribution is specified by [0, 500] and step=300, but the range is not divisible by `step`. It will be replaced by [0, 300].
  warnings.warn(
[I 2026-05-29 01:52:50,075] Trial 5 finished with value: -10.0 and parameters: {'sweep_pips': 50.0, 'reentry_pips': 20.0, 'stop_buffer_pips': 40.0, 'tp_mode': 'opposite', 'min_range_pips': 80.0, 'max_range_pips': 300.0, 'min_daily_atr': 0}. Best is trial 5 with value: -10.0.
[I 2026-05-29 01:52:50,076] Trial 6 finished with value: -10.0 and parameters: {'sweep_pips': 50.0, 'reentry_pips': 10.0, 'stop_buffer_pips': 40.0, 'tp_mode': 'mid', 'min_range_pips': 100.0, 'max_range_pips': 350.0, 'min_daily_atr': 300}. Best is trial 5 with value: -10.0.
[I 2026-05-29 01:52:50,077] Trial 2 finished with value: -10.0 and parameters: {'sweep_pips': 40.0, 'reentry_pips': 20.0, 'stop_buffer_pips': 40.0, 'tp_mode': 'opposite', 'min_range_pips': 120.0, 'max_range_pips': 300.0, 'min_daily_atr': 0}. Best is trial 5 with value: -10.0.
[I 2026-05-29 01:52:50,083] Trial 1 finished with value: -10.0 and parameters: {'sweep_pips': 40.0, 'reentry_pips': 0.0, 'stop_buffer_pips': 20.0, 'tp_mode': 'mid', 'min_range_pips': 80.0, 'max_range_pips': 350.0, 'min_daily_atr': 0}. Best is trial 5 with value: -10.0.
[I 2026-05-29 01:52:50,085] Trial 0 finished with value: -10.0 and parameters: {'sweep_pips': 40.0, 'reentry_pips': 0.0, 'stop_buffer_pips': 40.0, 'tp_mode': 'opposite', 'min_range_pips': 80.0, 'max_range_pips': 250.0, 'min_daily_atr': 0}. Best is trial 5 with value: -10.0.
[I 2026-05-29 01:52:50,091] Trial 4 finished with value: -10.0 and parameters: {'sweep_pips': 30.0, 'reentry_pips': 20.0, 'stop_buffer_pips': 40.0, 'tp_mode': 'mid', 'min_range_pips': 100.0, 'max_range_pips': 250.0, 'min_daily_atr': 300}. Best is trial 5 with value: -10.0.
[I 2026-05-29 01:52:50,100] Trial 7 finished with value: -10.0 and parameters: {'sweep_pips': 40.0, 'reentry_pips': 10.0, 'stop_buffer_pips': 20.0, 'tp_mode': 'mid', 'min_range_pips': 80.0, 'max_range_pips': 350.0, 'min_daily_atr': 0}. Best is trial 5 with value: -10.0.
[I 2026-05-29 01:52:50,101] Trial 3 finished with value: -10.0 and parameters: {'sweep_pips': 20.0, 'reentry_pips': 10.0, 'stop_buffer_pips': 20.0, 'tp_mode': 'mid', 'min_range_pips': 100.0, 'max_range_pips': 300.0, 'min_daily_atr': 300}. Best is trial 5 with value: -10.0.
C:\Users\הלל\Desktop\algo projects\trading-research-factory\walk forward engine\.venv\lib\site-packages\optuna\distributions.py:700: UserWarning: The distribution is specified by [0, 500] and step=300, but the range is not divisible by `step`. It will be replaced by [0, 300].
  warnings.warn(
C:\Users\הלל\Desktop\algo projects\trading-research-factory\walk forward engine\.venv\lib\site-packages\optuna\distributions.py:700: UserWarning: The distribution is specified by [0, 500] and step=300, but the range is not divisible by `step`. It will be replaced by [0, 300].
  warnings.warn(
C:\Users\הלל\Desktop\algo projects\trading-research-factory\walk forward engine\.venv\lib\site-packages\optuna\distributions.py:700: UserWarning: The distribution is specified by [0, 500] and step=300, but the range is not divisible by `step`. It will be replaced by [0, 300].
  warnings.warn(
C:\Users\הלל\Desktop\algo projects\trading-research-factory\walk forward engine\.venv\lib\site-packages\optuna\distributions.py:700: UserWarning: The distribution is specified by [0, 500] and step=300, but the range is not divisible by `step`. It will be replaced by [0, 300].
  warnings.warn(
C:\Users\הלל\Desktop\algo projects\trading-research-factory\walk forward engine\.venv\lib\site-packages\optuna\distributions.py:700: UserWarning: The distribution is specified by [0, 500] and step=300, but the range is not divisible by `step`. It will be replaced by [0, 300].
  warnings.warn(
C:\Users\הלל\Desktop\algo projects\trading-research-factory\walk forward engine\.venv\lib\site-packages\optuna\distributions.py:700: UserWarning: The distribution is specified by [0, 500] and step=300, but the range is not divisible by `step`. It will be replaced by [0, 300].
  warnings.warn(
[I 2026-05-29 01:52:50,687] Trial 8 finished with value: -10.0 and parameters: {'sweep_pips': 40.0, 'reentry_pips': 20.0, 'stop_buffer_pips': 20.0, 'tp_mode': 'opposite', 'min_range_pips': 120.0, 'max_range_pips': 250.0, 'min_daily_atr': 0}. Best is trial 5 with value: -10.0.
[I 2026-05-29 01:52:50,725] Trial 9 finished with value: -10.0 and parameters: {'sweep_pips': 40.0, 'reentry_pips': 20.0, 'stop_buffer_pips': 40.0, 'tp_mode': 'mid', 'min_range_pips': 100.0, 'max_range_pips': 350.0, 'min_daily_atr': 0}. Best is trial 5 with value: -10.0.
[I 2026-05-29 01:52:50,738] Trial 15 finished with value: -10.0 and parameters: {'sweep_pips': 20.0, 'reentry_pips': 20.0, 'stop_buffer_pips': 20.0, 'tp_mode': 'opposite', 'min_range_pips': 80.0, 'max_range_pips': 350.0, 'min_daily_atr': 300}. Best is trial 5 with value: -10.0.
[I 2026-05-29 01:52:50,757] Trial 10 finished with value: -10.0 and parameters: {'sweep_pips': 40.0, 'reentry_pips': 10.0, 'stop_buffer_pips': 30.0, 'tp_mode': 'opposite', 'min_range_pips': 120.0, 'max_range_pips': 300.0, 'min_daily_atr': 300}. Best is trial 5 with value: -10.0.
[I 2026-05-29 01:52:50,761] Trial 13 finished with value: -10.0 and parameters: {'sweep_pips': 50.0, 'reentry_pips': 0.0, 'stop_buffer_pips': 30.0, 'tp_mode': 'opposite', 'min_range_pips': 120.0, 'max_range_pips': 350.0, 'min_daily_atr': 0}. Best is trial 5 with value: -10.0.
[I 2026-05-29 01:52:50,775] Trial 11 finished with value: -10.0 and parameters: {'sweep_pips': 20.0, 'reentry_pips': 0.0, 'stop_buffer_pips': 30.0, 'tp_mode': 'mid', 'min_range_pips': 100.0, 'max_range_pips': 350.0, 'min_daily_atr': 300}. Best is trial 5 with value: -10.0.
[I 2026-05-29 01:52:50,779] Trial 14 finished with value: -10.0 and parameters: {'sweep_pips': 50.0, 'reentry_pips': 10.0, 'stop_buffer_pips': 40.0, 'tp_mode': 'mid', 'min_range_pips': 80.0, 'max_range_pips': 300.0, 'min_daily_atr': 300}. Best is trial 5 with value: -10.0.
[I 2026-05-29 01:52:50,792] Trial 12 finished with value: -10.0 and parameters: {'sweep_pips': 50.0, 'reentry_pips': 10.0, 'stop_buffer_pips': 30.0, 'tp_mode': 'mid', 'min_range_pips': 100.0, 'max_range_pips': 250.0, 'min_daily_atr': 0}. Best is trial 5 with value: -10.0.
C:\Users\הלל\Desktop\algo projects\trading-research-factory\walk forward engine\.venv\lib\site-packages\optuna\distributions.py:700: UserWarning: The distribution is specified by [0, 500] and step=300, but the range is not divisible by `step`. It will be replaced by [0, 300].
  warnings.warn(
C:\Users\הלל\Desktop\algo projects\trading-research-factory\walk forward engine\.venv\lib\site-packages\optuna\distributions.py:700: UserWarning: The distribution is specified by [0, 500] and step=300, but the range is not divisible by `step`. It will be replaced by [0, 300].
  warnings.warn(
C:\Users\הלל\Desktop\algo projects\trading-research-factory\walk forward engine\.venv\lib\site-packages\optuna\distributions.py:700: UserWarning: The distribution is specified by [0, 500] and step=300, but the range is not divisible by `step`. It will be replaced by [0, 300].
  warnings.warn(
C:\Users\הלל\Desktop\algo projects\trading-research-factory\walk forward engine\.venv\lib\site-packages\optuna\distributions.py:700: UserWarning: The distribution is specified by [0, 500] and step=300, but the range is not divisible by `step`. It will be replaced by [0, 300].
  warnings.warn(
C:\Users\הלל\Desktop\algo projects\trading-research-factory\walk forward engine\.venv\lib\site-packages\optuna\distributions.py:700: UserWarning: The distribution is specified by [0, 500] and step=300, but the range is not divisible by `step`. It will be replaced by [0, 300].
  warnings.warn(
C:\Users\הלל\Desktop\algo projects\trading-research-factory\walk forward engine\.venv\lib\site-packages\optuna\distributions.py:700: UserWarning: The distribution is specified by [0, 500] and step=300, but the range is not divisible by `step`. It will be replaced by [0, 300].
  warnings.warn(
C:\Users\הלל\Desktop\algo projects\trading-research-factory\walk forward engine\.venv\lib\site-packages\optuna\distributions.py:700: UserWarning: The distribution is specified by [0, 500] and step=300, but the range is not divisible by `step`. It will be replaced by [0, 300].
  warnings.warn(
[I 2026-05-29 01:52:51,695] Trial 17 finished with value: -10.0 and parameters: {'sweep_pips': 40.0, 'reentry_pips': 0.0, 'stop_buffer_pips': 40.0, 'tp_mode': 'opposite', 'min_range_pips': 80.0, 'max_range_pips': 250.0, 'min_daily_atr': 0}. Best is trial 5 with value: -10.0.
[I 2026-05-29 01:52:51,697] Trial 20 finished with value: -10.0 and parameters: {'sweep_pips': 30.0, 'reentry_pips': 0.0, 'stop_buffer_pips': 40.0, 'tp_mode': 'opposite', 'min_range_pips': 80.0, 'max_range_pips': 250.0, 'min_daily_atr': 0}. Best is trial 5 with value: -10.0.
[I 2026-05-29 01:52:51,702] Trial 16 finished with value: -10.0 and parameters: {'sweep_pips': 30.0, 'reentry_pips': 0.0, 'stop_buffer_pips': 40.0, 'tp_mode': 'opposite', 'min_range_pips': 80.0, 'max_range_pips': 250.0, 'min_daily_atr': 0}. Best is trial 5 with value: -10.0.
[I 2026-05-29 01:52:51,733] Trial 18 finished with value: -10.0 and parameters: {'sweep_pips': 40.0, 'reentry_pips': 0.0, 'stop_buffer_pips': 40.0, 'tp_mode': 'opposite', 'min_range_pips': 80.0, 'max_range_pips': 250.0, 'min_daily_atr': 0}. Best is trial 5 with value: -10.0.
[I 2026-05-29 01:52:52,071] Trial 22 finished with value: -10.0 and parameters: {'sweep_pips': 30.0, 'reentry_pips': 0.0, 'stop_buffer_pips': 40.0, 'tp_mode': 'opposite', 'min_range_pips': 80.0, 'max_range_pips': 250.0, 'min_daily_atr': 0}. Best is trial 5 with value: -10.0.
[I 2026-05-29 01:52:52,312] Trial 19 finished with value: -10.0 and parameters: {'sweep_pips': 40.0, 'reentry_pips': 0.0, 'stop_buffer_pips': 40.0, 'tp_mode': 'opposite', 'min_range_pips': 80.0, 'max_range_pips': 250.0, 'min_daily_atr': 0}. Best is trial 5 with value: -10.0.
[I 2026-05-29 01:52:52,315] Trial 23 finished with value: -10.0 and parameters: {'sweep_pips': 30.0, 'reentry_pips': 0.0, 'stop_buffer_pips': 40.0, 'tp_mode': 'opposite', 'min_range_pips': 100.0, 'max_range_pips': 250.0, 'min_daily_atr': 0}. Best is trial 5 with value: -10.0.
C:\Users\הלל\Desktop\algo projects\trading-research-factory\walk forward engine\.venv\lib\site-packages\optuna\distributions.py:700: UserWarning: The distribution is specified by [0, 500] and step=300, but the range is not divisible by `step`. It will be replaced by [0, 300].
  warnings.warn(
[I 2026-05-29 01:52:52,333] Trial 21 finished with value: -10.0 and parameters: {'sweep_pips': 40.0, 'reentry_pips': 0.0, 'stop_buffer_pips': 40.0, 'tp_mode': 'opposite', 'min_range_pips': 80.0, 'max_range_pips': 300.0, 'min_daily_atr': 0}. Best is trial 5 with value: -10.0.
C:\Users\הלל\Desktop\algo projects\trading-research-factory\walk forward engine\.venv\lib\site-packages\optuna\distributions.py:700: UserWarning: The distribution is specified by [0, 500] and step=300, but the range is not divisible by `step`. It will be replaced by [0, 300].
  warnings.warn(
C:\Users\הלל\Desktop\algo projects\trading-research-factory\walk forward engine\.venv\lib\site-packages\optuna\distributions.py:700: UserWarning: The distribution is specified by [0, 500] and step=300, but the range is not divisible by `step`. It will be replaced by [0, 300].
  warnings.warn(
C:\Users\הלל\Desktop\algo projects\trading-research-factory\walk forward engine\.venv\lib\site-packages\optuna\distributions.py:700: UserWarning: The distribution is specified by [0, 500] and step=300, but the range is not divisible by `step`. It will be replaced by [0, 300].
  warnings.warn(
[I 2026-05-29 01:52:52,758] Trial 27 finished with value: -10.0 and parameters: {'sweep_pips': 40.0, 'reentry_pips': 0.0, 'stop_buffer_pips': 20.0, 'tp_mode': 'mid', 'min_range_pips': 80.0, 'max_range_pips': 300.0, 'min_daily_atr': 0}. Best is trial 5 with value: -10.0.
[I 2026-05-29 01:52:52,804] Trial 26 finished with value: -10.0 and parameters: {'sweep_pips': 50.0, 'reentry_pips': 0.0, 'stop_buffer_pips': 30.0, 'tp_mode': 'mid', 'min_range_pips': 80.0, 'max_range_pips': 350.0, 'min_daily_atr': 0}. Best is trial 5 with value: -10.0.
[I 2026-05-29 01:52:52,820] Trial 25 finished with value: -10.0 and parameters: {'sweep_pips': 40.0, 'reentry_pips': 0.0, 'stop_buffer_pips': 20.0, 'tp_mode': 'opposite', 'min_range_pips': 80.0, 'max_range_pips': 350.0, 'min_daily_atr': 0}. Best is trial 5 with value: -10.0.
[I 2026-05-29 01:52:52,863] Trial 28 finished with value: -10.0 and parameters: {'sweep_pips': 50.0, 'reentry_pips': 20.0, 'stop_buffer_pips': 40.0, 'tp_mode': 'opposite', 'min_range_pips': 120.0, 'max_range_pips': 300.0, 'min_daily_atr': 0}. Best is trial 5 with value: -10.0.
[I 2026-05-29 01:52:52,867] Trial 24 finished with value: -10.0 and parameters: {'sweep_pips': 40.0, 'reentry_pips': 0.0, 'stop_buffer_pips': 20.0, 'tp_mode': 'mid', 'min_range_pips': 80.0, 'max_range_pips': 300.0, 'min_daily_atr': 0}. Best is trial 5 with value: -10.0.
C:\Users\הלל\Desktop\algo projects\trading-research-factory\walk forward engine\.venv\lib\site-packages\optuna\distributions.py:700: UserWarning: The distribution is specified by [0, 500] and step=300, but the range is not divisible by `step`. It will be replaced by [0, 300].
  warnings.warn(
[I 2026-05-29 01:52:52,944] Trial 29 finished with value: -10.0 and parameters: {'sweep_pips': 50.0, 'reentry_pips': 0.0, 'stop_buffer_pips': 20.0, 'tp_mode': 'opposite', 'min_range_pips': 80.0, 'max_range_pips': 350.0, 'min_daily_atr': 0}. Best is trial 5 with value: -10.0.
C:\Users\הלל\Desktop\algo projects\trading-research-factory\walk forward engine\.venv\lib\site-packages\optuna\samplers\_tpe\sampler.py:319: ExperimentalWarning: ``multivariate`` option is an experimental feature. The interface can change in the future.
  warnings.warn(
[I 2026-05-29 01:52:53,134] A new study created in memory with name: no-name-ba07d0bb-e18f-463c-a44f-86a60b187c46
C:\Users\הלל\Desktop\algo projects\trading-research-factory\walk forward engine\.venv\lib\site-packages\optuna\distributions.py:700: UserWarning: The distribution is specified by [0, 500] and step=300, but the range is not divisible by `step`. It will be replaced by [0, 300].
  warnings.warn(
C:\Users\הלל\Desktop\algo projects\trading-research-factory\walk forward engine\.venv\lib\site-packages\optuna\distributions.py:700: UserWarning: The distribution is specified by [0, 500] and step=300, but the range is not divisible by `step`. It will be replaced by [0, 300].
  warnings.warn(
C:\Users\הלל\Desktop\algo projects\trading-research-factory\walk forward engine\.venv\lib\site-packages\optuna\distributions.py:700: UserWarning: The distribution is specified by [0, 500] and step=300, but the range is not divisible by `step`. It will be replaced by [0, 300].
  warnings.warn(
C:\Users\הלל\Desktop\algo projects\trading-research-factory\walk forward engine\.venv\lib\site-packages\optuna\distributions.py:700: UserWarning: The distribution is specified by [0, 500] and step=300, but the range is not divisible by `step`. It will be replaced by [0, 300].
  warnings.warn(
C:\Users\הלל\Desktop\algo projects\trading-research-factory\walk forward engine\.venv\lib\site-packages\optuna\distributions.py:700: UserWarning: The distribution is specified by [0, 500] and step=300, but the range is not divisible by `step`. It will be replaced by [0, 300].
  warnings.warn(
[I 2026-05-29 01:52:53,588] Trial 2 finished with value: -10.0 and parameters: {'sweep_pips': 30.0, 'reentry_pips': 0.0, 'stop_buffer_pips': 20.0, 'tp_mode': 'mid', 'min_range_pips': 100.0, 'max_range_pips': 300.0, 'min_daily_atr': 0}. Best is trial 2 with value: -10.0.
[I 2026-05-29 01:52:53,615] Trial 0 finished with value: -10.0 and parameters: {'sweep_pips': 30.0, 'reentry_pips': 0.0, 'stop_buffer_pips': 20.0, 'tp_mode': 'opposite', 'min_range_pips': 120.0, 'max_range_pips': 250.0, 'min_daily_atr': 300}. Best is trial 2 with value: -10.0.
[I 2026-05-29 01:52:53,624] Trial 3 finished with value: -10.0 and parameters: {'sweep_pips': 40.0, 'reentry_pips': 0.0, 'stop_buffer_pips': 20.0, 'tp_mode': 'mid', 'min_range_pips': 120.0, 'max_range_pips': 250.0, 'min_daily_atr': 300}. Best is trial 2 with value: -10.0.
C:\Users\הלל\Desktop\algo projects\trading-research-factory\walk forward engine\.venv\lib\site-packages\optuna\distributions.py:700: UserWarning: The distribution is specified by [0, 500] and step=300, but the range is not divisible by `step`. It will be replaced by [0, 300].
  warnings.warn(
C:\Users\הלל\Desktop\algo projects\trading-research-factory\walk forward engine\.venv\lib\site-packages\optuna\distributions.py:700: UserWarning: The distribution is specified by [0, 500] and step=300, but the range is not divisible by `step`. It will be replaced by [0, 300].
  warnings.warn(
C:\Users\הלל\Desktop\algo projects\trading-research-factory\walk forward engine\.venv\lib\site-packages\optuna\distributions.py:700: UserWarning: The distribution is specified by [0, 500] and step=300, but the range is not divisible by `step`. It will be replaced by [0, 300].
  warnings.warn(
[I 2026-05-29 01:52:53,830] Trial 4 finished with value: -10.0 and parameters: {'sweep_pips': 20.0, 'reentry_pips': 10.0, 'stop_buffer_pips': 20.0, 'tp_mode': 'opposite', 'min_range_pips': 120.0, 'max_range_pips': 250.0, 'min_daily_atr': 0}. Best is trial 2 with value: -10.0.
C:\Users\הלל\Desktop\algo projects\trading-research-factory\walk forward engine\.venv\lib\site-packages\optuna\distributions.py:700: UserWarning: The distribution is specified by [0, 500] and step=300, but the range is not divisible by `step`. It will be replaced by [0, 300].
  warnings.warn(
[I 2026-05-29 01:52:53,866] Trial 7 finished with value: -10.0 and parameters: {'sweep_pips': 50.0, 'reentry_pips': 10.0, 'stop_buffer_pips': 30.0, 'tp_mode': 'mid', 'min_range_pips': 100.0, 'max_range_pips': 350.0, 'min_daily_atr': 0}. Best is trial 2 with value: -10.0.
[I 2026-05-29 01:52:53,870] Trial 5 finished with value: -10.0 and parameters: {'sweep_pips': 30.0, 'reentry_pips': 20.0, 'stop_buffer_pips': 30.0, 'tp_mode': 'opposite', 'min_range_pips': 80.0, 'max_range_pips': 250.0, 'min_daily_atr': 300}. Best is trial 2 with value: -10.0.
[I 2026-05-29 01:52:53,895] Trial 6 finished with value: -10.0 and parameters: {'sweep_pips': 40.0, 'reentry_pips': 10.0, 'stop_buffer_pips': 40.0, 'tp_mode': 'opposite', 'min_range_pips': 120.0, 'max_range_pips': 300.0, 'min_daily_atr': 0}. Best is trial 2 with value: -10.0.
