[I 2026-05-29 01:53:10,430] Trial 6 finished with value: -10.0 and parameters: {'sweep_pips': 50.0, 'reentry_pips': 20.0, 'stop_buffer_pips': 20.0, 'tp_mode': 'mid', 'min_range_pips': 120.0, 'max_range_pips': 250.0, 'min_daily_atr': 0}. Best is trial 1 with value: -10.0.
C:\Users\הלל\Desktop\algo projects\trading-research-factory\walk forward engine\.venv\lib\site-packages\optuna\distributions.py:700: UserWarning: The distribution is specified by [0, 500] and step=300, but the range is not divisible by `step`. It will be replaced by [0, 300].
  warnings.warn(
C:\Users\הלל\Desktop\algo projects\trading-research-factory\walk forward engine\.venv\lib\site-packages\optuna\distributions.py:700: UserWarning: The distribution is specified by [0, 500] and step=300, but the range is not divisible by `step`. It will be replaced by [0, 300].
  warnings.warn(
C:\Users\הלל\Desktop\algo projects\trading-research-factory\walk forward engine\.venv\lib\site-packages\optuna\distributions.py:700: UserWarning: The distribution is specified by [0, 500] and step=300, but the range is not divisible by `step`. It will be replaced by [0, 300].
  warnings.warn(
C:\Users\הלל\Desktop\algo projects\trading-research-factory\walk forward engine\.venv\lib\site-packages\optuna\distributions.py:700: UserWarning: The distribution is specified by [0, 500] and step=300, but the range is not divisible by `step`. It will be replaced by [0, 300].
  warnings.warn(
C:\Users\הלל\Desktop\algo projects\trading-research-factory\walk forward engine\.venv\lib\site-packages\optuna\distributions.py:700: UserWarning: The distribution is specified by [0, 500] and step=300, but the range is not divisible by `step`. It will be replaced by [0, 300].
  warnings.warn(
[I 2026-05-29 01:53:10,937] Trial 8 finished with value: -10.0 and parameters: {'sweep_pips': 20.0, 'reentry_pips': 20.0, 'stop_buffer_pips': 40.0, 'tp_mode': 'opposite', 'min_range_pips': 100.0, 'max_range_pips': 250.0, 'min_daily_atr': 300}. Best is trial 1 with value: -10.0.
C:\Users\הלל\Desktop\algo projects\trading-research-factory\walk forward engine\.venv\lib\site-packages\optuna\distributions.py:700: UserWarning: The distribution is specified by [0, 500] and step=300, but the range is not divisible by `step`. It will be replaced by [0, 300].
  warnings.warn(
[I 2026-05-29 01:53:11,028] Trial 9 finished with value: -10.0 and parameters: {'sweep_pips': 30.0, 'reentry_pips': 20.0, 'stop_buffer_pips': 40.0, 'tp_mode': 'mid', 'min_range_pips': 120.0, 'max_range_pips': 300.0, 'min_daily_atr': 0}. Best is trial 1 with value: -10.0.
[I 2026-05-29 01:53:11,314] Trial 10 finished with value: -10.0 and parameters: {'sweep_pips': 30.0, 'reentry_pips': 0.0, 'stop_buffer_pips': 40.0, 'tp_mode': 'opposite', 'min_range_pips': 80.0, 'max_range_pips': 350.0, 'min_daily_atr': 0}. Best is trial 1 with value: -10.0.
C:\Users\הלל\Desktop\algo projects\trading-research-factory\walk forward engine\.venv\lib\site-packages\optuna\distributions.py:700: UserWarning: The distribution is specified by [0, 500] and step=300, but the range is not divisible by `step`. It will be replaced by [0, 300].
  warnings.warn(
[I 2026-05-29 01:53:11,512] Trial 11 finished with value: -10.0 and parameters: {'sweep_pips': 40.0, 'reentry_pips': 20.0, 'stop_buffer_pips': 20.0, 'tp_mode': 'opposite', 'min_range_pips': 80.0, 'max_range_pips': 350.0, 'min_daily_atr': 300}. Best is trial 1 with value: -10.0.
[I 2026-05-29 01:53:11,588] Trial 12 finished with value: -10.0 and parameters: {'sweep_pips': 30.0, 'reentry_pips': 20.0, 'stop_buffer_pips': 40.0, 'tp_mode': 'mid', 'min_range_pips': 120.0, 'max_range_pips': 350.0, 'min_daily_atr': 300}. Best is trial 1 with value: -10.0.
C:\Users\הלל\Desktop\algo projects\trading-research-factory\walk forward engine\.venv\lib\site-packages\optuna\distributions.py:700: UserWarning: The distribution is specified by [0, 500] and step=300, but the range is not divisible by `step`. It will be replaced by [0, 300].
  warnings.warn(
[I 2026-05-29 01:53:11,696] Trial 14 finished with value: -10.0 and parameters: {'sweep_pips': 40.0, 'reentry_pips': 20.0, 'stop_buffer_pips': 30.0, 'tp_mode': 'mid', 'min_range_pips': 80.0, 'max_range_pips': 350.0, 'min_daily_atr': 0}. Best is trial 1 with value: -10.0.
[I 2026-05-29 01:53:11,703] Trial 13 finished with value: -10.0 and parameters: {'sweep_pips': 30.0, 'reentry_pips': 10.0, 'stop_buffer_pips': 30.0, 'tp_mode': 'opposite', 'min_range_pips': 100.0, 'max_range_pips': 300.0, 'min_daily_atr': 300}. Best is trial 1 with value: -10.0.
[I 2026-05-29 01:53:11,820] Trial 15 finished with value: -10.0 and parameters: {'sweep_pips': 50.0, 'reentry_pips': 0.0, 'stop_buffer_pips': 20.0, 'tp_mode': 'mid', 'min_range_pips': 80.0, 'max_range_pips': 250.0, 'min_daily_atr': 300}. Best is trial 1 with value: -10.0.
C:\Users\הלל\Desktop\algo projects\trading-research-factory\walk forward engine\.venv\lib\site-packages\optuna\distributions.py:700: UserWarning: The distribution is specified by [0, 500] and step=300, but the range is not divisible by `step`. It will be replaced by [0, 300].
  warnings.warn(
[I 2026-05-29 01:53:12,029] Trial 16 finished with value: -10.0 and parameters: {'sweep_pips': 30.0, 'reentry_pips': 0.0, 'stop_buffer_pips': 20.0, 'tp_mode': 'mid', 'min_range_pips': 120.0, 'max_range_pips': 250.0, 'min_daily_atr': 300}. Best is trial 1 with value: -10.0.
C:\Users\הלל\Desktop\algo projects\trading-research-factory\walk forward engine\.venv\lib\site-packages\optuna\distributions.py:700: UserWarning: The distribution is specified by [0, 500] and step=300, but the range is not divisible by `step`. It will be replaced by [0, 300].
  warnings.warn(
C:\Users\הלל\Desktop\algo projects\trading-research-factory\walk forward engine\.venv\lib\site-packages\optuna\distributions.py:700: UserWarning: The distribution is specified by [0, 500] and step=300, but the range is not divisible by `step`. It will be replaced by [0, 300].
  warnings.warn(
C:\Users\הלל\Desktop\algo projects\trading-research-factory\walk forward engine\.venv\lib\site-packages\optuna\distributions.py:700: UserWarning: The distribution is specified by [0, 500] and step=300, but the range is not divisible by `step`. It will be replaced by [0, 300].
  warnings.warn(
C:\Users\הלל\Desktop\algo projects\trading-research-factory\walk forward engine\.venv\lib\site-packages\optuna\distributions.py:700: UserWarning: The distribution is specified by [0, 500] and step=300, but the range is not divisible by `step`. It will be replaced by [0, 300].
  warnings.warn(
C:\Users\הלל\Desktop\algo projects\trading-research-factory\walk forward engine\.venv\lib\site-packages\optuna\distributions.py:700: UserWarning: The distribution is specified by [0, 500] and step=300, but the range is not divisible by `step`. It will be replaced by [0, 300].
  warnings.warn(
[I 2026-05-29 01:53:12,421] Trial 17 finished with value: -10.0 and parameters: {'sweep_pips': 30.0, 'reentry_pips': 0.0, 'stop_buffer_pips': 40.0, 'tp_mode': 'mid', 'min_range_pips': 120.0, 'max_range_pips': 350.0, 'min_daily_atr': 0}. Best is trial 1 with value: -10.0.
[I 2026-05-29 01:53:12,718] Trial 18 finished with value: -10.0 and parameters: {'sweep_pips': 30.0, 'reentry_pips': 0.0, 'stop_buffer_pips': 40.0, 'tp_mode': 'mid', 'min_range_pips': 120.0, 'max_range_pips': 350.0, 'min_daily_atr': 0}. Best is trial 1 with value: -10.0.
C:\Users\הלל\Desktop\algo projects\trading-research-factory\walk forward engine\.venv\lib\site-packages\optuna\distributions.py:700: UserWarning: The distribution is specified by [0, 500] and step=300, but the range is not divisible by `step`. It will be replaced by [0, 300].
  warnings.warn(
[I 2026-05-29 01:53:13,128] Trial 20 finished with value: -10.0 and parameters: {'sweep_pips': 30.0, 'reentry_pips': 0.0, 'stop_buffer_pips': 40.0, 'tp_mode': 'mid', 'min_range_pips': 120.0, 'max_range_pips': 350.0, 'min_daily_atr': 0}. Best is trial 1 with value: -10.0.
C:\Users\הלל\Desktop\algo projects\trading-research-factory\walk forward engine\.venv\lib\site-packages\optuna\distributions.py:700: UserWarning: The distribution is specified by [0, 500] and step=300, but the range is not divisible by `step`. It will be replaced by [0, 300].
  warnings.warn(
[I 2026-05-29 01:53:13,196] Trial 21 finished with value: -10.0 and parameters: {'sweep_pips': 20.0, 'reentry_pips': 0.0, 'stop_buffer_pips': 30.0, 'tp_mode': 'mid', 'min_range_pips': 120.0, 'max_range_pips': 350.0, 'min_daily_atr': 0}. Best is trial 1 with value: -10.0.
[I 2026-05-29 01:53:13,198] Trial 23 finished with value: -10.0 and parameters: {'sweep_pips': 20.0, 'reentry_pips': 0.0, 'stop_buffer_pips': 40.0, 'tp_mode': 'mid', 'min_range_pips': 120.0, 'max_range_pips': 350.0, 'min_daily_atr': 0}. Best is trial 1 with value: -10.0.
[I 2026-05-29 01:53:13,208] Trial 19 finished with value: -10.0 and parameters: {'sweep_pips': 20.0, 'reentry_pips': 0.0, 'stop_buffer_pips': 40.0, 'tp_mode': 'opposite', 'min_range_pips': 120.0, 'max_range_pips': 350.0, 'min_daily_atr': 0}. Best is trial 1 with value: -10.0.
[I 2026-05-29 01:53:13,338] Trial 24 finished with value: -10.0 and parameters: {'sweep_pips': 30.0, 'reentry_pips': 0.0, 'stop_buffer_pips': 40.0, 'tp_mode': 'mid', 'min_range_pips': 120.0, 'max_range_pips': 350.0, 'min_daily_atr': 0}. Best is trial 1 with value: -10.0.
C:\Users\הלל\Desktop\algo projects\trading-research-factory\walk forward engine\.venv\lib\site-packages\optuna\distributions.py:700: UserWarning: The distribution is specified by [0, 500] and step=300, but the range is not divisible by `step`. It will be replaced by [0, 300].
  warnings.warn(
[I 2026-05-29 01:53:13,493] Trial 22 finished with value: -10.0 and parameters: {'sweep_pips': 20.0, 'reentry_pips': 0.0, 'stop_buffer_pips': 40.0, 'tp_mode': 'mid', 'min_range_pips': 120.0, 'max_range_pips': 350.0, 'min_daily_atr': 300}. Best is trial 1 with value: -10.0.
C:\Users\הלל\Desktop\algo projects\trading-research-factory\walk forward engine\.venv\lib\site-packages\optuna\distributions.py:700: UserWarning: The distribution is specified by [0, 500] and step=300, but the range is not divisible by `step`. It will be replaced by [0, 300].
  warnings.warn(
[I 2026-05-29 01:53:13,692] Trial 25 finished with value: -10.0 and parameters: {'sweep_pips': 20.0, 'reentry_pips': 10.0, 'stop_buffer_pips': 20.0, 'tp_mode': 'opposite', 'min_range_pips': 120.0, 'max_range_pips': 250.0, 'min_daily_atr': 300}. Best is trial 1 with value: -10.0.
[I 2026-05-29 01:53:13,708] Trial 26 finished with value: -10.0 and parameters: {'sweep_pips': 20.0, 'reentry_pips': 0.0, 'stop_buffer_pips': 30.0, 'tp_mode': 'opposite', 'min_range_pips': 120.0, 'max_range_pips': 250.0, 'min_daily_atr': 300}. Best is trial 1 with value: -10.0.
C:\Users\הלל\Desktop\algo projects\trading-research-factory\walk forward engine\.venv\lib\site-packages\optuna\distributions.py:700: UserWarning: The distribution is specified by [0, 500] and step=300, but the range is not divisible by `step`. It will be replaced by [0, 300].
  warnings.warn(
[I 2026-05-29 01:53:13,801] Trial 27 finished with value: -10.0 and parameters: {'sweep_pips': 20.0, 'reentry_pips': 0.0, 'stop_buffer_pips': 20.0, 'tp_mode': 'opposite', 'min_range_pips': 100.0, 'max_range_pips': 300.0, 'min_daily_atr': 300}. Best is trial 1 with value: -10.0.
[I 2026-05-29 01:53:13,867] Trial 28 finished with value: -10.0 and parameters: {'sweep_pips': 20.0, 'reentry_pips': 10.0, 'stop_buffer_pips': 40.0, 'tp_mode': 'mid', 'min_range_pips': 80.0, 'max_range_pips': 300.0, 'min_daily_atr': 0}. Best is trial 1 with value: -10.0.
[I 2026-05-29 01:53:13,941] Trial 29 finished with value: -10.0 and parameters: {'sweep_pips': 20.0, 'reentry_pips': 0.0, 'stop_buffer_pips': 20.0, 'tp_mode': 'opposite', 'min_range_pips': 100.0, 'max_range_pips': 250.0, 'min_daily_atr': 300}. Best is trial 1 with value: -10.0.
C:\Users\הלל\Desktop\algo projects\trading-research-factory\walk forward engine\.venv\lib\site-packages\optuna\samplers\_tpe\sampler.py:319: ExperimentalWarning: ``multivariate`` option is an experimental feature. The interface can change in the future.
  warnings.warn(
[I 2026-05-29 01:53:14,318] A new study created in memory with name: no-name-9ec5cbff-d452-486f-8351-44b12aecd3b5
C:\Users\הלל\Desktop\algo projects\trading-research-factory\walk forward engine\.venv\lib\site-packages\optuna\distributions.py:700: UserWarning: The distribution is specified by [0, 500] and step=300, but the range is not divisible by `step`. It will be replaced by [0, 300].
  warnings.warn(
C:\Users\הלל\Desktop\algo projects\trading-research-factory\walk forward engine\.venv\lib\site-packages\optuna\distributions.py:700: UserWarning: The distribution is specified by [0, 500] and step=300, but the range is not divisible by `step`. It will be replaced by [0, 300].
  warnings.warn(
C:\Users\הלל\Desktop\algo projects\trading-research-factory\walk forward engine\.venv\lib\site-packages\optuna\distributions.py:700: UserWarning: The distribution is specified by [0, 500] and step=300, but the range is not divisible by `step`. It will be replaced by [0, 300].
  warnings.warn(
C:\Users\הלל\Desktop\algo projects\trading-research-factory\walk forward engine\.venv\lib\site-packages\optuna\distributions.py:700: UserWarning: The distribution is specified by [0, 500] and step=300, but the range is not divisible by `step`. It will be replaced by [0, 300].
  warnings.warn(
C:\Users\הלל\Desktop\algo projects\trading-research-factory\walk forward engine\.venv\lib\site-packages\optuna\distributions.py:700: UserWarning: The distribution is specified by [0, 500] and step=300, but the range is not divisible by `step`. It will be replaced by [0, 300].
  warnings.warn(
C:\Users\הלל\Desktop\algo projects\trading-research-factory\walk forward engine\.venv\lib\site-packages\optuna\distributions.py:700: UserWarning: The distribution is specified by [0, 500] and step=300, but the range is not divisible by `step`. It will be replaced by [0, 300].
  warnings.warn(
[I 2026-05-29 01:53:15,417] Trial 3 finished with value: -10.0 and parameters: {'sweep_pips': 40.0, 'reentry_pips': 10.0, 'stop_buffer_pips': 40.0, 'tp_mode': 'opposite', 'min_range_pips': 120.0, 'max_range_pips': 250.0, 'min_daily_atr': 300}. Best is trial 3 with value: -10.0.
[I 2026-05-29 01:53:15,520] Trial 2 finished with value: -10.0 and parameters: {'sweep_pips': 30.0, 'reentry_pips': 20.0, 'stop_buffer_pips': 30.0, 'tp_mode': 'opposite', 'min_range_pips': 80.0, 'max_range_pips': 250.0, 'min_daily_atr': 0}. Best is trial 3 with value: -10.0.
C:\Users\הלל\Desktop\algo projects\trading-research-factory\walk forward engine\.venv\lib\site-packages\optuna\distributions.py:700: UserWarning: The distribution is specified by [0, 500] and step=300, but the range is not divisible by `step`. It will be replaced by [0, 300].
  warnings.warn(
[I 2026-05-29 01:53:15,567] Trial 0 finished with value: -10.0 and parameters: {'sweep_pips': 30.0, 'reentry_pips': 0.0, 'stop_buffer_pips': 20.0, 'tp_mode': 'mid', 'min_range_pips': 120.0, 'max_range_pips': 250.0, 'min_daily_atr': 300}. Best is trial 3 with value: -10.0.
C:\Users\הלל\Desktop\algo projects\trading-research-factory\walk forward engine\.venv\lib\site-packages\optuna\distributions.py:700: UserWarning: The distribution is specified by [0, 500] and step=300, but the range is not divisible by `step`. It will be replaced by [0, 300].
  warnings.warn(
[I 2026-05-29 01:53:15,652] Trial 1 finished with value: -10.0 and parameters: {'sweep_pips': 30.0, 'reentry_pips': 10.0, 'stop_buffer_pips': 20.0, 'tp_mode': 'opposite', 'min_range_pips': 120.0, 'max_range_pips': 300.0, 'min_daily_atr': 300}. Best is trial 3 with value: -10.0.
[I 2026-05-29 01:53:15,654] Trial 7 finished with value: -10.0 and parameters: {'sweep_pips': 30.0, 'reentry_pips': 10.0, 'stop_buffer_pips': 40.0, 'tp_mode': 'opposite', 'min_range_pips': 100.0, 'max_range_pips': 350.0, 'min_daily_atr': 300}. Best is trial 3 with value: -10.0.
[I 2026-05-29 01:53:15,684] Trial 5 finished with value: -10.0 and parameters: {'sweep_pips': 20.0, 'reentry_pips': 20.0, 'stop_buffer_pips': 40.0, 'tp_mode': 'mid', 'min_range_pips': 100.0, 'max_range_pips': 300.0, 'min_daily_atr': 0}. Best is trial 3 with value: -10.0.
C:\Users\הלל\Desktop\algo projects\trading-research-factory\walk forward engine\.venv\lib\site-packages\optuna\distributions.py:700: UserWarning: The distribution is specified by [0, 500] and step=300, but the range is not divisible by `step`. It will be replaced by [0, 300].
  warnings.warn(
C:\Users\הלל\Desktop\algo projects\trading-research-factory\walk forward engine\.venv\lib\site-packages\optuna\distributions.py:700: UserWarning: The distribution is specified by [0, 500] and step=300, but the range is not divisible by `step`. It will be replaced by [0, 300].
  warnings.warn(
[I 2026-05-29 01:53:15,742] Trial 4 finished with value: -10.0 and parameters: {'sweep_pips': 50.0, 'reentry_pips': 0.0, 'stop_buffer_pips': 20.0, 'tp_mode': 'opposite', 'min_range_pips': 80.0, 'max_range_pips': 300.0, 'min_daily_atr': 300}. Best is trial 3 with value: -10.0.
C:\Users\הלל\Desktop\algo projects\trading-research-factory\walk forward engine\.venv\lib\site-packages\optuna\distributions.py:700: UserWarning: The distribution is specified by [0, 500] and step=300, but the range is not divisible by `step`. It will be replaced by [0, 300].
  warnings.warn(
C:\Users\הלל\Desktop\algo projects\trading-research-factory\walk forward engine\.venv\lib\site-packages\optuna\distributions.py:700: UserWarning: The distribution is specified by [0, 500] and step=300, but the range is not divisible by `step`. It will be replaced by [0, 300].
  warnings.warn(
[I 2026-05-29 01:53:15,847] Trial 6 finished with value: -10.0 and parameters: {'sweep_pips': 50.0, 'reentry_pips': 20.0, 'stop_buffer_pips': 40.0, 'tp_mode': 'mid', 'min_range_pips': 120.0, 'max_range_pips': 250.0, 'min_daily_atr': 300}. Best is trial 3 with value: -10.0.
C:\Users\הלל\Desktop\algo projects\trading-research-factory\walk forward engine\.venv\lib\site-packages\optuna\distributions.py:700: UserWarning: The distribution is specified by [0, 500] and step=300, but the range is not divisible by `step`. It will be replaced by [0, 300].
  warnings.warn(
[I 2026-05-29 01:53:16,810] Trial 8 finished with value: -10.0 and parameters: {'sweep_pips': 40.0, 'reentry_pips': 10.0, 'stop_buffer_pips': 20.0, 'tp_mode': 'mid', 'min_range_pips': 120.0, 'max_range_pips': 300.0, 'min_daily_atr': 0}. Best is trial 3 with value: -10.0.
[I 2026-05-29 01:53:16,861] Trial 9 finished with value: -10.0 and parameters: {'sweep_pips': 20.0, 'reentry_pips': 10.0, 'stop_buffer_pips': 30.0, 'tp_mode': 'opposite', 'min_range_pips': 120.0, 'max_range_pips': 300.0, 'min_daily_atr': 0}. Best is trial 3 with value: -10.0.
[I 2026-05-29 01:53:17,121] Trial 10 finished with value: -10.0 and parameters: {'sweep_pips': 30.0, 'reentry_pips': 0.0, 'stop_buffer_pips': 40.0, 'tp_mode': 'mid', 'min_range_pips': 80.0, 'max_range_pips': 250.0, 'min_daily_atr': 300}. Best is trial 3 with value: -10.0.
[I 2026-05-29 01:53:17,133] Trial 14 finished with value: -10.0 and parameters: {'sweep_pips': 30.0, 'reentry_pips': 0.0, 'stop_buffer_pips': 40.0, 'tp_mode': 'mid', 'min_range_pips': 120.0, 'max_range_pips': 250.0, 'min_daily_atr': 300}. Best is trial 3 with value: -10.0.
[I 2026-05-29 01:53:17,220] Trial 15 finished with value: -10.0 and parameters: {'sweep_pips': 40.0, 'reentry_pips': 0.0, 'stop_buffer_pips': 40.0, 'tp_mode': 'opposite', 'min_range_pips': 80.0, 'max_range_pips': 350.0, 'min_daily_atr': 0}. Best is trial 3 with value: -10.0.
C:\Users\הלל\Desktop\algo projects\trading-research-factory\walk forward engine\.venv\lib\site-packages\optuna\distributions.py:700: UserWarning: The distribution is specified by [0, 500] and step=300, but the range is not divisible by `step`. It will be replaced by [0, 300].
  warnings.warn(
[I 2026-05-29 01:53:17,270] Trial 12 finished with value: -10.0 and parameters: {'sweep_pips': 40.0, 'reentry_pips': 20.0, 'stop_buffer_pips': 20.0, 'tp_mode': 'mid', 'min_range_pips': 80.0, 'max_range_pips': 300.0, 'min_daily_atr': 300}. Best is trial 3 with value: -10.0.
C:\Users\הלל\Desktop\algo projects\trading-research-factory\walk forward engine\.venv\lib\site-packages\optuna\distributions.py:700: UserWarning: The distribution is specified by [0, 500] and step=300, but the range is not divisible by `step`. It will be replaced by [0, 300].
  warnings.warn(
[I 2026-05-29 01:53:17,462] Trial 11 finished with value: -10.0 and parameters: {'sweep_pips': 50.0, 'reentry_pips': 10.0, 'stop_buffer_pips': 30.0, 'tp_mode': 'mid', 'min_range_pips': 80.0, 'max_range_pips': 300.0, 'min_daily_atr': 300}. Best is trial 3 with value: -10.0.
