[I 2026-05-29 01:53:17,463] Trial 13 finished with value: -10.0 and parameters: {'sweep_pips': 20.0, 'reentry_pips': 20.0, 'stop_buffer_pips': 20.0, 'tp_mode': 'opposite', 'min_range_pips': 120.0, 'max_range_pips': 350.0, 'min_daily_atr': 300}. Best is trial 3 with value: -10.0.
C:\Users\הלל\Desktop\algo projects\trading-research-factory\walk forward engine\.venv\lib\site-packages\optuna\distributions.py:700: UserWarning: The distribution is specified by [0, 500] and step=300, but the range is not divisible by `step`. It will be replaced by [0, 300].
  warnings.warn(
C:\Users\הלל\Desktop\algo projects\trading-research-factory\walk forward engine\.venv\lib\site-packages\optuna\distributions.py:700: UserWarning: The distribution is specified by [0, 500] and step=300, but the range is not divisible by `step`. It will be replaced by [0, 300].
  warnings.warn(
C:\Users\הלל\Desktop\algo projects\trading-research-factory\walk forward engine\.venv\lib\site-packages\optuna\distributions.py:700: UserWarning: The distribution is specified by [0, 500] and step=300, but the range is not divisible by `step`. It will be replaced by [0, 300].
  warnings.warn(
C:\Users\הלל\Desktop\algo projects\trading-research-factory\walk forward engine\.venv\lib\site-packages\optuna\distributions.py:700: UserWarning: The distribution is specified by [0, 500] and step=300, but the range is not divisible by `step`. It will be replaced by [0, 300].
  warnings.warn(
[I 2026-05-29 01:53:18,439] Trial 17 finished with value: -10.0 and parameters: {'sweep_pips': 40.0, 'reentry_pips': 0.0, 'stop_buffer_pips': 20.0, 'tp_mode': 'mid', 'min_range_pips': 120.0, 'max_range_pips': 250.0, 'min_daily_atr': 300}. Best is trial 3 with value: -10.0.
[I 2026-05-29 01:53:18,482] Trial 16 finished with value: -10.0 and parameters: {'sweep_pips': 40.0, 'reentry_pips': 0.0, 'stop_buffer_pips': 30.0, 'tp_mode': 'mid', 'min_range_pips': 120.0, 'max_range_pips': 250.0, 'min_daily_atr': 300}. Best is trial 3 with value: -10.0.
C:\Users\הלל\Desktop\algo projects\trading-research-factory\walk forward engine\.venv\lib\site-packages\optuna\distributions.py:700: UserWarning: The distribution is specified by [0, 500] and step=300, but the range is not divisible by `step`. It will be replaced by [0, 300].
  warnings.warn(
[I 2026-05-29 01:53:19,018] Trial 20 finished with value: -10.0 and parameters: {'sweep_pips': 20.0, 'reentry_pips': 0.0, 'stop_buffer_pips': 20.0, 'tp_mode': 'mid', 'min_range_pips': 100.0, 'max_range_pips': 250.0, 'min_daily_atr': 300}. Best is trial 3 with value: -10.0.
C:\Users\הלל\Desktop\algo projects\trading-research-factory\walk forward engine\.venv\lib\site-packages\optuna\distributions.py:700: UserWarning: The distribution is specified by [0, 500] and step=300, but the range is not divisible by `step`. It will be replaced by [0, 300].
  warnings.warn(
[I 2026-05-29 01:53:19,089] Trial 18 finished with value: -10.0 and parameters: {'sweep_pips': 30.0, 'reentry_pips': 20.0, 'stop_buffer_pips': 20.0, 'tp_mode': 'opposite', 'min_range_pips': 120.0, 'max_range_pips': 300.0, 'min_daily_atr': 300}. Best is trial 3 with value: -10.0.
[I 2026-05-29 01:53:19,142] Trial 19 finished with value: -10.0 and parameters: {'sweep_pips': 40.0, 'reentry_pips': 0.0, 'stop_buffer_pips': 20.0, 'tp_mode': 'mid', 'min_range_pips': 120.0, 'max_range_pips': 250.0, 'min_daily_atr': 300}. Best is trial 3 with value: -10.0.
[I 2026-05-29 01:53:19,152] Trial 21 finished with value: -10.0 and parameters: {'sweep_pips': 30.0, 'reentry_pips': 10.0, 'stop_buffer_pips': 20.0, 'tp_mode': 'opposite', 'min_range_pips': 120.0, 'max_range_pips': 250.0, 'min_daily_atr': 300}. Best is trial 3 with value: -10.0.
[I 2026-05-29 01:53:19,276] Trial 22 finished with value: -10.0 and parameters: {'sweep_pips': 30.0, 'reentry_pips': 0.0, 'stop_buffer_pips': 20.0, 'tp_mode': 'mid', 'min_range_pips': 100.0, 'max_range_pips': 250.0, 'min_daily_atr': 300}. Best is trial 3 with value: -10.0.
C:\Users\הלל\Desktop\algo projects\trading-research-factory\walk forward engine\.venv\lib\site-packages\optuna\distributions.py:700: UserWarning: The distribution is specified by [0, 500] and step=300, but the range is not divisible by `step`. It will be replaced by [0, 300].
  warnings.warn(
C:\Users\הלל\Desktop\algo projects\trading-research-factory\walk forward engine\.venv\lib\site-packages\optuna\distributions.py:700: UserWarning: The distribution is specified by [0, 500] and step=300, but the range is not divisible by `step`. It will be replaced by [0, 300].
  warnings.warn(
[I 2026-05-29 01:53:19,452] Trial 23 finished with value: -10.0 and parameters: {'sweep_pips': 30.0, 'reentry_pips': 0.0, 'stop_buffer_pips': 20.0, 'tp_mode': 'mid', 'min_range_pips': 120.0, 'max_range_pips': 250.0, 'min_daily_atr': 300}. Best is trial 3 with value: -10.0.
C:\Users\הלל\Desktop\algo projects\trading-research-factory\walk forward engine\.venv\lib\site-packages\optuna\distributions.py:700: UserWarning: The distribution is specified by [0, 500] and step=300, but the range is not divisible by `step`. It will be replaced by [0, 300].
  warnings.warn(
C:\Users\הלל\Desktop\algo projects\trading-research-factory\walk forward engine\.venv\lib\site-packages\optuna\distributions.py:700: UserWarning: The distribution is specified by [0, 500] and step=300, but the range is not divisible by `step`. It will be replaced by [0, 300].
  warnings.warn(
[I 2026-05-29 01:53:19,713] Trial 24 finished with value: -10.0 and parameters: {'sweep_pips': 30.0, 'reentry_pips': 10.0, 'stop_buffer_pips': 20.0, 'tp_mode': 'opposite', 'min_range_pips': 100.0, 'max_range_pips': 250.0, 'min_daily_atr': 300}. Best is trial 3 with value: -10.0.
[I 2026-05-29 01:53:19,831] Trial 25 finished with value: -10.0 and parameters: {'sweep_pips': 20.0, 'reentry_pips': 0.0, 'stop_buffer_pips': 20.0, 'tp_mode': 'opposite', 'min_range_pips': 120.0, 'max_range_pips': 300.0, 'min_daily_atr': 300}. Best is trial 3 with value: -10.0.
[I 2026-05-29 01:53:19,989] Trial 26 finished with value: -10.0 and parameters: {'sweep_pips': 30.0, 'reentry_pips': 0.0, 'stop_buffer_pips': 20.0, 'tp_mode': 'opposite', 'min_range_pips': 120.0, 'max_range_pips': 300.0, 'min_daily_atr': 300}. Best is trial 3 with value: -10.0.
[I 2026-05-29 01:53:20,023] Trial 29 finished with value: -10.0 and parameters: {'sweep_pips': 20.0, 'reentry_pips': 10.0, 'stop_buffer_pips': 30.0, 'tp_mode': 'opposite', 'min_range_pips': 80.0, 'max_range_pips': 250.0, 'min_daily_atr': 0}. Best is trial 3 with value: -10.0.
[I 2026-05-29 01:53:20,028] Trial 27 finished with value: -10.0 and parameters: {'sweep_pips': 40.0, 'reentry_pips': 0.0, 'stop_buffer_pips': 30.0, 'tp_mode': 'opposite', 'min_range_pips': 120.0, 'max_range_pips': 350.0, 'min_daily_atr': 300}. Best is trial 3 with value: -10.0.
[I 2026-05-29 01:53:20,030] Trial 28 finished with value: -10.0 and parameters: {'sweep_pips': 30.0, 'reentry_pips': 20.0, 'stop_buffer_pips': 30.0, 'tp_mode': 'opposite', 'min_range_pips': 80.0, 'max_range_pips': 250.0, 'min_daily_atr': 0}. Best is trial 3 with value: -10.0.
C:\Users\הלל\Desktop\algo projects\trading-research-factory\walk forward engine\.venv\lib\site-packages\optuna\samplers\_tpe\sampler.py:319: ExperimentalWarning: ``multivariate`` option is an experimental feature. The interface can change in the future.
  warnings.warn(
[I 2026-05-29 01:53:20,404] A new study created in memory with name: no-name-e7d4ec88-dc0e-4a78-8253-d703f5fae1cb
C:\Users\הלל\Desktop\algo projects\trading-research-factory\walk forward engine\.venv\lib\site-packages\optuna\distributions.py:700: UserWarning: The distribution is specified by [0, 500] and step=300, but the range is not divisible by `step`. It will be replaced by [0, 300].
  warnings.warn(
C:\Users\הלל\Desktop\algo projects\trading-research-factory\walk forward engine\.venv\lib\site-packages\optuna\distributions.py:700: UserWarning: The distribution is specified by [0, 500] and step=300, but the range is not divisible by `step`. It will be replaced by [0, 300].
  warnings.warn(
C:\Users\הלל\Desktop\algo projects\trading-research-factory\walk forward engine\.venv\lib\site-packages\optuna\distributions.py:700: UserWarning: The distribution is specified by [0, 500] and step=300, but the range is not divisible by `step`. It will be replaced by [0, 300].
  warnings.warn(
C:\Users\הלל\Desktop\algo projects\trading-research-factory\walk forward engine\.venv\lib\site-packages\optuna\distributions.py:700: UserWarning: The distribution is specified by [0, 500] and step=300, but the range is not divisible by `step`. It will be replaced by [0, 300].
  warnings.warn(
C:\Users\הלל\Desktop\algo projects\trading-research-factory\walk forward engine\.venv\lib\site-packages\optuna\distributions.py:700: UserWarning: The distribution is specified by [0, 500] and step=300, but the range is not divisible by `step`. It will be replaced by [0, 300].
  warnings.warn(
C:\Users\הלל\Desktop\algo projects\trading-research-factory\walk forward engine\.venv\lib\site-packages\optuna\distributions.py:700: UserWarning: The distribution is specified by [0, 500] and step=300, but the range is not divisible by `step`. It will be replaced by [0, 300].
  warnings.warn(
C:\Users\הלל\Desktop\algo projects\trading-research-factory\walk forward engine\.venv\lib\site-packages\optuna\distributions.py:700: UserWarning: The distribution is specified by [0, 500] and step=300, but the range is not divisible by `step`. It will be replaced by [0, 300].
  warnings.warn(
[I 2026-05-29 01:53:21,246] Trial 0 finished with value: -10.0 and parameters: {'sweep_pips': 40.0, 'reentry_pips': 0.0, 'stop_buffer_pips': 40.0, 'tp_mode': 'mid', 'min_range_pips': 120.0, 'max_range_pips': 350.0, 'min_daily_atr': 0}. Best is trial 0 with value: -10.0.
[I 2026-05-29 01:53:21,300] Trial 3 finished with value: -10.0 and parameters: {'sweep_pips': 40.0, 'reentry_pips': 10.0, 'stop_buffer_pips': 40.0, 'tp_mode': 'opposite', 'min_range_pips': 80.0, 'max_range_pips': 350.0, 'min_daily_atr': 0}. Best is trial 0 with value: -10.0.
C:\Users\הלל\Desktop\algo projects\trading-research-factory\walk forward engine\.venv\lib\site-packages\optuna\distributions.py:700: UserWarning: The distribution is specified by [0, 500] and step=300, but the range is not divisible by `step`. It will be replaced by [0, 300].
  warnings.warn(
C:\Users\הלל\Desktop\algo projects\trading-research-factory\walk forward engine\.venv\lib\site-packages\optuna\distributions.py:700: UserWarning: The distribution is specified by [0, 500] and step=300, but the range is not divisible by `step`. It will be replaced by [0, 300].
  warnings.warn(
[I 2026-05-29 01:53:21,479] Trial 1 finished with value: -10.0 and parameters: {'sweep_pips': 50.0, 'reentry_pips': 10.0, 'stop_buffer_pips': 30.0, 'tp_mode': 'mid', 'min_range_pips': 80.0, 'max_range_pips': 250.0, 'min_daily_atr': 300}. Best is trial 0 with value: -10.0.
C:\Users\הלל\Desktop\algo projects\trading-research-factory\walk forward engine\.venv\lib\site-packages\optuna\distributions.py:700: UserWarning: The distribution is specified by [0, 500] and step=300, but the range is not divisible by `step`. It will be replaced by [0, 300].
  warnings.warn(
[I 2026-05-29 01:53:21,567] Trial 6 finished with value: -10.0 and parameters: {'sweep_pips': 50.0, 'reentry_pips': 10.0, 'stop_buffer_pips': 40.0, 'tp_mode': 'mid', 'min_range_pips': 100.0, 'max_range_pips': 250.0, 'min_daily_atr': 300}. Best is trial 0 with value: -10.0.
[I 2026-05-29 01:53:21,595] Trial 2 finished with value: -10.0 and parameters: {'sweep_pips': 30.0, 'reentry_pips': 0.0, 'stop_buffer_pips': 30.0, 'tp_mode': 'mid', 'min_range_pips': 80.0, 'max_range_pips': 350.0, 'min_daily_atr': 0}. Best is trial 0 with value: -10.0.
C:\Users\הלל\Desktop\algo projects\trading-research-factory\walk forward engine\.venv\lib\site-packages\optuna\distributions.py:700: UserWarning: The distribution is specified by [0, 500] and step=300, but the range is not divisible by `step`. It will be replaced by [0, 300].
  warnings.warn(
C:\Users\הלל\Desktop\algo projects\trading-research-factory\walk forward engine\.venv\lib\site-packages\optuna\distributions.py:700: UserWarning: The distribution is specified by [0, 500] and step=300, but the range is not divisible by `step`. It will be replaced by [0, 300].
  warnings.warn(
[I 2026-05-29 01:53:21,655] Trial 4 finished with value: -10.0 and parameters: {'sweep_pips': 40.0, 'reentry_pips': 20.0, 'stop_buffer_pips': 40.0, 'tp_mode': 'mid', 'min_range_pips': 80.0, 'max_range_pips': 250.0, 'min_daily_atr': 300}. Best is trial 0 with value: -10.0.
[I 2026-05-29 01:53:21,677] Trial 5 finished with value: -10.0 and parameters: {'sweep_pips': 40.0, 'reentry_pips': 10.0, 'stop_buffer_pips': 30.0, 'tp_mode': 'mid', 'min_range_pips': 80.0, 'max_range_pips': 350.0, 'min_daily_atr': 300}. Best is trial 0 with value: -10.0.
[I 2026-05-29 01:53:21,715] Trial 7 finished with value: -10.0 and parameters: {'sweep_pips': 20.0, 'reentry_pips': 0.0, 'stop_buffer_pips': 20.0, 'tp_mode': 'opposite', 'min_range_pips': 80.0, 'max_range_pips': 300.0, 'min_daily_atr': 300}. Best is trial 0 with value: -10.0.
C:\Users\הלל\Desktop\algo projects\trading-research-factory\walk forward engine\.venv\lib\site-packages\optuna\distributions.py:700: UserWarning: The distribution is specified by [0, 500] and step=300, but the range is not divisible by `step`. It will be replaced by [0, 300].
  warnings.warn(
C:\Users\הלל\Desktop\algo projects\trading-research-factory\walk forward engine\.venv\lib\site-packages\optuna\distributions.py:700: UserWarning: The distribution is specified by [0, 500] and step=300, but the range is not divisible by `step`. It will be replaced by [0, 300].
  warnings.warn(
[I 2026-05-29 01:53:22,287] Trial 8 finished with value: -10.0 and parameters: {'sweep_pips': 50.0, 'reentry_pips': 10.0, 'stop_buffer_pips': 20.0, 'tp_mode': 'opposite', 'min_range_pips': 80.0, 'max_range_pips': 350.0, 'min_daily_atr': 300}. Best is trial 0 with value: -10.0.
C:\Users\הלל\Desktop\algo projects\trading-research-factory\walk forward engine\.venv\lib\site-packages\optuna\distributions.py:700: UserWarning: The distribution is specified by [0, 500] and step=300, but the range is not divisible by `step`. It will be replaced by [0, 300].
  warnings.warn(
[I 2026-05-29 01:53:22,442] Trial 10 finished with value: -10.0 and parameters: {'sweep_pips': 20.0, 'reentry_pips': 10.0, 'stop_buffer_pips': 30.0, 'tp_mode': 'mid', 'min_range_pips': 80.0, 'max_range_pips': 350.0, 'min_daily_atr': 0}. Best is trial 0 with value: -10.0.
[I 2026-05-29 01:53:22,451] Trial 9 finished with value: -10.0 and parameters: {'sweep_pips': 50.0, 'reentry_pips': 20.0, 'stop_buffer_pips': 20.0, 'tp_mode': 'opposite', 'min_range_pips': 100.0, 'max_range_pips': 350.0, 'min_daily_atr': 0}. Best is trial 0 with value: -10.0.
[I 2026-05-29 01:53:22,493] Trial 11 finished with value: -10.0 and parameters: {'sweep_pips': 30.0, 'reentry_pips': 10.0, 'stop_buffer_pips': 30.0, 'tp_mode': 'mid', 'min_range_pips': 100.0, 'max_range_pips': 300.0, 'min_daily_atr': 0}. Best is trial 0 with value: -10.0.
[I 2026-05-29 01:53:22,562] Trial 12 finished with value: -10.0 and parameters: {'sweep_pips': 20.0, 'reentry_pips': 0.0, 'stop_buffer_pips': 40.0, 'tp_mode': 'mid', 'min_range_pips': 80.0, 'max_range_pips': 350.0, 'min_daily_atr': 300}. Best is trial 0 with value: -10.0.
C:\Users\הלל\Desktop\algo projects\trading-research-factory\walk forward engine\.venv\lib\site-packages\optuna\distributions.py:700: UserWarning: The distribution is specified by [0, 500] and step=300, but the range is not divisible by `step`. It will be replaced by [0, 300].
  warnings.warn(
C:\Users\הלל\Desktop\algo projects\trading-research-factory\walk forward engine\.venv\lib\site-packages\optuna\distributions.py:700: UserWarning: The distribution is specified by [0, 500] and step=300, but the range is not divisible by `step`. It will be replaced by [0, 300].
  warnings.warn(
C:\Users\הלל\Desktop\algo projects\trading-research-factory\walk forward engine\.venv\lib\site-packages\optuna\distributions.py:700: UserWarning: The distribution is specified by [0, 500] and step=300, but the range is not divisible by `step`. It will be replaced by [0, 300].
  warnings.warn(
[I 2026-05-29 01:53:22,938] Trial 13 finished with value: -10.0 and parameters: {'sweep_pips': 50.0, 'reentry_pips': 0.0, 'stop_buffer_pips': 20.0, 'tp_mode': 'opposite', 'min_range_pips': 120.0, 'max_range_pips': 350.0, 'min_daily_atr': 300}. Best is trial 0 with value: -10.0.
[I 2026-05-29 01:53:22,992] Trial 15 finished with value: -10.0 and parameters: {'sweep_pips': 20.0, 'reentry_pips': 20.0, 'stop_buffer_pips': 30.0, 'tp_mode': 'opposite', 'min_range_pips': 120.0, 'max_range_pips': 250.0, 'min_daily_atr': 0}. Best is trial 0 with value: -10.0.
[I 2026-05-29 01:53:23,022] Trial 14 finished with value: -10.0 and parameters: {'sweep_pips': 20.0, 'reentry_pips': 10.0, 'stop_buffer_pips': 20.0, 'tp_mode': 'mid', 'min_range_pips': 100.0, 'max_range_pips': 300.0, 'min_daily_atr': 0}. Best is trial 0 with value: -10.0.
C:\Users\הלל\Desktop\algo projects\trading-research-factory\walk forward engine\.venv\lib\site-packages\optuna\distributions.py:700: UserWarning: The distribution is specified by [0, 500] and step=300, but the range is not divisible by `step`. It will be replaced by [0, 300].
  warnings.warn(
C:\Users\הלל\Desktop\algo projects\trading-research-factory\walk forward engine\.venv\lib\site-packages\optuna\distributions.py:700: UserWarning: The distribution is specified by [0, 500] and step=300, but the range is not divisible by `step`. It will be replaced by [0, 300].
  warnings.warn(
C:\Users\הלל\Desktop\algo projects\trading-research-factory\walk forward engine\.venv\lib\site-packages\optuna\distributions.py:700: UserWarning: The distribution is specified by [0, 500] and step=300, but the range is not divisible by `step`. It will be replaced by [0, 300].
  warnings.warn(
C:\Users\הלל\Desktop\algo projects\trading-research-factory\walk forward engine\.venv\lib\site-packages\optuna\distributions.py:700: UserWarning: The distribution is specified by [0, 500] and step=300, but the range is not divisible by `step`. It will be replaced by [0, 300].
  warnings.warn(
[I 2026-05-29 01:53:23,749] Trial 16 finished with value: -10.0 and parameters: {'sweep_pips': 30.0, 'reentry_pips': 10.0, 'stop_buffer_pips': 20.0, 'tp_mode': 'mid', 'min_range_pips': 120.0, 'max_range_pips': 300.0, 'min_daily_atr': 300}. Best is trial 0 with value: -10.0.
[I 2026-05-29 01:53:23,970] Trial 19 finished with value: -10.0 and parameters: {'sweep_pips': 50.0, 'reentry_pips': 10.0, 'stop_buffer_pips': 20.0, 'tp_mode': 'mid', 'min_range_pips': 80.0, 'max_range_pips': 250.0, 'min_daily_atr': 300}. Best is trial 0 with value: -10.0.
C:\Users\הלל\Desktop\algo projects\trading-research-factory\walk forward engine\.venv\lib\site-packages\optuna\distributions.py:700: UserWarning: The distribution is specified by [0, 500] and step=300, but the range is not divisible by `step`. It will be replaced by [0, 300].
  warnings.warn(
[I 2026-05-29 01:53:24,062] Trial 18 finished with value: -10.0 and parameters: {'sweep_pips': 50.0, 'reentry_pips': 0.0, 'stop_buffer_pips': 40.0, 'tp_mode': 'mid', 'min_range_pips': 120.0, 'max_range_pips': 350.0, 'min_daily_atr': 0}. Best is trial 0 with value: -10.0.
[I 2026-05-29 01:53:24,081] Trial 17 finished with value: -10.0 and parameters: {'sweep_pips': 40.0, 'reentry_pips': 0.0, 'stop_buffer_pips': 40.0, 'tp_mode': 'mid', 'min_range_pips': 120.0, 'max_range_pips': 350.0, 'min_daily_atr': 0}. Best is trial 0 with value: -10.0.
[I 2026-05-29 01:53:24,309] Trial 20 finished with value: -10.0 and parameters: {'sweep_pips': 40.0, 'reentry_pips': 0.0, 'stop_buffer_pips': 40.0, 'tp_mode': 'mid', 'min_range_pips': 120.0, 'max_range_pips': 350.0, 'min_daily_atr': 0}. Best is trial 0 with value: -10.0.
[I 2026-05-29 01:53:24,378] Trial 21 finished with value: -10.0 and parameters: {'sweep_pips': 40.0, 'reentry_pips': 0.0, 'stop_buffer_pips': 40.0, 'tp_mode': 'mid', 'min_range_pips': 120.0, 'max_range_pips': 350.0, 'min_daily_atr': 0}. Best is trial 0 with value: -10.0.
C:\Users\הלל\Desktop\algo projects\trading-research-factory\walk forward engine\.venv\lib\site-packages\optuna\distributions.py:700: UserWarning: The distribution is specified by [0, 500] and step=300, but the range is not divisible by `step`. It will be replaced by [0, 300].
  warnings.warn(
[I 2026-05-29 01:53:24,586] Trial 22 finished with value: -10.0 and parameters: {'sweep_pips': 40.0, 'reentry_pips': 0.0, 'stop_buffer_pips': 40.0, 'tp_mode': 'mid', 'min_range_pips': 120.0, 'max_range_pips': 350.0, 'min_daily_atr': 0}. Best is trial 0 with value: -10.0.
C:\Users\הלל\Desktop\algo projects\trading-research-factory\walk forward engine\.venv\lib\site-packages\optuna\distributions.py:700: UserWarning: The distribution is specified by [0, 500] and step=300, but the range is not divisible by `step`. It will be replaced by [0, 300].
  warnings.warn(
