[I 2026-05-29 01:53:50,918] Trial 0 finished with value: -10.0 and parameters: {'sweep_pips': 20.0, 'reentry_pips': 0.0, 'stop_buffer_pips': 20.0, 'tp_mode': 'mid', 'min_range_pips': 80.0, 'max_range_pips': 300.0, 'min_daily_atr': 300}. Best is trial 6 with value: -10.0.
C:\Users\הלל\Desktop\algo projects\trading-research-factory\walk forward engine\.venv\lib\site-packages\optuna\distributions.py:700: UserWarning: The distribution is specified by [0, 500] and step=300, but the range is not divisible by `step`. It will be replaced by [0, 300].
  warnings.warn(
[I 2026-05-29 01:53:50,944] Trial 2 finished with value: -10.0 and parameters: {'sweep_pips': 20.0, 'reentry_pips': 10.0, 'stop_buffer_pips': 20.0, 'tp_mode': 'opposite', 'min_range_pips': 80.0, 'max_range_pips': 250.0, 'min_daily_atr': 0}. Best is trial 6 with value: -10.0.
[I 2026-05-29 01:53:50,946] Trial 4 finished with value: -10.0 and parameters: {'sweep_pips': 50.0, 'reentry_pips': 0.0, 'stop_buffer_pips': 30.0, 'tp_mode': 'mid', 'min_range_pips': 100.0, 'max_range_pips': 250.0, 'min_daily_atr': 0}. Best is trial 6 with value: -10.0.
C:\Users\הלל\Desktop\algo projects\trading-research-factory\walk forward engine\.venv\lib\site-packages\optuna\distributions.py:700: UserWarning: The distribution is specified by [0, 500] and step=300, but the range is not divisible by `step`. It will be replaced by [0, 300].
  warnings.warn(
[I 2026-05-29 01:53:51,006] Trial 5 finished with value: -10.0 and parameters: {'sweep_pips': 40.0, 'reentry_pips': 10.0, 'stop_buffer_pips': 30.0, 'tp_mode': 'opposite', 'min_range_pips': 120.0, 'max_range_pips': 350.0, 'min_daily_atr': 300}. Best is trial 6 with value: -10.0.
C:\Users\הלל\Desktop\algo projects\trading-research-factory\walk forward engine\.venv\lib\site-packages\optuna\distributions.py:700: UserWarning: The distribution is specified by [0, 500] and step=300, but the range is not divisible by `step`. It will be replaced by [0, 300].
  warnings.warn(
C:\Users\הלל\Desktop\algo projects\trading-research-factory\walk forward engine\.venv\lib\site-packages\optuna\distributions.py:700: UserWarning: The distribution is specified by [0, 500] and step=300, but the range is not divisible by `step`. It will be replaced by [0, 300].
  warnings.warn(
C:\Users\הלל\Desktop\algo projects\trading-research-factory\walk forward engine\.venv\lib\site-packages\optuna\distributions.py:700: UserWarning: The distribution is specified by [0, 500] and step=300, but the range is not divisible by `step`. It will be replaced by [0, 300].
  warnings.warn(
C:\Users\הלל\Desktop\algo projects\trading-research-factory\walk forward engine\.venv\lib\site-packages\optuna\distributions.py:700: UserWarning: The distribution is specified by [0, 500] and step=300, but the range is not divisible by `step`. It will be replaced by [0, 300].
  warnings.warn(
[I 2026-05-29 01:53:51,724] Trial 10 finished with value: -10.0 and parameters: {'sweep_pips': 40.0, 'reentry_pips': 0.0, 'stop_buffer_pips': 20.0, 'tp_mode': 'opposite', 'min_range_pips': 100.0, 'max_range_pips': 300.0, 'min_daily_atr': 300}. Best is trial 6 with value: -10.0.
[I 2026-05-29 01:53:51,726] Trial 8 finished with value: -10.0 and parameters: {'sweep_pips': 20.0, 'reentry_pips': 0.0, 'stop_buffer_pips': 30.0, 'tp_mode': 'opposite', 'min_range_pips': 100.0, 'max_range_pips': 250.0, 'min_daily_atr': 300}. Best is trial 6 with value: -10.0.
C:\Users\הלל\Desktop\algo projects\trading-research-factory\walk forward engine\.venv\lib\site-packages\optuna\distributions.py:700: UserWarning: The distribution is specified by [0, 500] and step=300, but the range is not divisible by `step`. It will be replaced by [0, 300].
  warnings.warn(
C:\Users\הלל\Desktop\algo projects\trading-research-factory\walk forward engine\.venv\lib\site-packages\optuna\distributions.py:700: UserWarning: The distribution is specified by [0, 500] and step=300, but the range is not divisible by `step`. It will be replaced by [0, 300].
  warnings.warn(
[I 2026-05-29 01:53:52,116] Trial 12 finished with value: -10.0 and parameters: {'sweep_pips': 40.0, 'reentry_pips': 20.0, 'stop_buffer_pips': 30.0, 'tp_mode': 'opposite', 'min_range_pips': 80.0, 'max_range_pips': 250.0, 'min_daily_atr': 300}. Best is trial 6 with value: -10.0.
[I 2026-05-29 01:53:52,157] Trial 9 finished with value: -10.0 and parameters: {'sweep_pips': 30.0, 'reentry_pips': 20.0, 'stop_buffer_pips': 40.0, 'tp_mode': 'opposite', 'min_range_pips': 120.0, 'max_range_pips': 250.0, 'min_daily_atr': 300}. Best is trial 6 with value: -10.0.
[I 2026-05-29 01:53:52,169] Trial 14 finished with value: -10.0 and parameters: {'sweep_pips': 40.0, 'reentry_pips': 10.0, 'stop_buffer_pips': 20.0, 'tp_mode': 'mid', 'min_range_pips': 100.0, 'max_range_pips': 350.0, 'min_daily_atr': 0}. Best is trial 6 with value: -10.0.
[I 2026-05-29 01:53:52,181] Trial 11 finished with value: -10.0 and parameters: {'sweep_pips': 50.0, 'reentry_pips': 10.0, 'stop_buffer_pips': 30.0, 'tp_mode': 'mid', 'min_range_pips': 100.0, 'max_range_pips': 350.0, 'min_daily_atr': 0}. Best is trial 6 with value: -10.0.
[I 2026-05-29 01:53:52,189] Trial 15 finished with value: -10.0 and parameters: {'sweep_pips': 20.0, 'reentry_pips': 20.0, 'stop_buffer_pips': 20.0, 'tp_mode': 'opposite', 'min_range_pips': 120.0, 'max_range_pips': 350.0, 'min_daily_atr': 300}. Best is trial 6 with value: -10.0.
[I 2026-05-29 01:53:52,200] Trial 13 finished with value: -10.0 and parameters: {'sweep_pips': 20.0, 'reentry_pips': 20.0, 'stop_buffer_pips': 20.0, 'tp_mode': 'opposite', 'min_range_pips': 120.0, 'max_range_pips': 300.0, 'min_daily_atr': 300}. Best is trial 6 with value: -10.0.
C:\Users\הלל\Desktop\algo projects\trading-research-factory\walk forward engine\.venv\lib\site-packages\optuna\distributions.py:700: UserWarning: The distribution is specified by [0, 500] and step=300, but the range is not divisible by `step`. It will be replaced by [0, 300].
  warnings.warn(
C:\Users\הלל\Desktop\algo projects\trading-research-factory\walk forward engine\.venv\lib\site-packages\optuna\distributions.py:700: UserWarning: The distribution is specified by [0, 500] and step=300, but the range is not divisible by `step`. It will be replaced by [0, 300].
  warnings.warn(
C:\Users\הלל\Desktop\algo projects\trading-research-factory\walk forward engine\.venv\lib\site-packages\optuna\distributions.py:700: UserWarning: The distribution is specified by [0, 500] and step=300, but the range is not divisible by `step`. It will be replaced by [0, 300].
  warnings.warn(
C:\Users\הלל\Desktop\algo projects\trading-research-factory\walk forward engine\.venv\lib\site-packages\optuna\distributions.py:700: UserWarning: The distribution is specified by [0, 500] and step=300, but the range is not divisible by `step`. It will be replaced by [0, 300].
  warnings.warn(
C:\Users\הלל\Desktop\algo projects\trading-research-factory\walk forward engine\.venv\lib\site-packages\optuna\distributions.py:700: UserWarning: The distribution is specified by [0, 500] and step=300, but the range is not divisible by `step`. It will be replaced by [0, 300].
  warnings.warn(
[I 2026-05-29 01:53:53,346] Trial 17 finished with value: -10.0 and parameters: {'sweep_pips': 20.0, 'reentry_pips': 10.0, 'stop_buffer_pips': 20.0, 'tp_mode': 'mid', 'min_range_pips': 100.0, 'max_range_pips': 300.0, 'min_daily_atr': 300}. Best is trial 6 with value: -10.0.
[I 2026-05-29 01:53:53,684] Trial 16 finished with value: -10.0 and parameters: {'sweep_pips': 30.0, 'reentry_pips': 0.0, 'stop_buffer_pips': 30.0, 'tp_mode': 'mid', 'min_range_pips': 80.0, 'max_range_pips': 300.0, 'min_daily_atr': 300}. Best is trial 6 with value: -10.0.
C:\Users\הלל\Desktop\algo projects\trading-research-factory\walk forward engine\.venv\lib\site-packages\optuna\distributions.py:700: UserWarning: The distribution is specified by [0, 500] and step=300, but the range is not divisible by `step`. It will be replaced by [0, 300].
  warnings.warn(
[I 2026-05-29 01:53:53,921] Trial 20 finished with value: -10.0 and parameters: {'sweep_pips': 30.0, 'reentry_pips': 0.0, 'stop_buffer_pips': 20.0, 'tp_mode': 'mid', 'min_range_pips': 80.0, 'max_range_pips': 350.0, 'min_daily_atr': 300}. Best is trial 6 with value: -10.0.
[I 2026-05-29 01:53:53,958] Trial 19 finished with value: -10.0 and parameters: {'sweep_pips': 50.0, 'reentry_pips': 10.0, 'stop_buffer_pips': 40.0, 'tp_mode': 'mid', 'min_range_pips': 80.0, 'max_range_pips': 250.0, 'min_daily_atr': 300}. Best is trial 6 with value: -10.0.
[I 2026-05-29 01:53:53,965] Trial 18 finished with value: -10.0 and parameters: {'sweep_pips': 20.0, 'reentry_pips': 0.0, 'stop_buffer_pips': 20.0, 'tp_mode': 'mid', 'min_range_pips': 80.0, 'max_range_pips': 300.0, 'min_daily_atr': 300}. Best is trial 6 with value: -10.0.
C:\Users\הלל\Desktop\algo projects\trading-research-factory\walk forward engine\.venv\lib\site-packages\optuna\distributions.py:700: UserWarning: The distribution is specified by [0, 500] and step=300, but the range is not divisible by `step`. It will be replaced by [0, 300].
  warnings.warn(
[I 2026-05-29 01:53:54,054] Trial 23 finished with value: -10.0 and parameters: {'sweep_pips': 20.0, 'reentry_pips': 0.0, 'stop_buffer_pips': 20.0, 'tp_mode': 'mid', 'min_range_pips': 80.0, 'max_range_pips': 300.0, 'min_daily_atr': 300}. Best is trial 6 with value: -10.0.
[I 2026-05-29 01:53:54,070] Trial 21 finished with value: -10.0 and parameters: {'sweep_pips': 20.0, 'reentry_pips': 0.0, 'stop_buffer_pips': 30.0, 'tp_mode': 'mid', 'min_range_pips': 80.0, 'max_range_pips': 300.0, 'min_daily_atr': 300}. Best is trial 6 with value: -10.0.
[I 2026-05-29 01:53:54,146] Trial 22 finished with value: -10.0 and parameters: {'sweep_pips': 20.0, 'reentry_pips': 0.0, 'stop_buffer_pips': 30.0, 'tp_mode': 'mid', 'min_range_pips': 80.0, 'max_range_pips': 300.0, 'min_daily_atr': 300}. Best is trial 6 with value: -10.0.
C:\Users\הלל\Desktop\algo projects\trading-research-factory\walk forward engine\.venv\lib\site-packages\optuna\distributions.py:700: UserWarning: The distribution is specified by [0, 500] and step=300, but the range is not divisible by `step`. It will be replaced by [0, 300].
  warnings.warn(
C:\Users\הלל\Desktop\algo projects\trading-research-factory\walk forward engine\.venv\lib\site-packages\optuna\distributions.py:700: UserWarning: The distribution is specified by [0, 500] and step=300, but the range is not divisible by `step`. It will be replaced by [0, 300].
  warnings.warn(
[I 2026-05-29 01:53:54,642] Trial 24 finished with value: -10.0 and parameters: {'sweep_pips': 50.0, 'reentry_pips': 10.0, 'stop_buffer_pips': 40.0, 'tp_mode': 'mid', 'min_range_pips': 80.0, 'max_range_pips': 250.0, 'min_daily_atr': 300}. Best is trial 6 with value: -10.0.
[I 2026-05-29 01:53:54,714] Trial 25 finished with value: -10.0 and parameters: {'sweep_pips': 50.0, 'reentry_pips': 10.0, 'stop_buffer_pips': 40.0, 'tp_mode': 'mid', 'min_range_pips': 100.0, 'max_range_pips': 250.0, 'min_daily_atr': 300}. Best is trial 6 with value: -10.0.
C:\Users\הלל\Desktop\algo projects\trading-research-factory\walk forward engine\.venv\lib\site-packages\optuna\distributions.py:700: UserWarning: The distribution is specified by [0, 500] and step=300, but the range is not divisible by `step`. It will be replaced by [0, 300].
  warnings.warn(
C:\Users\הלל\Desktop\algo projects\trading-research-factory\walk forward engine\.venv\lib\site-packages\optuna\distributions.py:700: UserWarning: The distribution is specified by [0, 500] and step=300, but the range is not divisible by `step`. It will be replaced by [0, 300].
  warnings.warn(
[I 2026-05-29 01:53:55,068] Trial 28 finished with value: -10.0 and parameters: {'sweep_pips': 20.0, 'reentry_pips': 10.0, 'stop_buffer_pips': 20.0, 'tp_mode': 'opposite', 'min_range_pips': 80.0, 'max_range_pips': 250.0, 'min_daily_atr': 0}. Best is trial 6 with value: -10.0.
[I 2026-05-29 01:53:55,072] Trial 26 finished with value: -10.0 and parameters: {'sweep_pips': 50.0, 'reentry_pips': 10.0, 'stop_buffer_pips': 30.0, 'tp_mode': 'mid', 'min_range_pips': 80.0, 'max_range_pips': 250.0, 'min_daily_atr': 300}. Best is trial 6 with value: -10.0.
[I 2026-05-29 01:53:55,199] Trial 27 finished with value: -10.0 and parameters: {'sweep_pips': 20.0, 'reentry_pips': 20.0, 'stop_buffer_pips': 20.0, 'tp_mode': 'opposite', 'min_range_pips': 80.0, 'max_range_pips': 250.0, 'min_daily_atr': 0}. Best is trial 6 with value: -10.0.
[I 2026-05-29 01:53:55,202] Trial 29 finished with value: -10.0 and parameters: {'sweep_pips': 30.0, 'reentry_pips': 0.0, 'stop_buffer_pips': 20.0, 'tp_mode': 'opposite', 'min_range_pips': 80.0, 'max_range_pips': 250.0, 'min_daily_atr': 0}. Best is trial 6 with value: -10.0.
C:\Users\הלל\Desktop\algo projects\trading-research-factory\walk forward engine\.venv\lib\site-packages\optuna\samplers\_tpe\sampler.py:319: ExperimentalWarning: ``multivariate`` option is an experimental feature. The interface can change in the future.
  warnings.warn(
[I 2026-05-29 01:53:55,439] A new study created in memory with name: no-name-1f679685-796c-43c0-a172-60c46dd8f218
C:\Users\הלל\Desktop\algo projects\trading-research-factory\walk forward engine\.venv\lib\site-packages\optuna\distributions.py:700: UserWarning: The distribution is specified by [0, 500] and step=300, but the range is not divisible by `step`. It will be replaced by [0, 300].
  warnings.warn(
C:\Users\הלל\Desktop\algo projects\trading-research-factory\walk forward engine\.venv\lib\site-packages\optuna\distributions.py:700: UserWarning: The distribution is specified by [0, 500] and step=300, but the range is not divisible by `step`. It will be replaced by [0, 300].
  warnings.warn(
C:\Users\הלל\Desktop\algo projects\trading-research-factory\walk forward engine\.venv\lib\site-packages\optuna\distributions.py:700: UserWarning: The distribution is specified by [0, 500] and step=300, but the range is not divisible by `step`. It will be replaced by [0, 300].
  warnings.warn(
C:\Users\הלל\Desktop\algo projects\trading-research-factory\walk forward engine\.venv\lib\site-packages\optuna\distributions.py:700: UserWarning: The distribution is specified by [0, 500] and step=300, but the range is not divisible by `step`. It will be replaced by [0, 300].
  warnings.warn(
C:\Users\הלל\Desktop\algo projects\trading-research-factory\walk forward engine\.venv\lib\site-packages\optuna\distributions.py:700: UserWarning: The distribution is specified by [0, 500] and step=300, but the range is not divisible by `step`. It will be replaced by [0, 300].
  warnings.warn(
C:\Users\הלל\Desktop\algo projects\trading-research-factory\walk forward engine\.venv\lib\site-packages\optuna\distributions.py:700: UserWarning: The distribution is specified by [0, 500] and step=300, but the range is not divisible by `step`. It will be replaced by [0, 300].
  warnings.warn(
C:\Users\הלל\Desktop\algo projects\trading-research-factory\walk forward engine\.venv\lib\site-packages\optuna\distributions.py:700: UserWarning: The distribution is specified by [0, 500] and step=300, but the range is not divisible by `step`. It will be replaced by [0, 300].
  warnings.warn(
[I 2026-05-29 01:53:56,313] Trial 1 finished with value: -10.0 and parameters: {'sweep_pips': 30.0, 'reentry_pips': 0.0, 'stop_buffer_pips': 40.0, 'tp_mode': 'mid', 'min_range_pips': 120.0, 'max_range_pips': 250.0, 'min_daily_atr': 0}. Best is trial 1 with value: -10.0.
[I 2026-05-29 01:53:56,397] Trial 5 finished with value: -10.0 and parameters: {'sweep_pips': 50.0, 'reentry_pips': 0.0, 'stop_buffer_pips': 30.0, 'tp_mode': 'mid', 'min_range_pips': 100.0, 'max_range_pips': 350.0, 'min_daily_atr': 0}. Best is trial 1 with value: -10.0.
[I 2026-05-29 01:53:56,398] Trial 0 finished with value: -10.0 and parameters: {'sweep_pips': 50.0, 'reentry_pips': 10.0, 'stop_buffer_pips': 40.0, 'tp_mode': 'opposite', 'min_range_pips': 120.0, 'max_range_pips': 350.0, 'min_daily_atr': 300}. Best is trial 1 with value: -10.0.
C:\Users\הלל\Desktop\algo projects\trading-research-factory\walk forward engine\.venv\lib\site-packages\optuna\distributions.py:700: UserWarning: The distribution is specified by [0, 500] and step=300, but the range is not divisible by `step`. It will be replaced by [0, 300].
  warnings.warn(
[I 2026-05-29 01:53:56,459] Trial 2 finished with value: -10.0 and parameters: {'sweep_pips': 50.0, 'reentry_pips': 20.0, 'stop_buffer_pips': 30.0, 'tp_mode': 'opposite', 'min_range_pips': 100.0, 'max_range_pips': 250.0, 'min_daily_atr': 300}. Best is trial 1 with value: -10.0.
C:\Users\הלל\Desktop\algo projects\trading-research-factory\walk forward engine\.venv\lib\site-packages\optuna\distributions.py:700: UserWarning: The distribution is specified by [0, 500] and step=300, but the range is not divisible by `step`. It will be replaced by [0, 300].
  warnings.warn(
C:\Users\הלל\Desktop\algo projects\trading-research-factory\walk forward engine\.venv\lib\site-packages\optuna\distributions.py:700: UserWarning: The distribution is specified by [0, 500] and step=300, but the range is not divisible by `step`. It will be replaced by [0, 300].
  warnings.warn(
[I 2026-05-29 01:53:56,542] Trial 6 finished with value: -10.0 and parameters: {'sweep_pips': 20.0, 'reentry_pips': 20.0, 'stop_buffer_pips': 30.0, 'tp_mode': 'opposite', 'min_range_pips': 120.0, 'max_range_pips': 300.0, 'min_daily_atr': 0}. Best is trial 1 with value: -10.0.
[I 2026-05-29 01:53:56,555] Trial 4 finished with value: -10.0 and parameters: {'sweep_pips': 40.0, 'reentry_pips': 0.0, 'stop_buffer_pips': 30.0, 'tp_mode': 'mid', 'min_range_pips': 120.0, 'max_range_pips': 350.0, 'min_daily_atr': 300}. Best is trial 1 with value: -10.0.
[I 2026-05-29 01:53:56,561] Trial 3 finished with value: -10.0 and parameters: {'sweep_pips': 40.0, 'reentry_pips': 20.0, 'stop_buffer_pips': 40.0, 'tp_mode': 'opposite', 'min_range_pips': 100.0, 'max_range_pips': 250.0, 'min_daily_atr': 300}. Best is trial 1 with value: -10.0.
C:\Users\הלל\Desktop\algo projects\trading-research-factory\walk forward engine\.venv\lib\site-packages\optuna\distributions.py:700: UserWarning: The distribution is specified by [0, 500] and step=300, but the range is not divisible by `step`. It will be replaced by [0, 300].
  warnings.warn(
C:\Users\הלל\Desktop\algo projects\trading-research-factory\walk forward engine\.venv\lib\site-packages\optuna\distributions.py:700: UserWarning: The distribution is specified by [0, 500] and step=300, but the range is not divisible by `step`. It will be replaced by [0, 300].
  warnings.warn(
C:\Users\הלל\Desktop\algo projects\trading-research-factory\walk forward engine\.venv\lib\site-packages\optuna\distributions.py:700: UserWarning: The distribution is specified by [0, 500] and step=300, but the range is not divisible by `step`. It will be replaced by [0, 300].
  warnings.warn(
[I 2026-05-29 01:53:56,898] Trial 7 finished with value: -10.0 and parameters: {'sweep_pips': 20.0, 'reentry_pips': 20.0, 'stop_buffer_pips': 30.0, 'tp_mode': 'opposite', 'min_range_pips': 120.0, 'max_range_pips': 350.0, 'min_daily_atr': 300}. Best is trial 1 with value: -10.0.
C:\Users\הלל\Desktop\algo projects\trading-research-factory\walk forward engine\.venv\lib\site-packages\optuna\distributions.py:700: UserWarning: The distribution is specified by [0, 500] and step=300, but the range is not divisible by `step`. It will be replaced by [0, 300].
  warnings.warn(
[I 2026-05-29 01:53:57,365] Trial 9 finished with value: -10.0 and parameters: {'sweep_pips': 20.0, 'reentry_pips': 10.0, 'stop_buffer_pips': 20.0, 'tp_mode': 'mid', 'min_range_pips': 120.0, 'max_range_pips': 300.0, 'min_daily_atr': 300}. Best is trial 1 with value: -10.0.
[I 2026-05-29 01:53:57,407] Trial 8 finished with value: -10.0 and parameters: {'sweep_pips': 20.0, 'reentry_pips': 10.0, 'stop_buffer_pips': 40.0, 'tp_mode': 'opposite', 'min_range_pips': 80.0, 'max_range_pips': 300.0, 'min_daily_atr': 0}. Best is trial 1 with value: -10.0.
[I 2026-05-29 01:53:57,496] Trial 10 finished with value: -10.0 and parameters: {'sweep_pips': 20.0, 'reentry_pips': 10.0, 'stop_buffer_pips': 40.0, 'tp_mode': 'opposite', 'min_range_pips': 80.0, 'max_range_pips': 350.0, 'min_daily_atr': 0}. Best is trial 1 with value: -10.0.
[I 2026-05-29 01:53:57,531] Trial 12 finished with value: -10.0 and parameters: {'sweep_pips': 30.0, 'reentry_pips': 0.0, 'stop_buffer_pips': 30.0, 'tp_mode': 'mid', 'min_range_pips': 100.0, 'max_range_pips': 300.0, 'min_daily_atr': 300}. Best is trial 1 with value: -10.0.
[I 2026-05-29 01:53:57,568] Trial 14 finished with value: -10.0 and parameters: {'sweep_pips': 20.0, 'reentry_pips': 10.0, 'stop_buffer_pips': 30.0, 'tp_mode': 'opposite', 'min_range_pips': 100.0, 'max_range_pips': 250.0, 'min_daily_atr': 300}. Best is trial 1 with value: -10.0.
[I 2026-05-29 01:53:57,626] Trial 13 finished with value: -10.0 and parameters: {'sweep_pips': 40.0, 'reentry_pips': 0.0, 'stop_buffer_pips': 20.0, 'tp_mode': 'opposite', 'min_range_pips': 120.0, 'max_range_pips': 350.0, 'min_daily_atr': 300}. Best is trial 1 with value: -10.0.
C:\Users\הלל\Desktop\algo projects\trading-research-factory\walk forward engine\.venv\lib\site-packages\optuna\distributions.py:700: UserWarning: The distribution is specified by [0, 500] and step=300, but the range is not divisible by `step`. It will be replaced by [0, 300].
  warnings.warn(
