[I 2026-06-01 23:08:31,849] Trial 11 finished with value: -10.0 and parameters: {'pre_momentum_lookback': 4, 'momentum_threshold': 0.00030000000000000003, 'volume_lookback': 96, 'volume_ratio_min': 0.7, 'atr_period': 14, 'vol_lookback': 48, 'vol_ratio_min': 0.7, 'fix_hour_utc': 15, 'post_fix_window_bars': 2, 'max_hold_bars': 12, 'sl_atr_mult': 1.0, 'tp_atr_mult': 1.5, 'direction_mode': 'continuation', 'min_abs_intraday_return': 0.0005}. Best is trial 4 with value: -0.772676541462401.
C:\Users\הלל\Desktop\algo projects\trading-research-factory\walk forward engine\.venv\lib\site-packages\optuna\samplers\_tpe\sampler.py:319: ExperimentalWarning: ``multivariate`` option is an experimental feature. The interface can change in the future.
  warnings.warn(
[I 2026-06-01 23:08:32,118] A new study created in memory with name: no-name-5b11019d-cb8e-4cb9-88cc-7c746fab964c
C:\Users\הלל\Desktop\algo projects\trading-research-factory\walk forward engine\.venv\lib\site-packages\optuna\distributions.py:685: UserWarning: The distribution is specified by [0.00015, 0.0005] and step=5.000000000000002e-05, but the range is not divisible by `step`. It will be replaced by [0.00015, 0.0004500000000000001].
  warnings.warn(
C:\Users\הלל\Desktop\algo projects\trading-research-factory\walk forward engine\.venv\lib\site-packages\optuna\distributions.py:685: UserWarning: The distribution is specified by [0.7, 1.1] and step=0.20000000000000007, but the range is not divisible by `step`. It will be replaced by [0.7, 0.9].
  warnings.warn(
C:\Users\הלל\Desktop\algo projects\trading-research-factory\walk forward engine\.venv\lib\site-packages\optuna\distributions.py:700: UserWarning: The distribution is specified by [10, 20] and step=4, but the range is not divisible by `step`. It will be replaced by [10, 18].
  warnings.warn(
C:\Users\הלל\Desktop\algo projects\trading-research-factory\walk forward engine\.venv\lib\site-packages\optuna\distributions.py:685: UserWarning: The distribution is specified by [0.5, 0.9] and step=0.19999999999999996, but the range is not divisible by `step`. It will be replaced by [0.5, 0.8999999999999999].
  warnings.warn(
C:\Users\הלל\Desktop\algo projects\trading-research-factory\walk forward engine\.venv\lib\site-packages\optuna\distributions.py:685: UserWarning: The distribution is specified by [1.0, 2.0] and step=0.3999999999999999, but the range is not divisible by `step`. It will be replaced by [1.0, 1.7999999999999998].
  warnings.warn(
C:\Users\הלל\Desktop\algo projects\trading-research-factory\walk forward engine\.venv\lib\site-packages\optuna\distributions.py:685: UserWarning: The distribution is specified by [0.5, 0.9] and step=0.19999999999999996, but the range is not divisible by `step`. It will be replaced by [0.5, 0.8999999999999999].
  warnings.warn(
C:\Users\הלל\Desktop\algo projects\trading-research-factory\walk forward engine\.venv\lib\site-packages\optuna\distributions.py:685: UserWarning: The distribution is specified by [0.7, 1.1] and step=0.20000000000000007, but the range is not divisible by `step`. It will be replaced by [0.7, 0.9].
  warnings.warn(
C:\Users\הלל\Desktop\algo projects\trading-research-factory\walk forward engine\.venv\lib\site-packages\optuna\distributions.py:700: UserWarning: The distribution is specified by [10, 20] and step=4, but the range is not divisible by `step`. It will be replaced by [10, 18].
  warnings.warn(
C:\Users\הלל\Desktop\algo projects\trading-research-factory\walk forward engine\.venv\lib\site-packages\optuna\distributions.py:685: UserWarning: The distribution is specified by [0.00015, 0.0005] and step=5.000000000000002e-05, but the range is not divisible by `step`. It will be replaced by [0.00015, 0.0004500000000000001].
  warnings.warn(
C:\Users\הלל\Desktop\algo projects\trading-research-factory\walk forward engine\.venv\lib\site-packages\optuna\distributions.py:685: UserWarning: The distribution is specified by [1.0, 2.0] and step=0.3999999999999999, but the range is not divisible by `step`. It will be replaced by [1.0, 1.7999999999999998].
  warnings.warn(
C:\Users\הלל\Desktop\algo projects\trading-research-factory\walk forward engine\.venv\lib\site-packages\optuna\distributions.py:685: UserWarning: The distribution is specified by [1.0, 2.0] and step=0.3999999999999999, but the range is not divisible by `step`. It will be replaced by [1.0, 1.7999999999999998].
  warnings.warn(
C:\Users\הלל\Desktop\algo projects\trading-research-factory\walk forward engine\.venv\lib\site-packages\optuna\distributions.py:685: UserWarning: The distribution is specified by [1.0, 2.0] and step=0.3999999999999999, but the range is not divisible by `step`. It will be replaced by [1.0, 1.7999999999999998].
  warnings.warn(
[I 2026-06-01 23:08:32,572] Trial 0 finished with value: -10.0 and parameters: {'pre_momentum_lookback': 8, 'momentum_threshold': 0.0002, 'volume_lookback': 48, 'volume_ratio_min': 0.7, 'atr_period': 14, 'vol_lookback': 192, 'vol_ratio_min': 0.5, 'fix_hour_utc': 15, 'post_fix_window_bars': 3, 'max_hold_bars': 4, 'sl_atr_mult': 1.4, 'tp_atr_mult': 1.5, 'direction_mode': 'continuation', 'min_abs_intraday_return': 0.001}. Best is trial 0 with value: -10.0.
C:\Users\הלל\Desktop\algo projects\trading-research-factory\walk forward engine\.venv\lib\site-packages\optuna\distributions.py:685: UserWarning: The distribution is specified by [0.00015, 0.0005] and step=5.000000000000002e-05, but the range is not divisible by `step`. It will be replaced by [0.00015, 0.0004500000000000001].
  warnings.warn(
C:\Users\הלל\Desktop\algo projects\trading-research-factory\walk forward engine\.venv\lib\site-packages\optuna\distributions.py:685: UserWarning: The distribution is specified by [0.7, 1.1] and step=0.20000000000000007, but the range is not divisible by `step`. It will be replaced by [0.7, 0.9].
  warnings.warn(
C:\Users\הלל\Desktop\algo projects\trading-research-factory\walk forward engine\.venv\lib\site-packages\optuna\distributions.py:700: UserWarning: The distribution is specified by [10, 20] and step=4, but the range is not divisible by `step`. It will be replaced by [10, 18].
  warnings.warn(
C:\Users\הלל\Desktop\algo projects\trading-research-factory\walk forward engine\.venv\lib\site-packages\optuna\distributions.py:685: UserWarning: The distribution is specified by [0.5, 0.9] and step=0.19999999999999996, but the range is not divisible by `step`. It will be replaced by [0.5, 0.8999999999999999].
  warnings.warn(
C:\Users\הלל\Desktop\algo projects\trading-research-factory\walk forward engine\.venv\lib\site-packages\optuna\distributions.py:685: UserWarning: The distribution is specified by [1.0, 2.0] and step=0.3999999999999999, but the range is not divisible by `step`. It will be replaced by [1.0, 1.7999999999999998].
  warnings.warn(
[I 2026-06-01 23:08:33,051] Trial 3 finished with value: -10.0 and parameters: {'pre_momentum_lookback': 8, 'momentum_threshold': 0.0002, 'volume_lookback': 192, 'volume_ratio_min': 0.7, 'atr_period': 18, 'vol_lookback': 96, 'vol_ratio_min': 0.5, 'fix_hour_utc': 15, 'post_fix_window_bars': 2, 'max_hold_bars': 4, 'sl_atr_mult': 1.7999999999999998, 'tp_atr_mult': 2.5, 'direction_mode': 'continuation', 'min_abs_intraday_return': 0.001}. Best is trial 0 with value: -10.0.
C:\Users\הלל\Desktop\algo projects\trading-research-factory\walk forward engine\.venv\lib\site-packages\optuna\distributions.py:685: UserWarning: The distribution is specified by [0.00015, 0.0005] and step=5.000000000000002e-05, but the range is not divisible by `step`. It will be replaced by [0.00015, 0.0004500000000000001].
  warnings.warn(
[I 2026-06-01 23:08:33,109] Trial 7 finished with value: -2.222458780295218 and parameters: {'pre_momentum_lookback': 8, 'momentum_threshold': 0.0004000000000000001, 'volume_lookback': 192, 'volume_ratio_min': 0.7, 'atr_period': 18, 'vol_lookback': 192, 'vol_ratio_min': 0.8999999999999999, 'fix_hour_utc': 15, 'post_fix_window_bars': 3, 'max_hold_bars': 12, 'sl_atr_mult': 1.7999999999999998, 'tp_atr_mult': 3.0, 'direction_mode': 'fade', 'min_abs_intraday_return': 0.001}. Best is trial 7 with value: -2.222458780295218.
C:\Users\הלל\Desktop\algo projects\trading-research-factory\walk forward engine\.venv\lib\site-packages\optuna\distributions.py:685: UserWarning: The distribution is specified by [0.7, 1.1] and step=0.20000000000000007, but the range is not divisible by `step`. It will be replaced by [0.7, 0.9].
  warnings.warn(
[I 2026-06-01 23:08:33,140] Trial 1 finished with value: -3.1395296344067836 and parameters: {'pre_momentum_lookback': 8, 'momentum_threshold': 0.00035000000000000005, 'volume_lookback': 144, 'volume_ratio_min': 0.7, 'atr_period': 10, 'vol_lookback': 144, 'vol_ratio_min': 0.5, 'fix_hour_utc': 15, 'post_fix_window_bars': 2, 'max_hold_bars': 8, 'sl_atr_mult': 1.4, 'tp_atr_mult': 3.0, 'direction_mode': 'fade', 'min_abs_intraday_return': 0.0005}. Best is trial 7 with value: -2.222458780295218.
C:\Users\הלל\Desktop\algo projects\trading-research-factory\walk forward engine\.venv\lib\site-packages\optuna\distributions.py:700: UserWarning: The distribution is specified by [10, 20] and step=4, but the range is not divisible by `step`. It will be replaced by [10, 18].
  warnings.warn(
C:\Users\הלל\Desktop\algo projects\trading-research-factory\walk forward engine\.venv\lib\site-packages\optuna\distributions.py:685: UserWarning: The distribution is specified by [0.00015, 0.0005] and step=5.000000000000002e-05, but the range is not divisible by `step`. It will be replaced by [0.00015, 0.0004500000000000001].
  warnings.warn(
C:\Users\הלל\Desktop\algo projects\trading-research-factory\walk forward engine\.venv\lib\site-packages\optuna\distributions.py:685: UserWarning: The distribution is specified by [0.5, 0.9] and step=0.19999999999999996, but the range is not divisible by `step`. It will be replaced by [0.5, 0.8999999999999999].
  warnings.warn(
[I 2026-06-01 23:08:33,183] Trial 5 finished with value: -10.0 and parameters: {'pre_momentum_lookback': 16, 'momentum_threshold': 0.0004000000000000001, 'volume_lookback': 144, 'volume_ratio_min': 0.7, 'atr_period': 14, 'vol_lookback': 192, 'vol_ratio_min': 0.7, 'fix_hour_utc': 16, 'post_fix_window_bars': 1, 'max_hold_bars': 12, 'sl_atr_mult': 1.0, 'tp_atr_mult': 1.5, 'direction_mode': 'continuation', 'min_abs_intraday_return': 0.0}. Best is trial 7 with value: -2.222458780295218.
C:\Users\הלל\Desktop\algo projects\trading-research-factory\walk forward engine\.venv\lib\site-packages\optuna\distributions.py:685: UserWarning: The distribution is specified by [0.7, 1.1] and step=0.20000000000000007, but the range is not divisible by `step`. It will be replaced by [0.7, 0.9].
  warnings.warn(
C:\Users\הלל\Desktop\algo projects\trading-research-factory\walk forward engine\.venv\lib\site-packages\optuna\distributions.py:685: UserWarning: The distribution is specified by [1.0, 2.0] and step=0.3999999999999999, but the range is not divisible by `step`. It will be replaced by [1.0, 1.7999999999999998].
  warnings.warn(
[I 2026-06-01 23:08:33,288] Trial 2 finished with value: -2.4118815530345725 and parameters: {'pre_momentum_lookback': 12, 'momentum_threshold': 0.0002, 'volume_lookback': 144, 'volume_ratio_min': 0.7, 'atr_period': 10, 'vol_lookback': 144, 'vol_ratio_min': 0.8999999999999999, 'fix_hour_utc': 15, 'post_fix_window_bars': 2, 'max_hold_bars': 8, 'sl_atr_mult': 1.7999999999999998, 'tp_atr_mult': 3.0, 'direction_mode': 'fade', 'min_abs_intraday_return': 0.001}. Best is trial 7 with value: -2.222458780295218.
[I 2026-06-01 23:08:33,297] Trial 6 finished with value: -10.0 and parameters: {'pre_momentum_lookback': 8, 'momentum_threshold': 0.0004500000000000001, 'volume_lookback': 96, 'volume_ratio_min': 0.7, 'atr_period': 18, 'vol_lookback': 192, 'vol_ratio_min': 0.5, 'fix_hour_utc': 16, 'post_fix_window_bars': 3, 'max_hold_bars': 12, 'sl_atr_mult': 1.7999999999999998, 'tp_atr_mult': 2.0, 'direction_mode': 'continuation', 'min_abs_intraday_return': 0.001}. Best is trial 7 with value: -2.222458780295218.
[I 2026-06-01 23:08:33,352] Trial 4 finished with value: -4.938730423317671 and parameters: {'pre_momentum_lookback': 8, 'momentum_threshold': 0.00015, 'volume_lookback': 144, 'volume_ratio_min': 0.7, 'atr_period': 14, 'vol_lookback': 144, 'vol_ratio_min': 0.7, 'fix_hour_utc': 15, 'post_fix_window_bars': 2, 'max_hold_bars': 4, 'sl_atr_mult': 1.4, 'tp_atr_mult': 1.5, 'direction_mode': 'fade', 'min_abs_intraday_return': 0.0}. Best is trial 7 with value: -2.222458780295218.
[I 2026-06-01 23:08:33,478] Trial 8 finished with value: -3.933917248830761 and parameters: {'pre_momentum_lookback': 8, 'momentum_threshold': 0.0004000000000000001, 'volume_lookback': 192, 'volume_ratio_min': 0.7, 'atr_period': 10, 'vol_lookback': 192, 'vol_ratio_min': 0.5, 'fix_hour_utc': 15, 'post_fix_window_bars': 3, 'max_hold_bars': 4, 'sl_atr_mult': 1.0, 'tp_atr_mult': 3.0, 'direction_mode': 'fade', 'min_abs_intraday_return': 0.001}. Best is trial 7 with value: -2.222458780295218.
[I 2026-06-01 23:08:33,634] Trial 11 finished with value: -10.0 and parameters: {'pre_momentum_lookback': 12, 'momentum_threshold': 0.0002, 'volume_lookback': 96, 'volume_ratio_min': 0.7, 'atr_period': 14, 'vol_lookback': 48, 'vol_ratio_min': 0.7, 'fix_hour_utc': 16, 'post_fix_window_bars': 2, 'max_hold_bars': 4, 'sl_atr_mult': 1.0, 'tp_atr_mult': 2.0, 'direction_mode': 'continuation', 'min_abs_intraday_return': 0.0}. Best is trial 7 with value: -2.222458780295218.
[I 2026-06-01 23:08:33,681] Trial 9 finished with value: -1.5858368358580492 and parameters: {'pre_momentum_lookback': 16, 'momentum_threshold': 0.0004500000000000001, 'volume_lookback': 192, 'volume_ratio_min': 0.7, 'atr_period': 18, 'vol_lookback': 144, 'vol_ratio_min': 0.7, 'fix_hour_utc': 15, 'post_fix_window_bars': 1, 'max_hold_bars': 8, 'sl_atr_mult': 1.7999999999999998, 'tp_atr_mult': 1.5, 'direction_mode': 'fade', 'min_abs_intraday_return': 0.001}. Best is trial 9 with value: -1.5858368358580492.
[I 2026-06-01 23:08:33,701] Trial 10 finished with value: -5.89552347892025 and parameters: {'pre_momentum_lookback': 4, 'momentum_threshold': 0.0004000000000000001, 'volume_lookback': 48, 'volume_ratio_min': 0.7, 'atr_period': 14, 'vol_lookback': 96, 'vol_ratio_min': 0.7, 'fix_hour_utc': 15, 'post_fix_window_bars': 2, 'max_hold_bars': 4, 'sl_atr_mult': 1.0, 'tp_atr_mult': 3.0, 'direction_mode': 'fade', 'min_abs_intraday_return': 0.0005}. Best is trial 9 with value: -1.5858368358580492.
C:\Users\הלל\Desktop\algo projects\trading-research-factory\walk forward engine\.venv\lib\site-packages\optuna\samplers\_tpe\sampler.py:319: ExperimentalWarning: ``multivariate`` option is an experimental feature. The interface can change in the future.
  warnings.warn(
[I 2026-06-01 23:08:33,964] A new study created in memory with name: no-name-3de3a96e-e767-45f2-9a30-cd61f6f58c6b
C:\Users\הלל\Desktop\algo projects\trading-research-factory\walk forward engine\.venv\lib\site-packages\optuna\distributions.py:685: UserWarning: The distribution is specified by [0.00015, 0.0005] and step=5.000000000000002e-05, but the range is not divisible by `step`. It will be replaced by [0.00015, 0.0004500000000000001].
  warnings.warn(
C:\Users\הלל\Desktop\algo projects\trading-research-factory\walk forward engine\.venv\lib\site-packages\optuna\distributions.py:685: UserWarning: The distribution is specified by [0.7, 1.1] and step=0.20000000000000007, but the range is not divisible by `step`. It will be replaced by [0.7, 0.9].
  warnings.warn(
C:\Users\הלל\Desktop\algo projects\trading-research-factory\walk forward engine\.venv\lib\site-packages\optuna\distributions.py:700: UserWarning: The distribution is specified by [10, 20] and step=4, but the range is not divisible by `step`. It will be replaced by [10, 18].
  warnings.warn(
C:\Users\הלל\Desktop\algo projects\trading-research-factory\walk forward engine\.venv\lib\site-packages\optuna\distributions.py:685: UserWarning: The distribution is specified by [0.5, 0.9] and step=0.19999999999999996, but the range is not divisible by `step`. It will be replaced by [0.5, 0.8999999999999999].
  warnings.warn(
C:\Users\הלל\Desktop\algo projects\trading-research-factory\walk forward engine\.venv\lib\site-packages\optuna\distributions.py:685: UserWarning: The distribution is specified by [1.0, 2.0] and step=0.3999999999999999, but the range is not divisible by `step`. It will be replaced by [1.0, 1.7999999999999998].
  warnings.warn(
C:\Users\הלל\Desktop\algo projects\trading-research-factory\walk forward engine\.venv\lib\site-packages\optuna\distributions.py:685: UserWarning: The distribution is specified by [0.00015, 0.0005] and step=5.000000000000002e-05, but the range is not divisible by `step`. It will be replaced by [0.00015, 0.0004500000000000001].
  warnings.warn(
C:\Users\הלל\Desktop\algo projects\trading-research-factory\walk forward engine\.venv\lib\site-packages\optuna\distributions.py:685: UserWarning: The distribution is specified by [0.00015, 0.0005] and step=5.000000000000002e-05, but the range is not divisible by `step`. It will be replaced by [0.00015, 0.0004500000000000001].
  warnings.warn(
C:\Users\הלל\Desktop\algo projects\trading-research-factory\walk forward engine\.venv\lib\site-packages\optuna\distributions.py:685: UserWarning: The distribution is specified by [0.7, 1.1] and step=0.20000000000000007, but the range is not divisible by `step`. It will be replaced by [0.7, 0.9].
  warnings.warn(
C:\Users\הלל\Desktop\algo projects\trading-research-factory\walk forward engine\.venv\lib\site-packages\optuna\distributions.py:700: UserWarning: The distribution is specified by [10, 20] and step=4, but the range is not divisible by `step`. It will be replaced by [10, 18].
  warnings.warn(
C:\Users\הלל\Desktop\algo projects\trading-research-factory\walk forward engine\.venv\lib\site-packages\optuna\distributions.py:685: UserWarning: The distribution is specified by [0.5, 0.9] and step=0.19999999999999996, but the range is not divisible by `step`. It will be replaced by [0.5, 0.8999999999999999].
  warnings.warn(
C:\Users\הלל\Desktop\algo projects\trading-research-factory\walk forward engine\.venv\lib\site-packages\optuna\distributions.py:685: UserWarning: The distribution is specified by [1.0, 2.0] and step=0.3999999999999999, but the range is not divisible by `step`. It will be replaced by [1.0, 1.7999999999999998].
  warnings.warn(
C:\Users\הלל\Desktop\algo projects\trading-research-factory\walk forward engine\.venv\lib\site-packages\optuna\distributions.py:685: UserWarning: The distribution is specified by [1.0, 2.0] and step=0.3999999999999999, but the range is not divisible by `step`. It will be replaced by [1.0, 1.7999999999999998].
  warnings.warn(
[I 2026-06-01 23:08:34,547] Trial 2 finished with value: -10.0 and parameters: {'pre_momentum_lookback': 16, 'momentum_threshold': 0.0004500000000000001, 'volume_lookback': 192, 'volume_ratio_min': 0.7, 'atr_period': 18, 'vol_lookback': 96, 'vol_ratio_min': 0.7, 'fix_hour_utc': 15, 'post_fix_window_bars': 2, 'max_hold_bars': 4, 'sl_atr_mult': 1.7999999999999998, 'tp_atr_mult': 2.5, 'direction_mode': 'continuation', 'min_abs_intraday_return': 0.001}. Best is trial 2 with value: -10.0.
C:\Users\הלל\Desktop\algo projects\trading-research-factory\walk forward engine\.venv\lib\site-packages\optuna\distributions.py:685: UserWarning: The distribution is specified by [0.00015, 0.0005] and step=5.000000000000002e-05, but the range is not divisible by `step`. It will be replaced by [0.00015, 0.0004500000000000001].
  warnings.warn(
C:\Users\הלל\Desktop\algo projects\trading-research-factory\walk forward engine\.venv\lib\site-packages\optuna\distributions.py:685: UserWarning: The distribution is specified by [0.7, 1.1] and step=0.20000000000000007, but the range is not divisible by `step`. It will be replaced by [0.7, 0.9].
  warnings.warn(
C:\Users\הלל\Desktop\algo projects\trading-research-factory\walk forward engine\.venv\lib\site-packages\optuna\distributions.py:700: UserWarning: The distribution is specified by [10, 20] and step=4, but the range is not divisible by `step`. It will be replaced by [10, 18].
  warnings.warn(
C:\Users\הלל\Desktop\algo projects\trading-research-factory\walk forward engine\.venv\lib\site-packages\optuna\distributions.py:685: UserWarning: The distribution is specified by [0.5, 0.9] and step=0.19999999999999996, but the range is not divisible by `step`. It will be replaced by [0.5, 0.8999999999999999].
  warnings.warn(
C:\Users\הלל\Desktop\algo projects\trading-research-factory\walk forward engine\.venv\lib\site-packages\optuna\distributions.py:685: UserWarning: The distribution is specified by [1.0, 2.0] and step=0.3999999999999999, but the range is not divisible by `step`. It will be replaced by [1.0, 1.7999999999999998].
  warnings.warn(
[I 2026-06-01 23:08:34,821] Trial 4 finished with value: -10.0 and parameters: {'pre_momentum_lookback': 8, 'momentum_threshold': 0.0004500000000000001, 'volume_lookback': 48, 'volume_ratio_min': 0.7, 'atr_period': 14, 'vol_lookback': 192, 'vol_ratio_min': 0.5, 'fix_hour_utc': 16, 'post_fix_window_bars': 1, 'max_hold_bars': 4, 'sl_atr_mult': 1.4, 'tp_atr_mult': 2.5, 'direction_mode': 'continuation', 'min_abs_intraday_return': 0.0005}. Best is trial 2 with value: -10.0.
