[I 2026-06-01 23:07:34,257] Trial 0 finished with value: -10.0 and parameters: {'pre_momentum_lookback': 12, 'momentum_threshold': 0.00030000000000000003, 'volume_lookback': 192, 'volume_ratio_min': 0.7, 'atr_period': 10, 'vol_lookback': 48, 'vol_ratio_min': 0.7, 'fix_hour_utc': 15, 'post_fix_window_bars': 2, 'max_hold_bars': 4, 'sl_atr_mult': 1.0, 'tp_atr_mult': 2.5, 'direction_mode': 'continuation', 'min_abs_intraday_return': 0.0005}. Best is trial 0 with value: -10.0.
C:\Users\הלל\Desktop\algo projects\trading-research-factory\walk forward engine\.venv\lib\site-packages\optuna\distributions.py:685: UserWarning: The distribution is specified by [0.00015, 0.0005] and step=5.000000000000002e-05, but the range is not divisible by `step`. It will be replaced by [0.00015, 0.0004500000000000001].
  warnings.warn(
C:\Users\הלל\Desktop\algo projects\trading-research-factory\walk forward engine\.venv\lib\site-packages\optuna\distributions.py:685: UserWarning: The distribution is specified by [0.7, 1.1] and step=0.20000000000000007, but the range is not divisible by `step`. It will be replaced by [0.7, 0.9].
  warnings.warn(
C:\Users\הלל\Desktop\algo projects\trading-research-factory\walk forward engine\.venv\lib\site-packages\optuna\distributions.py:700: UserWarning: The distribution is specified by [10, 20] and step=4, but the range is not divisible by `step`. It will be replaced by [10, 18].
  warnings.warn(
C:\Users\הלל\Desktop\algo projects\trading-research-factory\walk forward engine\.venv\lib\site-packages\optuna\distributions.py:685: UserWarning: The distribution is specified by [0.5, 0.9] and step=0.19999999999999996, but the range is not divisible by `step`. It will be replaced by [0.5, 0.8999999999999999].
  warnings.warn(
C:\Users\הלל\Desktop\algo projects\trading-research-factory\walk forward engine\.venv\lib\site-packages\optuna\distributions.py:685: UserWarning: The distribution is specified by [1.0, 2.0] and step=0.3999999999999999, but the range is not divisible by `step`. It will be replaced by [1.0, 1.7999999999999998].
  warnings.warn(
[I 2026-06-01 23:07:34,443] Trial 3 finished with value: -3.5524071027124497 and parameters: {'pre_momentum_lookback': 16, 'momentum_threshold': 0.00015, 'volume_lookback': 48, 'volume_ratio_min': 0.7, 'atr_period': 14, 'vol_lookback': 144, 'vol_ratio_min': 0.8999999999999999, 'fix_hour_utc': 16, 'post_fix_window_bars': 1, 'max_hold_bars': 8, 'sl_atr_mult': 1.7999999999999998, 'tp_atr_mult': 2.0, 'direction_mode': 'fade', 'min_abs_intraday_return': 0.001}. Best is trial 3 with value: -3.5524071027124497.
[I 2026-06-01 23:07:34,486] Trial 2 finished with value: -3.2678428257709387 and parameters: {'pre_momentum_lookback': 8, 'momentum_threshold': 0.00025, 'volume_lookback': 192, 'volume_ratio_min': 0.7, 'atr_period': 10, 'vol_lookback': 192, 'vol_ratio_min': 0.7, 'fix_hour_utc': 16, 'post_fix_window_bars': 3, 'max_hold_bars': 12, 'sl_atr_mult': 1.4, 'tp_atr_mult': 1.5, 'direction_mode': 'fade', 'min_abs_intraday_return': 0.0}. Best is trial 2 with value: -3.2678428257709387.
C:\Users\הלל\Desktop\algo projects\trading-research-factory\walk forward engine\.venv\lib\site-packages\optuna\distributions.py:685: UserWarning: The distribution is specified by [0.00015, 0.0005] and step=5.000000000000002e-05, but the range is not divisible by `step`. It will be replaced by [0.00015, 0.0004500000000000001].
  warnings.warn(
[I 2026-06-01 23:07:34,518] Trial 1 finished with value: -10.0 and parameters: {'pre_momentum_lookback': 16, 'momentum_threshold': 0.0002, 'volume_lookback': 96, 'volume_ratio_min': 0.7, 'atr_period': 18, 'vol_lookback': 48, 'vol_ratio_min': 0.7, 'fix_hour_utc': 15, 'post_fix_window_bars': 3, 'max_hold_bars': 8, 'sl_atr_mult': 1.7999999999999998, 'tp_atr_mult': 2.0, 'direction_mode': 'continuation', 'min_abs_intraday_return': 0.0}. Best is trial 2 with value: -3.2678428257709387.
C:\Users\הלל\Desktop\algo projects\trading-research-factory\walk forward engine\.venv\lib\site-packages\optuna\distributions.py:685: UserWarning: The distribution is specified by [0.7, 1.1] and step=0.20000000000000007, but the range is not divisible by `step`. It will be replaced by [0.7, 0.9].
  warnings.warn(
C:\Users\הלל\Desktop\algo projects\trading-research-factory\walk forward engine\.venv\lib\site-packages\optuna\distributions.py:700: UserWarning: The distribution is specified by [10, 20] and step=4, but the range is not divisible by `step`. It will be replaced by [10, 18].
  warnings.warn(
C:\Users\הלל\Desktop\algo projects\trading-research-factory\walk forward engine\.venv\lib\site-packages\optuna\distributions.py:685: UserWarning: The distribution is specified by [0.5, 0.9] and step=0.19999999999999996, but the range is not divisible by `step`. It will be replaced by [0.5, 0.8999999999999999].
  warnings.warn(
C:\Users\הלל\Desktop\algo projects\trading-research-factory\walk forward engine\.venv\lib\site-packages\optuna\distributions.py:685: UserWarning: The distribution is specified by [1.0, 2.0] and step=0.3999999999999999, but the range is not divisible by `step`. It will be replaced by [1.0, 1.7999999999999998].
  warnings.warn(
C:\Users\הלל\Desktop\algo projects\trading-research-factory\walk forward engine\.venv\lib\site-packages\optuna\distributions.py:685: UserWarning: The distribution is specified by [0.00015, 0.0005] and step=5.000000000000002e-05, but the range is not divisible by `step`. It will be replaced by [0.00015, 0.0004500000000000001].
  warnings.warn(
C:\Users\הלל\Desktop\algo projects\trading-research-factory\walk forward engine\.venv\lib\site-packages\optuna\distributions.py:685: UserWarning: The distribution is specified by [1.0, 2.0] and step=0.3999999999999999, but the range is not divisible by `step`. It will be replaced by [1.0, 1.7999999999999998].
  warnings.warn(
C:\Users\הלל\Desktop\algo projects\trading-research-factory\walk forward engine\.venv\lib\site-packages\optuna\distributions.py:685: UserWarning: The distribution is specified by [0.7, 1.1] and step=0.20000000000000007, but the range is not divisible by `step`. It will be replaced by [0.7, 0.9].
  warnings.warn(
C:\Users\הלל\Desktop\algo projects\trading-research-factory\walk forward engine\.venv\lib\site-packages\optuna\distributions.py:700: UserWarning: The distribution is specified by [10, 20] and step=4, but the range is not divisible by `step`. It will be replaced by [10, 18].
  warnings.warn(
C:\Users\הלל\Desktop\algo projects\trading-research-factory\walk forward engine\.venv\lib\site-packages\optuna\distributions.py:685: UserWarning: The distribution is specified by [0.5, 0.9] and step=0.19999999999999996, but the range is not divisible by `step`. It will be replaced by [0.5, 0.8999999999999999].
  warnings.warn(
C:\Users\הלל\Desktop\algo projects\trading-research-factory\walk forward engine\.venv\lib\site-packages\optuna\distributions.py:685: UserWarning: The distribution is specified by [1.0, 2.0] and step=0.3999999999999999, but the range is not divisible by `step`. It will be replaced by [1.0, 1.7999999999999998].
  warnings.warn(
[I 2026-06-01 23:07:34,863] Trial 4 finished with value: -5.4333100816282105 and parameters: {'pre_momentum_lookback': 4, 'momentum_threshold': 0.0004500000000000001, 'volume_lookback': 192, 'volume_ratio_min': 0.7, 'atr_period': 14, 'vol_lookback': 96, 'vol_ratio_min': 0.7, 'fix_hour_utc': 15, 'post_fix_window_bars': 2, 'max_hold_bars': 8, 'sl_atr_mult': 1.4, 'tp_atr_mult': 2.0, 'direction_mode': 'fade', 'min_abs_intraday_return': 0.0005}. Best is trial 2 with value: -3.2678428257709387.
[I 2026-06-01 23:07:34,890] Trial 7 finished with value: -10.0 and parameters: {'pre_momentum_lookback': 4, 'momentum_threshold': 0.0004500000000000001, 'volume_lookback': 144, 'volume_ratio_min': 0.7, 'atr_period': 18, 'vol_lookback': 192, 'vol_ratio_min': 0.7, 'fix_hour_utc': 16, 'post_fix_window_bars': 2, 'max_hold_bars': 4, 'sl_atr_mult': 1.7999999999999998, 'tp_atr_mult': 2.0, 'direction_mode': 'continuation', 'min_abs_intraday_return': 0.0}. Best is trial 2 with value: -3.2678428257709387.
[I 2026-06-01 23:07:34,931] Trial 5 finished with value: -5.653552668991449 and parameters: {'pre_momentum_lookback': 16, 'momentum_threshold': 0.0004500000000000001, 'volume_lookback': 192, 'volume_ratio_min': 0.7, 'atr_period': 18, 'vol_lookback': 144, 'vol_ratio_min': 0.7, 'fix_hour_utc': 15, 'post_fix_window_bars': 2, 'max_hold_bars': 8, 'sl_atr_mult': 1.4, 'tp_atr_mult': 3.0, 'direction_mode': 'fade', 'min_abs_intraday_return': 0.0005}. Best is trial 2 with value: -3.2678428257709387.
[I 2026-06-01 23:07:34,949] Trial 6 finished with value: -4.88230871495784 and parameters: {'pre_momentum_lookback': 8, 'momentum_threshold': 0.0004000000000000001, 'volume_lookback': 48, 'volume_ratio_min': 0.7, 'atr_period': 14, 'vol_lookback': 192, 'vol_ratio_min': 0.5, 'fix_hour_utc': 15, 'post_fix_window_bars': 3, 'max_hold_bars': 8, 'sl_atr_mult': 1.4, 'tp_atr_mult': 2.5, 'direction_mode': 'fade', 'min_abs_intraday_return': 0.0}. Best is trial 2 with value: -3.2678428257709387.
[I 2026-06-01 23:07:35,101] Trial 8 finished with value: -3.862324464837304 and parameters: {'pre_momentum_lookback': 16, 'momentum_threshold': 0.0004500000000000001, 'volume_lookback': 96, 'volume_ratio_min': 0.7, 'atr_period': 10, 'vol_lookback': 96, 'vol_ratio_min': 0.7, 'fix_hour_utc': 16, 'post_fix_window_bars': 1, 'max_hold_bars': 12, 'sl_atr_mult': 1.0, 'tp_atr_mult': 2.5, 'direction_mode': 'fade', 'min_abs_intraday_return': 0.0}. Best is trial 2 with value: -3.2678428257709387.
[I 2026-06-01 23:07:35,245] Trial 9 finished with value: -6.219851542807457 and parameters: {'pre_momentum_lookback': 16, 'momentum_threshold': 0.00035000000000000005, 'volume_lookback': 144, 'volume_ratio_min': 0.7, 'atr_period': 18, 'vol_lookback': 48, 'vol_ratio_min': 0.5, 'fix_hour_utc': 15, 'post_fix_window_bars': 1, 'max_hold_bars': 8, 'sl_atr_mult': 1.4, 'tp_atr_mult': 3.0, 'direction_mode': 'fade', 'min_abs_intraday_return': 0.0}. Best is trial 2 with value: -3.2678428257709387.
[I 2026-06-01 23:07:35,273] Trial 10 finished with value: -3.9836140614779585 and parameters: {'pre_momentum_lookback': 16, 'momentum_threshold': 0.0004000000000000001, 'volume_lookback': 144, 'volume_ratio_min': 0.7, 'atr_period': 18, 'vol_lookback': 48, 'vol_ratio_min': 0.5, 'fix_hour_utc': 16, 'post_fix_window_bars': 3, 'max_hold_bars': 12, 'sl_atr_mult': 1.0, 'tp_atr_mult': 3.0, 'direction_mode': 'fade', 'min_abs_intraday_return': 0.0}. Best is trial 2 with value: -3.2678428257709387.
[I 2026-06-01 23:07:35,273] Trial 11 finished with value: -10.0 and parameters: {'pre_momentum_lookback': 16, 'momentum_threshold': 0.00030000000000000003, 'volume_lookback': 144, 'volume_ratio_min': 0.7, 'atr_period': 14, 'vol_lookback': 48, 'vol_ratio_min': 0.8999999999999999, 'fix_hour_utc': 15, 'post_fix_window_bars': 3, 'max_hold_bars': 4, 'sl_atr_mult': 1.7999999999999998, 'tp_atr_mult': 3.0, 'direction_mode': 'continuation', 'min_abs_intraday_return': 0.0005}. Best is trial 2 with value: -3.2678428257709387.
C:\Users\הלל\Desktop\algo projects\trading-research-factory\walk forward engine\.venv\lib\site-packages\optuna\samplers\_tpe\sampler.py:319: ExperimentalWarning: ``multivariate`` option is an experimental feature. The interface can change in the future.
  warnings.warn(
[I 2026-06-01 23:07:35,534] A new study created in memory with name: no-name-49467f40-babe-453e-a9ec-26553ddb2516
C:\Users\הלל\Desktop\algo projects\trading-research-factory\walk forward engine\.venv\lib\site-packages\optuna\distributions.py:685: UserWarning: The distribution is specified by [0.00015, 0.0005] and step=5.000000000000002e-05, but the range is not divisible by `step`. It will be replaced by [0.00015, 0.0004500000000000001].
  warnings.warn(
C:\Users\הלל\Desktop\algo projects\trading-research-factory\walk forward engine\.venv\lib\site-packages\optuna\distributions.py:685: UserWarning: The distribution is specified by [0.7, 1.1] and step=0.20000000000000007, but the range is not divisible by `step`. It will be replaced by [0.7, 0.9].
  warnings.warn(
C:\Users\הלל\Desktop\algo projects\trading-research-factory\walk forward engine\.venv\lib\site-packages\optuna\distributions.py:700: UserWarning: The distribution is specified by [10, 20] and step=4, but the range is not divisible by `step`. It will be replaced by [10, 18].
  warnings.warn(
C:\Users\הלל\Desktop\algo projects\trading-research-factory\walk forward engine\.venv\lib\site-packages\optuna\distributions.py:685: UserWarning: The distribution is specified by [0.5, 0.9] and step=0.19999999999999996, but the range is not divisible by `step`. It will be replaced by [0.5, 0.8999999999999999].
  warnings.warn(
C:\Users\הלל\Desktop\algo projects\trading-research-factory\walk forward engine\.venv\lib\site-packages\optuna\distributions.py:685: UserWarning: The distribution is specified by [1.0, 2.0] and step=0.3999999999999999, but the range is not divisible by `step`. It will be replaced by [1.0, 1.7999999999999998].
  warnings.warn(
C:\Users\הלל\Desktop\algo projects\trading-research-factory\walk forward engine\.venv\lib\site-packages\optuna\distributions.py:685: UserWarning: The distribution is specified by [0.00015, 0.0005] and step=5.000000000000002e-05, but the range is not divisible by `step`. It will be replaced by [0.00015, 0.0004500000000000001].
  warnings.warn(
C:\Users\הלל\Desktop\algo projects\trading-research-factory\walk forward engine\.venv\lib\site-packages\optuna\distributions.py:685: UserWarning: The distribution is specified by [0.7, 1.1] and step=0.20000000000000007, but the range is not divisible by `step`. It will be replaced by [0.7, 0.9].
  warnings.warn(
C:\Users\הלל\Desktop\algo projects\trading-research-factory\walk forward engine\.venv\lib\site-packages\optuna\distributions.py:700: UserWarning: The distribution is specified by [10, 20] and step=4, but the range is not divisible by `step`. It will be replaced by [10, 18].
  warnings.warn(
C:\Users\הלל\Desktop\algo projects\trading-research-factory\walk forward engine\.venv\lib\site-packages\optuna\distributions.py:685: UserWarning: The distribution is specified by [0.5, 0.9] and step=0.19999999999999996, but the range is not divisible by `step`. It will be replaced by [0.5, 0.8999999999999999].
  warnings.warn(
C:\Users\הלל\Desktop\algo projects\trading-research-factory\walk forward engine\.venv\lib\site-packages\optuna\distributions.py:685: UserWarning: The distribution is specified by [1.0, 2.0] and step=0.3999999999999999, but the range is not divisible by `step`. It will be replaced by [1.0, 1.7999999999999998].
  warnings.warn(
C:\Users\הלל\Desktop\algo projects\trading-research-factory\walk forward engine\.venv\lib\site-packages\optuna\distributions.py:685: UserWarning: The distribution is specified by [0.00015, 0.0005] and step=5.000000000000002e-05, but the range is not divisible by `step`. It will be replaced by [0.00015, 0.0004500000000000001].
  warnings.warn(
C:\Users\הלל\Desktop\algo projects\trading-research-factory\walk forward engine\.venv\lib\site-packages\optuna\distributions.py:685: UserWarning: The distribution is specified by [0.7, 1.1] and step=0.20000000000000007, but the range is not divisible by `step`. It will be replaced by [0.7, 0.9].
  warnings.warn(
C:\Users\הלל\Desktop\algo projects\trading-research-factory\walk forward engine\.venv\lib\site-packages\optuna\distributions.py:700: UserWarning: The distribution is specified by [10, 20] and step=4, but the range is not divisible by `step`. It will be replaced by [10, 18].
  warnings.warn(
C:\Users\הלל\Desktop\algo projects\trading-research-factory\walk forward engine\.venv\lib\site-packages\optuna\distributions.py:685: UserWarning: The distribution is specified by [0.00015, 0.0005] and step=5.000000000000002e-05, but the range is not divisible by `step`. It will be replaced by [0.00015, 0.0004500000000000001].
  warnings.warn(
C:\Users\הלל\Desktop\algo projects\trading-research-factory\walk forward engine\.venv\lib\site-packages\optuna\distributions.py:685: UserWarning: The distribution is specified by [0.5, 0.9] and step=0.19999999999999996, but the range is not divisible by `step`. It will be replaced by [0.5, 0.8999999999999999].
  warnings.warn(
C:\Users\הלל\Desktop\algo projects\trading-research-factory\walk forward engine\.venv\lib\site-packages\optuna\distributions.py:685: UserWarning: The distribution is specified by [1.0, 2.0] and step=0.3999999999999999, but the range is not divisible by `step`. It will be replaced by [1.0, 1.7999999999999998].
  warnings.warn(
[I 2026-06-01 23:07:36,105] Trial 0 finished with value: -10.0 and parameters: {'pre_momentum_lookback': 12, 'momentum_threshold': 0.0004500000000000001, 'volume_lookback': 48, 'volume_ratio_min': 0.7, 'atr_period': 14, 'vol_lookback': 48, 'vol_ratio_min': 0.5, 'fix_hour_utc': 15, 'post_fix_window_bars': 3, 'max_hold_bars': 8, 'sl_atr_mult': 1.4, 'tp_atr_mult': 2.5, 'direction_mode': 'continuation', 'min_abs_intraday_return': 0.001}. Best is trial 0 with value: -10.0.
C:\Users\הלל\Desktop\algo projects\trading-research-factory\walk forward engine\.venv\lib\site-packages\optuna\distributions.py:685: UserWarning: The distribution is specified by [0.00015, 0.0005] and step=5.000000000000002e-05, but the range is not divisible by `step`. It will be replaced by [0.00015, 0.0004500000000000001].
  warnings.warn(
C:\Users\הלל\Desktop\algo projects\trading-research-factory\walk forward engine\.venv\lib\site-packages\optuna\distributions.py:685: UserWarning: The distribution is specified by [0.7, 1.1] and step=0.20000000000000007, but the range is not divisible by `step`. It will be replaced by [0.7, 0.9].
  warnings.warn(
C:\Users\הלל\Desktop\algo projects\trading-research-factory\walk forward engine\.venv\lib\site-packages\optuna\distributions.py:700: UserWarning: The distribution is specified by [10, 20] and step=4, but the range is not divisible by `step`. It will be replaced by [10, 18].
  warnings.warn(
C:\Users\הלל\Desktop\algo projects\trading-research-factory\walk forward engine\.venv\lib\site-packages\optuna\distributions.py:685: UserWarning: The distribution is specified by [0.5, 0.9] and step=0.19999999999999996, but the range is not divisible by `step`. It will be replaced by [0.5, 0.8999999999999999].
  warnings.warn(
C:\Users\הלל\Desktop\algo projects\trading-research-factory\walk forward engine\.venv\lib\site-packages\optuna\distributions.py:685: UserWarning: The distribution is specified by [1.0, 2.0] and step=0.3999999999999999, but the range is not divisible by `step`. It will be replaced by [1.0, 1.7999999999999998].
  warnings.warn(
[I 2026-06-01 23:07:36,215] Trial 1 finished with value: -3.957148310489589 and parameters: {'pre_momentum_lookback': 16, 'momentum_threshold': 0.00025, 'volume_lookback': 96, 'volume_ratio_min': 0.7, 'atr_period': 14, 'vol_lookback': 192, 'vol_ratio_min': 0.5, 'fix_hour_utc': 16, 'post_fix_window_bars': 3, 'max_hold_bars': 12, 'sl_atr_mult': 1.0, 'tp_atr_mult': 3.0, 'direction_mode': 'fade', 'min_abs_intraday_return': 0.0005}. Best is trial 1 with value: -3.957148310489589.
[I 2026-06-01 23:07:36,238] Trial 3 finished with value: -10.0 and parameters: {'pre_momentum_lookback': 16, 'momentum_threshold': 0.00025, 'volume_lookback': 192, 'volume_ratio_min': 0.7, 'atr_period': 18, 'vol_lookback': 48, 'vol_ratio_min': 0.5, 'fix_hour_utc': 16, 'post_fix_window_bars': 2, 'max_hold_bars': 12, 'sl_atr_mult': 1.4, 'tp_atr_mult': 3.0, 'direction_mode': 'continuation', 'min_abs_intraday_return': 0.001}. Best is trial 1 with value: -3.957148310489589.
C:\Users\הלל\Desktop\algo projects\trading-research-factory\walk forward engine\.venv\lib\site-packages\optuna\distributions.py:685: UserWarning: The distribution is specified by [0.00015, 0.0005] and step=5.000000000000002e-05, but the range is not divisible by `step`. It will be replaced by [0.00015, 0.0004500000000000001].
  warnings.warn(
C:\Users\הלל\Desktop\algo projects\trading-research-factory\walk forward engine\.venv\lib\site-packages\optuna\distributions.py:685: UserWarning: The distribution is specified by [0.00015, 0.0005] and step=5.000000000000002e-05, but the range is not divisible by `step`. It will be replaced by [0.00015, 0.0004500000000000001].
  warnings.warn(
C:\Users\הלל\Desktop\algo projects\trading-research-factory\walk forward engine\.venv\lib\site-packages\optuna\distributions.py:685: UserWarning: The distribution is specified by [0.7, 1.1] and step=0.20000000000000007, but the range is not divisible by `step`. It will be replaced by [0.7, 0.9].
  warnings.warn(
C:\Users\הלל\Desktop\algo projects\trading-research-factory\walk forward engine\.venv\lib\site-packages\optuna\distributions.py:700: UserWarning: The distribution is specified by [10, 20] and step=4, but the range is not divisible by `step`. It will be replaced by [10, 18].
  warnings.warn(
