[I 2026-06-02 00:19:46,172] Trial 2 finished with value: -2.6169536644306866 and parameters: {'atr_period': 14, 'pre_event_lookback': 8, 'reaction_bars': 1, 'min_reaction_return': 0.00015, 'pre_range_atr_mult_max': 67.0, 'volume_lookback': 96, 'volume_ratio_max': 73.5, 'max_hold_bars': 12, 'sl_atr_mult': 1.0, 'tp_atr_mult': 1.5, 'direction_mode': 'continuation', 'release_hour_mode': 'fixed_13_utc'}. Best is trial 2 with value: -2.6169536644306866.
C:\Users\הלל\Desktop\algo projects\trading-research-factory\walk forward engine\.venv\lib\site-packages\optuna\distributions.py:700: UserWarning: The distribution is specified by [10, 20] and step=4, but the range is not divisible by `step`. It will be replaced by [10, 18].
  warnings.warn(
C:\Users\הלל\Desktop\algo projects\trading-research-factory\walk forward engine\.venv\lib\site-packages\optuna\distributions.py:685: UserWarning: The distribution is specified by [0.0, 0.0005] and step=0.00015, but the range is not divisible by `step`. It will be replaced by [0.0, 0.00045].
  warnings.warn(
C:\Users\הלל\Desktop\algo projects\trading-research-factory\walk forward engine\.venv\lib\site-packages\optuna\distributions.py:685: UserWarning: The distribution is specified by [1.5, 99.0] and step=1.0, but the range is not divisible by `step`. It will be replaced by [1.5, 98.5].
  warnings.warn(
C:\Users\הלל\Desktop\algo projects\trading-research-factory\walk forward engine\.venv\lib\site-packages\optuna\distributions.py:685: UserWarning: The distribution is specified by [1.5, 4.0] and step=1.0, but the range is not divisible by `step`. It will be replaced by [1.5, 3.5].
  warnings.warn(
[I 2026-06-02 00:19:46,314] Trial 0 finished with value: -2.599531778331096 and parameters: {'atr_period': 14, 'pre_event_lookback': 8, 'reaction_bars': 2, 'min_reaction_return': 0.00015, 'pre_range_atr_mult_max': 62.0, 'volume_lookback': 144, 'volume_ratio_max': 76.5, 'max_hold_bars': 12, 'sl_atr_mult': 1.5, 'tp_atr_mult': 1.5, 'direction_mode': 'continuation', 'release_hour_mode': 'us_dst_approx'}. Best is trial 0 with value: -2.599531778331096.
C:\Users\הלל\Desktop\algo projects\trading-research-factory\walk forward engine\.venv\lib\site-packages\optuna\distributions.py:700: UserWarning: The distribution is specified by [10, 20] and step=4, but the range is not divisible by `step`. It will be replaced by [10, 18].
  warnings.warn(
C:\Users\הלל\Desktop\algo projects\trading-research-factory\walk forward engine\.venv\lib\site-packages\optuna\distributions.py:685: UserWarning: The distribution is specified by [0.0, 0.0005] and step=0.00015, but the range is not divisible by `step`. It will be replaced by [0.0, 0.00045].
  warnings.warn(
[I 2026-06-02 00:19:46,372] Trial 4 finished with value: -2.7877998161021176 and parameters: {'atr_period': 10, 'pre_event_lookback': 4, 'reaction_bars': 1, 'min_reaction_return': 0.0003, 'pre_range_atr_mult_max': 31.0, 'volume_lookback': 96, 'volume_ratio_max': 27.5, 'max_hold_bars': 10, 'sl_atr_mult': 1.5, 'tp_atr_mult': 2.5, 'direction_mode': 'continuation', 'release_hour_mode': 'fixed_13_utc'}. Best is trial 0 with value: -2.599531778331096.
C:\Users\הלל\Desktop\algo projects\trading-research-factory\walk forward engine\.venv\lib\site-packages\optuna\distributions.py:685: UserWarning: The distribution is specified by [1.5, 99.0] and step=1.0, but the range is not divisible by `step`. It will be replaced by [1.5, 98.5].
  warnings.warn(
C:\Users\הלל\Desktop\algo projects\trading-research-factory\walk forward engine\.venv\lib\site-packages\optuna\distributions.py:685: UserWarning: The distribution is specified by [1.5, 4.0] and step=1.0, but the range is not divisible by `step`. It will be replaced by [1.5, 3.5].
  warnings.warn(
[I 2026-06-02 00:19:46,433] Trial 3 finished with value: -9.6 and parameters: {'atr_period': 10, 'pre_event_lookback': 8, 'reaction_bars': 2, 'min_reaction_return': 0.0003, 'pre_range_atr_mult_max': 69.0, 'volume_lookback': 192, 'volume_ratio_max': 31.5, 'max_hold_bars': 6, 'sl_atr_mult': 1.0, 'tp_atr_mult': 3.5, 'direction_mode': 'continuation', 'release_hour_mode': 'fixed_12_utc'}. Best is trial 0 with value: -2.599531778331096.
C:\Users\הלל\Desktop\algo projects\trading-research-factory\walk forward engine\.venv\lib\site-packages\optuna\distributions.py:700: UserWarning: The distribution is specified by [10, 20] and step=4, but the range is not divisible by `step`. It will be replaced by [10, 18].
  warnings.warn(
[I 2026-06-02 00:19:46,454] Trial 7 finished with value: -2.8092689360254943 and parameters: {'atr_period': 18, 'pre_event_lookback': 12, 'reaction_bars': 2, 'min_reaction_return': 0.0003, 'pre_range_atr_mult_max': 91.0, 'volume_lookback': 192, 'volume_ratio_max': 71.5, 'max_hold_bars': 2, 'sl_atr_mult': 2.0, 'tp_atr_mult': 2.5, 'direction_mode': 'continuation', 'release_hour_mode': 'fixed_13_utc'}. Best is trial 0 with value: -2.599531778331096.
C:\Users\הלל\Desktop\algo projects\trading-research-factory\walk forward engine\.venv\lib\site-packages\optuna\distributions.py:685: UserWarning: The distribution is specified by [0.0, 0.0005] and step=0.00015, but the range is not divisible by `step`. It will be replaced by [0.0, 0.00045].
  warnings.warn(
[I 2026-06-02 00:19:46,462] Trial 6 finished with value: -9.7 and parameters: {'atr_period': 18, 'pre_event_lookback': 4, 'reaction_bars': 1, 'min_reaction_return': 0.0003, 'pre_range_atr_mult_max': 27.0, 'volume_lookback': 96, 'volume_ratio_max': 49.5, 'max_hold_bars': 12, 'sl_atr_mult': 1.5, 'tp_atr_mult': 3.5, 'direction_mode': 'fade', 'release_hour_mode': 'fixed_12_utc'}. Best is trial 0 with value: -2.599531778331096.
C:\Users\הלל\Desktop\algo projects\trading-research-factory\walk forward engine\.venv\lib\site-packages\optuna\distributions.py:685: UserWarning: The distribution is specified by [1.5, 99.0] and step=1.0, but the range is not divisible by `step`. It will be replaced by [1.5, 98.5].
  warnings.warn(
C:\Users\הלל\Desktop\algo projects\trading-research-factory\walk forward engine\.venv\lib\site-packages\optuna\distributions.py:685: UserWarning: The distribution is specified by [1.5, 4.0] and step=1.0, but the range is not divisible by `step`. It will be replaced by [1.5, 3.5].
  warnings.warn(
[I 2026-06-02 00:19:46,483] Trial 5 finished with value: -2.6770974842679167 and parameters: {'atr_period': 14, 'pre_event_lookback': 8, 'reaction_bars': 1, 'min_reaction_return': 0.0003, 'pre_range_atr_mult_max': 89.0, 'volume_lookback': 192, 'volume_ratio_max': 11.5, 'max_hold_bars': 10, 'sl_atr_mult': 1.5, 'tp_atr_mult': 3.5, 'direction_mode': 'continuation', 'release_hour_mode': 'fixed_13_utc'}. Best is trial 0 with value: -2.599531778331096.
[I 2026-06-02 00:19:46,821] Trial 8 finished with value: 0.8749663253748903 and parameters: {'atr_period': 18, 'pre_event_lookback': 8, 'reaction_bars': 1, 'min_reaction_return': 0.0, 'pre_range_atr_mult_max': 27.0, 'volume_lookback': 192, 'volume_ratio_max': 40.5, 'max_hold_bars': 12, 'sl_atr_mult': 2.0, 'tp_atr_mult': 1.5, 'direction_mode': 'fade', 'release_hour_mode': 'fixed_13_utc'}. Best is trial 8 with value: 0.8749663253748903.
[I 2026-06-02 00:19:46,878] Trial 9 finished with value: 2.9620335226929435 and parameters: {'atr_period': 14, 'pre_event_lookback': 12, 'reaction_bars': 2, 'min_reaction_return': 0.0003, 'pre_range_atr_mult_max': 57.0, 'volume_lookback': 96, 'volume_ratio_max': 95.5, 'max_hold_bars': 12, 'sl_atr_mult': 1.0, 'tp_atr_mult': 3.5, 'direction_mode': 'fade', 'release_hour_mode': 'us_dst_approx'}. Best is trial 9 with value: 2.9620335226929435.
[I 2026-06-02 00:19:46,911] Trial 11 finished with value: 1.964176023796797 and parameters: {'atr_period': 14, 'pre_event_lookback': 8, 'reaction_bars': 2, 'min_reaction_return': 0.0003, 'pre_range_atr_mult_max': 27.0, 'volume_lookback': 96, 'volume_ratio_max': 81.5, 'max_hold_bars': 6, 'sl_atr_mult': 2.0, 'tp_atr_mult': 2.5, 'direction_mode': 'fade', 'release_hour_mode': 'fixed_13_utc'}. Best is trial 9 with value: 2.9620335226929435.
[I 2026-06-02 00:19:46,937] Trial 10 finished with value: -9.7 and parameters: {'atr_period': 10, 'pre_event_lookback': 12, 'reaction_bars': 1, 'min_reaction_return': 0.00015, 'pre_range_atr_mult_max': 24.0, 'volume_lookback': 48, 'volume_ratio_max': 31.5, 'max_hold_bars': 6, 'sl_atr_mult': 1.0, 'tp_atr_mult': 3.5, 'direction_mode': 'continuation', 'release_hour_mode': 'fixed_12_utc'}. Best is trial 9 with value: 2.9620335226929435.
C:\Users\הלל\Desktop\algo projects\trading-research-factory\walk forward engine\.venv\lib\site-packages\optuna\samplers\_tpe\sampler.py:319: ExperimentalWarning: ``multivariate`` option is an experimental feature. The interface can change in the future.
  warnings.warn(
[I 2026-06-02 00:19:47,127] A new study created in memory with name: no-name-925eed95-6f87-405f-802b-acf3bcb08638
C:\Users\הלל\Desktop\algo projects\trading-research-factory\walk forward engine\.venv\lib\site-packages\optuna\distributions.py:700: UserWarning: The distribution is specified by [10, 20] and step=4, but the range is not divisible by `step`. It will be replaced by [10, 18].
  warnings.warn(
C:\Users\הלל\Desktop\algo projects\trading-research-factory\walk forward engine\.venv\lib\site-packages\optuna\distributions.py:685: UserWarning: The distribution is specified by [0.0, 0.0005] and step=0.00015, but the range is not divisible by `step`. It will be replaced by [0.0, 0.00045].
  warnings.warn(
C:\Users\הלל\Desktop\algo projects\trading-research-factory\walk forward engine\.venv\lib\site-packages\optuna\distributions.py:685: UserWarning: The distribution is specified by [1.5, 99.0] and step=1.0, but the range is not divisible by `step`. It will be replaced by [1.5, 98.5].
  warnings.warn(
C:\Users\הלל\Desktop\algo projects\trading-research-factory\walk forward engine\.venv\lib\site-packages\optuna\distributions.py:685: UserWarning: The distribution is specified by [1.5, 4.0] and step=1.0, but the range is not divisible by `step`. It will be replaced by [1.5, 3.5].
  warnings.warn(
C:\Users\הלל\Desktop\algo projects\trading-research-factory\walk forward engine\.venv\lib\site-packages\optuna\distributions.py:685: UserWarning: The distribution is specified by [1.5, 99.0] and step=1.0, but the range is not divisible by `step`. It will be replaced by [1.5, 98.5].
  warnings.warn(
C:\Users\הלל\Desktop\algo projects\trading-research-factory\walk forward engine\.venv\lib\site-packages\optuna\distributions.py:685: UserWarning: The distribution is specified by [1.5, 4.0] and step=1.0, but the range is not divisible by `step`. It will be replaced by [1.5, 3.5].
  warnings.warn(
[I 2026-06-02 00:19:47,632] Trial 0 finished with value: -9.6 and parameters: {'atr_period': 14, 'pre_event_lookback': 12, 'reaction_bars': 2, 'min_reaction_return': 0.00045, 'pre_range_atr_mult_max': 87.0, 'volume_lookback': 144, 'volume_ratio_max': 56.5, 'max_hold_bars': 4, 'sl_atr_mult': 1.0, 'tp_atr_mult': 3.5, 'direction_mode': 'fade', 'release_hour_mode': 'fixed_13_utc'}. Best is trial 0 with value: -9.6.
C:\Users\הלל\Desktop\algo projects\trading-research-factory\walk forward engine\.venv\lib\site-packages\optuna\distributions.py:700: UserWarning: The distribution is specified by [10, 20] and step=4, but the range is not divisible by `step`. It will be replaced by [10, 18].
  warnings.warn(
C:\Users\הלל\Desktop\algo projects\trading-research-factory\walk forward engine\.venv\lib\site-packages\optuna\distributions.py:685: UserWarning: The distribution is specified by [0.0, 0.0005] and step=0.00015, but the range is not divisible by `step`. It will be replaced by [0.0, 0.00045].
  warnings.warn(
C:\Users\הלל\Desktop\algo projects\trading-research-factory\walk forward engine\.venv\lib\site-packages\optuna\distributions.py:685: UserWarning: The distribution is specified by [1.5, 99.0] and step=1.0, but the range is not divisible by `step`. It will be replaced by [1.5, 98.5].
  warnings.warn(
C:\Users\הלל\Desktop\algo projects\trading-research-factory\walk forward engine\.venv\lib\site-packages\optuna\distributions.py:685: UserWarning: The distribution is specified by [1.5, 4.0] and step=1.0, but the range is not divisible by `step`. It will be replaced by [1.5, 3.5].
  warnings.warn(
[I 2026-06-02 00:19:47,900] Trial 1 finished with value: -9.6 and parameters: {'atr_period': 14, 'pre_event_lookback': 8, 'reaction_bars': 2, 'min_reaction_return': 0.0, 'pre_range_atr_mult_max': 92.0, 'volume_lookback': 96, 'volume_ratio_max': 88.5, 'max_hold_bars': 4, 'sl_atr_mult': 1.5, 'tp_atr_mult': 2.5, 'direction_mode': 'fade', 'release_hour_mode': 'us_dst_approx'}. Best is trial 0 with value: -9.6.
C:\Users\הלל\Desktop\algo projects\trading-research-factory\walk forward engine\.venv\lib\site-packages\optuna\distributions.py:700: UserWarning: The distribution is specified by [10, 20] and step=4, but the range is not divisible by `step`. It will be replaced by [10, 18].
  warnings.warn(
C:\Users\הלל\Desktop\algo projects\trading-research-factory\walk forward engine\.venv\lib\site-packages\optuna\distributions.py:685: UserWarning: The distribution is specified by [0.0, 0.0005] and step=0.00015, but the range is not divisible by `step`. It will be replaced by [0.0, 0.00045].
  warnings.warn(
[I 2026-06-02 00:19:47,965] Trial 7 finished with value: -9.6 and parameters: {'atr_period': 10, 'pre_event_lookback': 4, 'reaction_bars': 2, 'min_reaction_return': 0.0, 'pre_range_atr_mult_max': 35.0, 'volume_lookback': 144, 'volume_ratio_max': 85.5, 'max_hold_bars': 12, 'sl_atr_mult': 1.0, 'tp_atr_mult': 2.5, 'direction_mode': 'fade', 'release_hour_mode': 'fixed_12_utc'}. Best is trial 0 with value: -9.6.
C:\Users\הלל\Desktop\algo projects\trading-research-factory\walk forward engine\.venv\lib\site-packages\optuna\distributions.py:685: UserWarning: The distribution is specified by [1.5, 99.0] and step=1.0, but the range is not divisible by `step`. It will be replaced by [1.5, 98.5].
  warnings.warn(
[I 2026-06-02 00:19:47,968] Trial 4 finished with value: -9.8 and parameters: {'atr_period': 14, 'pre_event_lookback': 8, 'reaction_bars': 2, 'min_reaction_return': 0.0003, 'pre_range_atr_mult_max': 29.0, 'volume_lookback': 96, 'volume_ratio_max': 2.5, 'max_hold_bars': 10, 'sl_atr_mult': 2.0, 'tp_atr_mult': 3.5, 'direction_mode': 'fade', 'release_hour_mode': 'fixed_13_utc'}. Best is trial 0 with value: -9.6.
C:\Users\הלל\Desktop\algo projects\trading-research-factory\walk forward engine\.venv\lib\site-packages\optuna\distributions.py:685: UserWarning: The distribution is specified by [1.5, 4.0] and step=1.0, but the range is not divisible by `step`. It will be replaced by [1.5, 3.5].
  warnings.warn(
[I 2026-06-02 00:19:47,999] Trial 6 finished with value: -9.6 and parameters: {'atr_period': 10, 'pre_event_lookback': 12, 'reaction_bars': 2, 'min_reaction_return': 0.00015, 'pre_range_atr_mult_max': 30.0, 'volume_lookback': 192, 'volume_ratio_max': 47.5, 'max_hold_bars': 8, 'sl_atr_mult': 1.5, 'tp_atr_mult': 3.5, 'direction_mode': 'continuation', 'release_hour_mode': 'fixed_12_utc'}. Best is trial 0 with value: -9.6.
C:\Users\הלל\Desktop\algo projects\trading-research-factory\walk forward engine\.venv\lib\site-packages\optuna\distributions.py:685: UserWarning: The distribution is specified by [1.5, 4.0] and step=1.0, but the range is not divisible by `step`. It will be replaced by [1.5, 3.5].
  warnings.warn(
[I 2026-06-02 00:19:48,036] Trial 5 finished with value: -9.6 and parameters: {'atr_period': 18, 'pre_event_lookback': 12, 'reaction_bars': 1, 'min_reaction_return': 0.0, 'pre_range_atr_mult_max': 51.0, 'volume_lookback': 192, 'volume_ratio_max': 20.5, 'max_hold_bars': 4, 'sl_atr_mult': 1.0, 'tp_atr_mult': 2.5, 'direction_mode': 'continuation', 'release_hour_mode': 'fixed_12_utc'}. Best is trial 0 with value: -9.6.
C:\Users\הלל\Desktop\algo projects\trading-research-factory\walk forward engine\.venv\lib\site-packages\optuna\distributions.py:685: UserWarning: The distribution is specified by [0.0, 0.0005] and step=0.00015, but the range is not divisible by `step`. It will be replaced by [0.0, 0.00045].
  warnings.warn(
C:\Users\הלל\Desktop\algo projects\trading-research-factory\walk forward engine\.venv\lib\site-packages\optuna\distributions.py:685: UserWarning: The distribution is specified by [1.5, 99.0] and step=1.0, but the range is not divisible by `step`. It will be replaced by [1.5, 98.5].
  warnings.warn(
C:\Users\הלל\Desktop\algo projects\trading-research-factory\walk forward engine\.venv\lib\site-packages\optuna\distributions.py:685: UserWarning: The distribution is specified by [1.5, 4.0] and step=1.0, but the range is not divisible by `step`. It will be replaced by [1.5, 3.5].
  warnings.warn(
[I 2026-06-02 00:19:48,120] Trial 2 finished with value: -9.7 and parameters: {'atr_period': 14, 'pre_event_lookback': 8, 'reaction_bars': 2, 'min_reaction_return': 0.00045, 'pre_range_atr_mult_max': 47.0, 'volume_lookback': 192, 'volume_ratio_max': 59.5, 'max_hold_bars': 12, 'sl_atr_mult': 1.0, 'tp_atr_mult': 2.5, 'direction_mode': 'continuation', 'release_hour_mode': 'us_dst_approx'}. Best is trial 0 with value: -9.6.
[I 2026-06-02 00:19:48,132] Trial 3 finished with value: -9.6 and parameters: {'atr_period': 14, 'pre_event_lookback': 12, 'reaction_bars': 1, 'min_reaction_return': 0.0, 'pre_range_atr_mult_max': 34.0, 'volume_lookback': 144, 'volume_ratio_max': 48.5, 'max_hold_bars': 4, 'sl_atr_mult': 1.0, 'tp_atr_mult': 2.5, 'direction_mode': 'fade', 'release_hour_mode': 'fixed_12_utc'}. Best is trial 0 with value: -9.6.
[I 2026-06-02 00:19:48,260] Trial 8 finished with value: -9.6 and parameters: {'atr_period': 10, 'pre_event_lookback': 8, 'reaction_bars': 1, 'min_reaction_return': 0.0, 'pre_range_atr_mult_max': 49.0, 'volume_lookback': 144, 'volume_ratio_max': 52.5, 'max_hold_bars': 8, 'sl_atr_mult': 2.0, 'tp_atr_mult': 3.5, 'direction_mode': 'fade', 'release_hour_mode': 'fixed_13_utc'}. Best is trial 0 with value: -9.6.
[I 2026-06-02 00:19:48,504] Trial 10 finished with value: -9.6 and parameters: {'atr_period': 10, 'pre_event_lookback': 8, 'reaction_bars': 2, 'min_reaction_return': 0.0, 'pre_range_atr_mult_max': 91.0, 'volume_lookback': 144, 'volume_ratio_max': 60.5, 'max_hold_bars': 2, 'sl_atr_mult': 1.0, 'tp_atr_mult': 2.5, 'direction_mode': 'continuation', 'release_hour_mode': 'fixed_13_utc'}. Best is trial 0 with value: -9.6.
[I 2026-06-02 00:19:48,537] Trial 11 finished with value: -9.6 and parameters: {'atr_period': 10, 'pre_event_lookback': 4, 'reaction_bars': 1, 'min_reaction_return': 0.0003, 'pre_range_atr_mult_max': 69.0, 'volume_lookback': 192, 'volume_ratio_max': 70.5, 'max_hold_bars': 12, 'sl_atr_mult': 1.5, 'tp_atr_mult': 1.5, 'direction_mode': 'fade', 'release_hour_mode': 'us_dst_approx'}. Best is trial 0 with value: -9.6.
