[I 2026-06-02 00:19:27,662] Trial 3 finished with value: -9.7 and parameters: {'atr_period': 18, 'pre_event_lookback': 4, 'reaction_bars': 1, 'min_reaction_return': 0.0003, 'pre_range_atr_mult_max': 24.0, 'volume_lookback': 144, 'volume_ratio_max': 5.5, 'max_hold_bars': 12, 'sl_atr_mult': 2.0, 'tp_atr_mult': 3.5, 'direction_mode': 'continuation', 'release_hour_mode': 'fixed_13_utc'}. Best is trial 1 with value: -9.6.
[I 2026-06-02 00:19:27,691] Trial 0 finished with value: -1.2620332676788968 and parameters: {'atr_period': 18, 'pre_event_lookback': 8, 'reaction_bars': 1, 'min_reaction_return': 0.0, 'pre_range_atr_mult_max': 84.0, 'volume_lookback': 48, 'volume_ratio_max': 57.5, 'max_hold_bars': 10, 'sl_atr_mult': 2.0, 'tp_atr_mult': 3.5, 'direction_mode': 'continuation', 'release_hour_mode': 'fixed_13_utc'}. Best is trial 0 with value: -1.2620332676788968.
[I 2026-06-02 00:19:27,691] Trial 6 finished with value: -1.0438625333934441 and parameters: {'atr_period': 10, 'pre_event_lookback': 8, 'reaction_bars': 1, 'min_reaction_return': 0.00015, 'pre_range_atr_mult_max': 81.0, 'volume_lookback': 144, 'volume_ratio_max': 22.5, 'max_hold_bars': 2, 'sl_atr_mult': 1.0, 'tp_atr_mult': 1.5, 'direction_mode': 'continuation', 'release_hour_mode': 'fixed_13_utc'}. Best is trial 6 with value: -1.0438625333934441.
[I 2026-06-02 00:19:27,707] Trial 4 finished with value: -0.3168265103215883 and parameters: {'atr_period': 18, 'pre_event_lookback': 12, 'reaction_bars': 2, 'min_reaction_return': 0.0, 'pre_range_atr_mult_max': 25.0, 'volume_lookback': 96, 'volume_ratio_max': 6.5, 'max_hold_bars': 2, 'sl_atr_mult': 1.5, 'tp_atr_mult': 2.5, 'direction_mode': 'continuation', 'release_hour_mode': 'fixed_13_utc'}. Best is trial 4 with value: -0.3168265103215883.
C:\Users\הלל\Desktop\algo projects\trading-research-factory\walk forward engine\.venv\lib\site-packages\optuna\distributions.py:700: UserWarning: The distribution is specified by [10, 20] and step=4, but the range is not divisible by `step`. It will be replaced by [10, 18].
  warnings.warn(
C:\Users\הלל\Desktop\algo projects\trading-research-factory\walk forward engine\.venv\lib\site-packages\optuna\distributions.py:685: UserWarning: The distribution is specified by [0.0, 0.0005] and step=0.00015, but the range is not divisible by `step`. It will be replaced by [0.0, 0.00045].
  warnings.warn(
[I 2026-06-02 00:19:27,723] Trial 5 finished with value: -9.7 and parameters: {'atr_period': 14, 'pre_event_lookback': 4, 'reaction_bars': 2, 'min_reaction_return': 0.00015, 'pre_range_atr_mult_max': 32.0, 'volume_lookback': 144, 'volume_ratio_max': 70.5, 'max_hold_bars': 10, 'sl_atr_mult': 1.0, 'tp_atr_mult': 3.5, 'direction_mode': 'fade', 'release_hour_mode': 'fixed_12_utc'}. Best is trial 4 with value: -0.3168265103215883.
C:\Users\הלל\Desktop\algo projects\trading-research-factory\walk forward engine\.venv\lib\site-packages\optuna\distributions.py:685: UserWarning: The distribution is specified by [1.5, 99.0] and step=1.0, but the range is not divisible by `step`. It will be replaced by [1.5, 98.5].
  warnings.warn(
C:\Users\הלל\Desktop\algo projects\trading-research-factory\walk forward engine\.venv\lib\site-packages\optuna\distributions.py:685: UserWarning: The distribution is specified by [1.5, 4.0] and step=1.0, but the range is not divisible by `step`. It will be replaced by [1.5, 3.5].
  warnings.warn(
[I 2026-06-02 00:19:27,766] Trial 7 finished with value: -9.6 and parameters: {'atr_period': 14, 'pre_event_lookback': 8, 'reaction_bars': 2, 'min_reaction_return': 0.00045, 'pre_range_atr_mult_max': 32.0, 'volume_lookback': 48, 'volume_ratio_max': 14.5, 'max_hold_bars': 8, 'sl_atr_mult': 1.0, 'tp_atr_mult': 3.5, 'direction_mode': 'continuation', 'release_hour_mode': 'fixed_13_utc'}. Best is trial 4 with value: -0.3168265103215883.
C:\Users\הלל\Desktop\algo projects\trading-research-factory\walk forward engine\.venv\lib\site-packages\optuna\distributions.py:685: UserWarning: The distribution is specified by [1.5, 4.0] and step=1.0, but the range is not divisible by `step`. It will be replaced by [1.5, 3.5].
  warnings.warn(
[I 2026-06-02 00:19:28,025] Trial 8 finished with value: -9.7 and parameters: {'atr_period': 18, 'pre_event_lookback': 8, 'reaction_bars': 2, 'min_reaction_return': 0.00015, 'pre_range_atr_mult_max': 77.0, 'volume_lookback': 48, 'volume_ratio_max': 40.5, 'max_hold_bars': 2, 'sl_atr_mult': 1.5, 'tp_atr_mult': 2.5, 'direction_mode': 'fade', 'release_hour_mode': 'fixed_12_utc'}. Best is trial 4 with value: -0.3168265103215883.
[I 2026-06-02 00:19:28,220] Trial 10 finished with value: -1.3659278770869372 and parameters: {'atr_period': 14, 'pre_event_lookback': 4, 'reaction_bars': 1, 'min_reaction_return': 0.0, 'pre_range_atr_mult_max': 44.0, 'volume_lookback': 96, 'volume_ratio_max': 71.5, 'max_hold_bars': 2, 'sl_atr_mult': 2.0, 'tp_atr_mult': 1.5, 'direction_mode': 'continuation', 'release_hour_mode': 'fixed_13_utc'}. Best is trial 4 with value: -0.3168265103215883.
[I 2026-06-02 00:19:28,244] Trial 9 finished with value: -9.7 and parameters: {'atr_period': 18, 'pre_event_lookback': 4, 'reaction_bars': 2, 'min_reaction_return': 0.00045, 'pre_range_atr_mult_max': 49.0, 'volume_lookback': 192, 'volume_ratio_max': 77.5, 'max_hold_bars': 4, 'sl_atr_mult': 1.5, 'tp_atr_mult': 3.5, 'direction_mode': 'continuation', 'release_hour_mode': 'fixed_12_utc'}. Best is trial 4 with value: -0.3168265103215883.
[I 2026-06-02 00:19:28,272] Trial 11 finished with value: 1.7965574634981853 and parameters: {'atr_period': 18, 'pre_event_lookback': 12, 'reaction_bars': 1, 'min_reaction_return': 0.00045, 'pre_range_atr_mult_max': 29.0, 'volume_lookback': 96, 'volume_ratio_max': 94.5, 'max_hold_bars': 6, 'sl_atr_mult': 1.5, 'tp_atr_mult': 2.5, 'direction_mode': 'continuation', 'release_hour_mode': 'us_dst_approx'}. Best is trial 11 with value: 1.7965574634981853.
C:\Users\הלל\Desktop\algo projects\trading-research-factory\walk forward engine\.venv\lib\site-packages\optuna\samplers\_tpe\sampler.py:319: ExperimentalWarning: ``multivariate`` option is an experimental feature. The interface can change in the future.
  warnings.warn(
[I 2026-06-02 00:19:28,510] A new study created in memory with name: no-name-71179ad5-9b55-40bd-b528-b0386edf38e5
C:\Users\הלל\Desktop\algo projects\trading-research-factory\walk forward engine\.venv\lib\site-packages\optuna\distributions.py:700: UserWarning: The distribution is specified by [10, 20] and step=4, but the range is not divisible by `step`. It will be replaced by [10, 18].
  warnings.warn(
C:\Users\הלל\Desktop\algo projects\trading-research-factory\walk forward engine\.venv\lib\site-packages\optuna\distributions.py:685: UserWarning: The distribution is specified by [0.0, 0.0005] and step=0.00015, but the range is not divisible by `step`. It will be replaced by [0.0, 0.00045].
  warnings.warn(
C:\Users\הלל\Desktop\algo projects\trading-research-factory\walk forward engine\.venv\lib\site-packages\optuna\distributions.py:685: UserWarning: The distribution is specified by [1.5, 99.0] and step=1.0, but the range is not divisible by `step`. It will be replaced by [1.5, 98.5].
  warnings.warn(
C:\Users\הלל\Desktop\algo projects\trading-research-factory\walk forward engine\.venv\lib\site-packages\optuna\distributions.py:685: UserWarning: The distribution is specified by [1.5, 4.0] and step=1.0, but the range is not divisible by `step`. It will be replaced by [1.5, 3.5].
  warnings.warn(
C:\Users\הלל\Desktop\algo projects\trading-research-factory\walk forward engine\.venv\lib\site-packages\optuna\distributions.py:685: UserWarning: The distribution is specified by [1.5, 4.0] and step=1.0, but the range is not divisible by `step`. It will be replaced by [1.5, 3.5].
  warnings.warn(
C:\Users\הלל\Desktop\algo projects\trading-research-factory\walk forward engine\.venv\lib\site-packages\optuna\distributions.py:685: UserWarning: The distribution is specified by [1.5, 99.0] and step=1.0, but the range is not divisible by `step`. It will be replaced by [1.5, 98.5].
  warnings.warn(
C:\Users\הלל\Desktop\algo projects\trading-research-factory\walk forward engine\.venv\lib\site-packages\optuna\distributions.py:685: UserWarning: The distribution is specified by [1.5, 4.0] and step=1.0, but the range is not divisible by `step`. It will be replaced by [1.5, 3.5].
  warnings.warn(
C:\Users\הלל\Desktop\algo projects\trading-research-factory\walk forward engine\.venv\lib\site-packages\optuna\distributions.py:685: UserWarning: The distribution is specified by [1.5, 4.0] and step=1.0, but the range is not divisible by `step`. It will be replaced by [1.5, 3.5].
  warnings.warn(
[I 2026-06-02 00:19:29,163] Trial 0 finished with value: -9.8 and parameters: {'atr_period': 10, 'pre_event_lookback': 8, 'reaction_bars': 1, 'min_reaction_return': 0.0003, 'pre_range_atr_mult_max': 6.0, 'volume_lookback': 144, 'volume_ratio_max': 53.5, 'max_hold_bars': 10, 'sl_atr_mult': 1.0, 'tp_atr_mult': 1.5, 'direction_mode': 'continuation', 'release_hour_mode': 'fixed_13_utc'}. Best is trial 0 with value: -9.8.
C:\Users\הלל\Desktop\algo projects\trading-research-factory\walk forward engine\.venv\lib\site-packages\optuna\distributions.py:700: UserWarning: The distribution is specified by [10, 20] and step=4, but the range is not divisible by `step`. It will be replaced by [10, 18].
  warnings.warn(
C:\Users\הלל\Desktop\algo projects\trading-research-factory\walk forward engine\.venv\lib\site-packages\optuna\distributions.py:685: UserWarning: The distribution is specified by [0.0, 0.0005] and step=0.00015, but the range is not divisible by `step`. It will be replaced by [0.0, 0.00045].
  warnings.warn(
C:\Users\הלל\Desktop\algo projects\trading-research-factory\walk forward engine\.venv\lib\site-packages\optuna\distributions.py:685: UserWarning: The distribution is specified by [1.5, 99.0] and step=1.0, but the range is not divisible by `step`. It will be replaced by [1.5, 98.5].
  warnings.warn(
C:\Users\הלל\Desktop\algo projects\trading-research-factory\walk forward engine\.venv\lib\site-packages\optuna\distributions.py:685: UserWarning: The distribution is specified by [1.5, 4.0] and step=1.0, but the range is not divisible by `step`. It will be replaced by [1.5, 3.5].
  warnings.warn(
[I 2026-06-02 00:19:29,594] Trial 1 finished with value: -9.6 and parameters: {'atr_period': 14, 'pre_event_lookback': 8, 'reaction_bars': 2, 'min_reaction_return': 0.00045, 'pre_range_atr_mult_max': 99.0, 'volume_lookback': 144, 'volume_ratio_max': 28.5, 'max_hold_bars': 6, 'sl_atr_mult': 1.0, 'tp_atr_mult': 2.5, 'direction_mode': 'continuation', 'release_hour_mode': 'fixed_12_utc'}. Best is trial 1 with value: -9.6.
C:\Users\הלל\Desktop\algo projects\trading-research-factory\walk forward engine\.venv\lib\site-packages\optuna\distributions.py:700: UserWarning: The distribution is specified by [10, 20] and step=4, but the range is not divisible by `step`. It will be replaced by [10, 18].
  warnings.warn(
C:\Users\הלל\Desktop\algo projects\trading-research-factory\walk forward engine\.venv\lib\site-packages\optuna\distributions.py:685: UserWarning: The distribution is specified by [0.0, 0.0005] and step=0.00015, but the range is not divisible by `step`. It will be replaced by [0.0, 0.00045].
  warnings.warn(
C:\Users\הלל\Desktop\algo projects\trading-research-factory\walk forward engine\.venv\lib\site-packages\optuna\distributions.py:685: UserWarning: The distribution is specified by [1.5, 99.0] and step=1.0, but the range is not divisible by `step`. It will be replaced by [1.5, 98.5].
  warnings.warn(
C:\Users\הלל\Desktop\algo projects\trading-research-factory\walk forward engine\.venv\lib\site-packages\optuna\distributions.py:685: UserWarning: The distribution is specified by [1.5, 4.0] and step=1.0, but the range is not divisible by `step`. It will be replaced by [1.5, 3.5].
  warnings.warn(
[I 2026-06-02 00:19:29,640] Trial 5 finished with value: -9.6 and parameters: {'atr_period': 14, 'pre_event_lookback': 8, 'reaction_bars': 2, 'min_reaction_return': 0.0003, 'pre_range_atr_mult_max': 6.0, 'volume_lookback': 192, 'volume_ratio_max': 11.5, 'max_hold_bars': 2, 'sl_atr_mult': 1.5, 'tp_atr_mult': 1.5, 'direction_mode': 'continuation', 'release_hour_mode': 'us_dst_approx'}. Best is trial 1 with value: -9.6.
[I 2026-06-02 00:19:29,705] Trial 7 finished with value: -9.8 and parameters: {'atr_period': 10, 'pre_event_lookback': 8, 'reaction_bars': 1, 'min_reaction_return': 0.00045, 'pre_range_atr_mult_max': 80.0, 'volume_lookback': 192, 'volume_ratio_max': 10.5, 'max_hold_bars': 2, 'sl_atr_mult': 1.0, 'tp_atr_mult': 2.5, 'direction_mode': 'fade', 'release_hour_mode': 'fixed_13_utc'}. Best is trial 1 with value: -9.6.
C:\Users\הלל\Desktop\algo projects\trading-research-factory\walk forward engine\.venv\lib\site-packages\optuna\distributions.py:700: UserWarning: The distribution is specified by [10, 20] and step=4, but the range is not divisible by `step`. It will be replaced by [10, 18].
  warnings.warn(
C:\Users\הלל\Desktop\algo projects\trading-research-factory\walk forward engine\.venv\lib\site-packages\optuna\distributions.py:685: UserWarning: The distribution is specified by [0.0, 0.0005] and step=0.00015, but the range is not divisible by `step`. It will be replaced by [0.0, 0.00045].
  warnings.warn(
[I 2026-06-02 00:19:29,720] Trial 3 finished with value: -9.8 and parameters: {'atr_period': 14, 'pre_event_lookback': 4, 'reaction_bars': 1, 'min_reaction_return': 0.00045, 'pre_range_atr_mult_max': 42.0, 'volume_lookback': 96, 'volume_ratio_max': 84.5, 'max_hold_bars': 10, 'sl_atr_mult': 1.5, 'tp_atr_mult': 2.5, 'direction_mode': 'fade', 'release_hour_mode': 'fixed_13_utc'}. Best is trial 1 with value: -9.6.
[I 2026-06-02 00:19:29,736] Trial 6 finished with value: -9.8 and parameters: {'atr_period': 18, 'pre_event_lookback': 8, 'reaction_bars': 1, 'min_reaction_return': 0.00045, 'pre_range_atr_mult_max': 74.0, 'volume_lookback': 192, 'volume_ratio_max': 17.5, 'max_hold_bars': 2, 'sl_atr_mult': 1.5, 'tp_atr_mult': 1.5, 'direction_mode': 'fade', 'release_hour_mode': 'fixed_13_utc'}. Best is trial 1 with value: -9.6.
C:\Users\הלל\Desktop\algo projects\trading-research-factory\walk forward engine\.venv\lib\site-packages\optuna\distributions.py:685: UserWarning: The distribution is specified by [1.5, 99.0] and step=1.0, but the range is not divisible by `step`. It will be replaced by [1.5, 98.5].
  warnings.warn(
C:\Users\הלל\Desktop\algo projects\trading-research-factory\walk forward engine\.venv\lib\site-packages\optuna\distributions.py:685: UserWarning: The distribution is specified by [1.5, 4.0] and step=1.0, but the range is not divisible by `step`. It will be replaced by [1.5, 3.5].
  warnings.warn(
[I 2026-06-02 00:19:29,800] Trial 4 finished with value: -9.6 and parameters: {'atr_period': 18, 'pre_event_lookback': 12, 'reaction_bars': 2, 'min_reaction_return': 0.00015, 'pre_range_atr_mult_max': 59.0, 'volume_lookback': 192, 'volume_ratio_max': 68.5, 'max_hold_bars': 2, 'sl_atr_mult': 1.0, 'tp_atr_mult': 2.5, 'direction_mode': 'continuation', 'release_hour_mode': 'us_dst_approx'}. Best is trial 1 with value: -9.6.
[I 2026-06-02 00:19:29,834] Trial 2 finished with value: -1.426811139874012 and parameters: {'atr_period': 14, 'pre_event_lookback': 12, 'reaction_bars': 1, 'min_reaction_return': 0.0, 'pre_range_atr_mult_max': 58.0, 'volume_lookback': 48, 'volume_ratio_max': 48.5, 'max_hold_bars': 8, 'sl_atr_mult': 1.5, 'tp_atr_mult': 1.5, 'direction_mode': 'fade', 'release_hour_mode': 'fixed_13_utc'}. Best is trial 2 with value: -1.426811139874012.
[I 2026-06-02 00:19:29,979] Trial 8 finished with value: 1.8130892883351792 and parameters: {'atr_period': 10, 'pre_event_lookback': 8, 'reaction_bars': 2, 'min_reaction_return': 0.0003, 'pre_range_atr_mult_max': 54.0, 'volume_lookback': 144, 'volume_ratio_max': 27.5, 'max_hold_bars': 6, 'sl_atr_mult': 1.5, 'tp_atr_mult': 1.5, 'direction_mode': 'continuation', 'release_hour_mode': 'fixed_13_utc'}. Best is trial 8 with value: 1.8130892883351792.
[I 2026-06-02 00:19:30,074] Trial 9 finished with value: -0.22302613644969263 and parameters: {'atr_period': 14, 'pre_event_lookback': 4, 'reaction_bars': 1, 'min_reaction_return': 0.0, 'pre_range_atr_mult_max': 15.0, 'volume_lookback': 48, 'volume_ratio_max': 89.5, 'max_hold_bars': 10, 'sl_atr_mult': 2.0, 'tp_atr_mult': 1.5, 'direction_mode': 'continuation', 'release_hour_mode': 'fixed_13_utc'}. Best is trial 8 with value: 1.8130892883351792.
[I 2026-06-02 00:19:30,127] Trial 10 finished with value: -9.6 and parameters: {'atr_period': 14, 'pre_event_lookback': 4, 'reaction_bars': 1, 'min_reaction_return': 0.0003, 'pre_range_atr_mult_max': 40.0, 'volume_lookback': 192, 'volume_ratio_max': 54.5, 'max_hold_bars': 12, 'sl_atr_mult': 1.0, 'tp_atr_mult': 1.5, 'direction_mode': 'continuation', 'release_hour_mode': 'fixed_12_utc'}. Best is trial 8 with value: 1.8130892883351792.
[I 2026-06-02 00:19:30,151] Trial 11 finished with value: -9.7 and parameters: {'atr_period': 14, 'pre_event_lookback': 12, 'reaction_bars': 1, 'min_reaction_return': 0.0003, 'pre_range_atr_mult_max': 3.0, 'volume_lookback': 192, 'volume_ratio_max': 18.5, 'max_hold_bars': 6, 'sl_atr_mult': 1.5, 'tp_atr_mult': 1.5, 'direction_mode': 'continuation', 'release_hour_mode': 'fixed_12_utc'}. Best is trial 8 with value: 1.8130892883351792.
C:\Users\הלל\Desktop\algo projects\trading-research-factory\walk forward engine\.venv\lib\site-packages\optuna\samplers\_tpe\sampler.py:319: ExperimentalWarning: ``multivariate`` option is an experimental feature. The interface can change in the future.
  warnings.warn(
[I 2026-06-02 00:19:30,357] A new study created in memory with name: no-name-fe5e0b50-ab8c-408f-917c-b0a092ab477d
C:\Users\הלל\Desktop\algo projects\trading-research-factory\walk forward engine\.venv\lib\site-packages\optuna\distributions.py:700: UserWarning: The distribution is specified by [10, 20] and step=4, but the range is not divisible by `step`. It will be replaced by [10, 18].
  warnings.warn(
C:\Users\הלל\Desktop\algo projects\trading-research-factory\walk forward engine\.venv\lib\site-packages\optuna\distributions.py:685: UserWarning: The distribution is specified by [0.0, 0.0005] and step=0.00015, but the range is not divisible by `step`. It will be replaced by [0.0, 0.00045].
  warnings.warn(
C:\Users\הלל\Desktop\algo projects\trading-research-factory\walk forward engine\.venv\lib\site-packages\optuna\distributions.py:685: UserWarning: The distribution is specified by [1.5, 99.0] and step=1.0, but the range is not divisible by `step`. It will be replaced by [1.5, 98.5].
  warnings.warn(
C:\Users\הלל\Desktop\algo projects\trading-research-factory\walk forward engine\.venv\lib\site-packages\optuna\distributions.py:685: UserWarning: The distribution is specified by [1.5, 4.0] and step=1.0, but the range is not divisible by `step`. It will be replaced by [1.5, 3.5].
  warnings.warn(
C:\Users\הלל\Desktop\algo projects\trading-research-factory\walk forward engine\.venv\lib\site-packages\optuna\distributions.py:685: UserWarning: The distribution is specified by [1.5, 4.0] and step=1.0, but the range is not divisible by `step`. It will be replaced by [1.5, 3.5].
  warnings.warn(
C:\Users\הלל\Desktop\algo projects\trading-research-factory\walk forward engine\.venv\lib\site-packages\optuna\distributions.py:685: UserWarning: The distribution is specified by [0.0, 0.0005] and step=0.00015, but the range is not divisible by `step`. It will be replaced by [0.0, 0.00045].
  warnings.warn(
C:\Users\הלל\Desktop\algo projects\trading-research-factory\walk forward engine\.venv\lib\site-packages\optuna\distributions.py:685: UserWarning: The distribution is specified by [1.5, 99.0] and step=1.0, but the range is not divisible by `step`. It will be replaced by [1.5, 98.5].
  warnings.warn(
C:\Users\הלל\Desktop\algo projects\trading-research-factory\walk forward engine\.venv\lib\site-packages\optuna\distributions.py:685: UserWarning: The distribution is specified by [1.5, 99.0] and step=1.0, but the range is not divisible by `step`. It will be replaced by [1.5, 98.5].
  warnings.warn(
C:\Users\הלל\Desktop\algo projects\trading-research-factory\walk forward engine\.venv\lib\site-packages\optuna\distributions.py:685: UserWarning: The distribution is specified by [1.5, 4.0] and step=1.0, but the range is not divisible by `step`. It will be replaced by [1.5, 3.5].
  warnings.warn(
C:\Users\הלל\Desktop\algo projects\trading-research-factory\walk forward engine\.venv\lib\site-packages\optuna\distributions.py:685: UserWarning: The distribution is specified by [1.5, 4.0] and step=1.0, but the range is not divisible by `step`. It will be replaced by [1.5, 3.5].
  warnings.warn(
