[I 2026-06-02 00:20:57,347] Trial 3 finished with value: -9.7 and parameters: {'atr_period': 10, 'pre_event_lookback': 8, 'reaction_bars': 2, 'min_reaction_return': 0.0003, 'pre_range_atr_mult_max': 46.0, 'volume_lookback': 192, 'volume_ratio_max': 49.5, 'max_hold_bars': 8, 'sl_atr_mult': 1.5, 'tp_atr_mult': 2.5, 'direction_mode': 'continuation', 'release_hour_mode': 'fixed_12_utc'}. Best is trial 2 with value: -0.369427541303599.
[I 2026-06-02 00:20:57,354] Trial 4 finished with value: -0.7976437537179347 and parameters: {'atr_period': 14, 'pre_event_lookback': 8, 'reaction_bars': 2, 'min_reaction_return': 0.00015, 'pre_range_atr_mult_max': 42.0, 'volume_lookback': 48, 'volume_ratio_max': 33.5, 'max_hold_bars': 8, 'sl_atr_mult': 1.0, 'tp_atr_mult': 3.5, 'direction_mode': 'fade', 'release_hour_mode': 'fixed_12_utc'}. Best is trial 2 with value: -0.369427541303599.
[I 2026-06-02 00:20:57,651] Trial 10 finished with value: 0.09405320670645903 and parameters: {'atr_period': 14, 'pre_event_lookback': 8, 'reaction_bars': 2, 'min_reaction_return': 0.0, 'pre_range_atr_mult_max': 8.0, 'volume_lookback': 96, 'volume_ratio_max': 86.5, 'max_hold_bars': 8, 'sl_atr_mult': 1.0, 'tp_atr_mult': 1.5, 'direction_mode': 'continuation', 'release_hour_mode': 'fixed_13_utc'}. Best is trial 10 with value: 0.09405320670645903.
[I 2026-06-02 00:20:57,699] Trial 9 finished with value: -9.9 and parameters: {'atr_period': 18, 'pre_event_lookback': 4, 'reaction_bars': 1, 'min_reaction_return': 0.00045, 'pre_range_atr_mult_max': 44.0, 'volume_lookback': 144, 'volume_ratio_max': 47.5, 'max_hold_bars': 8, 'sl_atr_mult': 2.0, 'tp_atr_mult': 2.5, 'direction_mode': 'fade', 'release_hour_mode': 'fixed_12_utc'}. Best is trial 10 with value: 0.09405320670645903.
[I 2026-06-02 00:20:57,732] Trial 8 finished with value: -9.9 and parameters: {'atr_period': 10, 'pre_event_lookback': 12, 'reaction_bars': 1, 'min_reaction_return': 0.00045, 'pre_range_atr_mult_max': 96.0, 'volume_lookback': 96, 'volume_ratio_max': 93.5, 'max_hold_bars': 2, 'sl_atr_mult': 1.0, 'tp_atr_mult': 2.5, 'direction_mode': 'fade', 'release_hour_mode': 'fixed_12_utc'}. Best is trial 10 with value: 0.09405320670645903.
[I 2026-06-02 00:20:57,732] Trial 11 finished with value: -9.9 and parameters: {'atr_period': 10, 'pre_event_lookback': 4, 'reaction_bars': 1, 'min_reaction_return': 0.00045, 'pre_range_atr_mult_max': 68.0, 'volume_lookback': 144, 'volume_ratio_max': 59.5, 'max_hold_bars': 4, 'sl_atr_mult': 1.0, 'tp_atr_mult': 3.5, 'direction_mode': 'fade', 'release_hour_mode': 'fixed_13_utc'}. Best is trial 10 with value: 0.09405320670645903.
C:\Users\הלל\Desktop\algo projects\trading-research-factory\walk forward engine\.venv\lib\site-packages\optuna\samplers\_tpe\sampler.py:319: ExperimentalWarning: ``multivariate`` option is an experimental feature. The interface can change in the future.
  warnings.warn(
[I 2026-06-02 00:20:57,939] A new study created in memory with name: no-name-48be8792-6210-4332-a4ee-41d7a618d55c
C:\Users\הלל\Desktop\algo projects\trading-research-factory\walk forward engine\.venv\lib\site-packages\optuna\distributions.py:700: UserWarning: The distribution is specified by [10, 20] and step=4, but the range is not divisible by `step`. It will be replaced by [10, 18].
  warnings.warn(
C:\Users\הלל\Desktop\algo projects\trading-research-factory\walk forward engine\.venv\lib\site-packages\optuna\distributions.py:685: UserWarning: The distribution is specified by [0.0, 0.0005] and step=0.00015, but the range is not divisible by `step`. It will be replaced by [0.0, 0.00045].
  warnings.warn(
C:\Users\הלל\Desktop\algo projects\trading-research-factory\walk forward engine\.venv\lib\site-packages\optuna\distributions.py:685: UserWarning: The distribution is specified by [1.5, 99.0] and step=1.0, but the range is not divisible by `step`. It will be replaced by [1.5, 98.5].
  warnings.warn(
C:\Users\הלל\Desktop\algo projects\trading-research-factory\walk forward engine\.venv\lib\site-packages\optuna\distributions.py:685: UserWarning: The distribution is specified by [1.5, 4.0] and step=1.0, but the range is not divisible by `step`. It will be replaced by [1.5, 3.5].
  warnings.warn(
C:\Users\הלל\Desktop\algo projects\trading-research-factory\walk forward engine\.venv\lib\site-packages\optuna\distributions.py:685: UserWarning: The distribution is specified by [1.5, 4.0] and step=1.0, but the range is not divisible by `step`. It will be replaced by [1.5, 3.5].
  warnings.warn(
C:\Users\הלל\Desktop\algo projects\trading-research-factory\walk forward engine\.venv\lib\site-packages\optuna\distributions.py:685: UserWarning: The distribution is specified by [1.5, 99.0] and step=1.0, but the range is not divisible by `step`. It will be replaced by [1.5, 98.5].
  warnings.warn(
C:\Users\הלל\Desktop\algo projects\trading-research-factory\walk forward engine\.venv\lib\site-packages\optuna\distributions.py:685: UserWarning: The distribution is specified by [1.5, 4.0] and step=1.0, but the range is not divisible by `step`. It will be replaced by [1.5, 3.5].
  warnings.warn(
C:\Users\הלל\Desktop\algo projects\trading-research-factory\walk forward engine\.venv\lib\site-packages\optuna\distributions.py:685: UserWarning: The distribution is specified by [1.5, 4.0] and step=1.0, but the range is not divisible by `step`. It will be replaced by [1.5, 3.5].
  warnings.warn(
[I 2026-06-02 00:20:58,633] Trial 0 finished with value: -9.6 and parameters: {'atr_period': 10, 'pre_event_lookback': 4, 'reaction_bars': 2, 'min_reaction_return': 0.00045, 'pre_range_atr_mult_max': 81.0, 'volume_lookback': 48, 'volume_ratio_max': 29.5, 'max_hold_bars': 12, 'sl_atr_mult': 1.5, 'tp_atr_mult': 2.5, 'direction_mode': 'fade', 'release_hour_mode': 'fixed_13_utc'}. Best is trial 0 with value: -9.6.
[I 2026-06-02 00:20:58,656] Trial 3 finished with value: -9.9 and parameters: {'atr_period': 10, 'pre_event_lookback': 4, 'reaction_bars': 1, 'min_reaction_return': 0.00045, 'pre_range_atr_mult_max': 98.0, 'volume_lookback': 192, 'volume_ratio_max': 72.5, 'max_hold_bars': 8, 'sl_atr_mult': 1.0, 'tp_atr_mult': 1.5, 'direction_mode': 'fade', 'release_hour_mode': 'us_dst_approx'}. Best is trial 0 with value: -9.6.
C:\Users\הלל\Desktop\algo projects\trading-research-factory\walk forward engine\.venv\lib\site-packages\optuna\distributions.py:700: UserWarning: The distribution is specified by [10, 20] and step=4, but the range is not divisible by `step`. It will be replaced by [10, 18].
  warnings.warn(
C:\Users\הלל\Desktop\algo projects\trading-research-factory\walk forward engine\.venv\lib\site-packages\optuna\distributions.py:685: UserWarning: The distribution is specified by [0.0, 0.0005] and step=0.00015, but the range is not divisible by `step`. It will be replaced by [0.0, 0.00045].
  warnings.warn(
C:\Users\הלל\Desktop\algo projects\trading-research-factory\walk forward engine\.venv\lib\site-packages\optuna\distributions.py:685: UserWarning: The distribution is specified by [1.5, 99.0] and step=1.0, but the range is not divisible by `step`. It will be replaced by [1.5, 98.5].
  warnings.warn(
C:\Users\הלל\Desktop\algo projects\trading-research-factory\walk forward engine\.venv\lib\site-packages\optuna\distributions.py:685: UserWarning: The distribution is specified by [1.5, 4.0] and step=1.0, but the range is not divisible by `step`. It will be replaced by [1.5, 3.5].
  warnings.warn(
C:\Users\הלל\Desktop\algo projects\trading-research-factory\walk forward engine\.venv\lib\site-packages\optuna\distributions.py:700: UserWarning: The distribution is specified by [10, 20] and step=4, but the range is not divisible by `step`. It will be replaced by [10, 18].
  warnings.warn(
C:\Users\הלל\Desktop\algo projects\trading-research-factory\walk forward engine\.venv\lib\site-packages\optuna\distributions.py:685: UserWarning: The distribution is specified by [0.0, 0.0005] and step=0.00015, but the range is not divisible by `step`. It will be replaced by [0.0, 0.00045].
  warnings.warn(
C:\Users\הלל\Desktop\algo projects\trading-research-factory\walk forward engine\.venv\lib\site-packages\optuna\distributions.py:685: UserWarning: The distribution is specified by [1.5, 99.0] and step=1.0, but the range is not divisible by `step`. It will be replaced by [1.5, 98.5].
  warnings.warn(
C:\Users\הלל\Desktop\algo projects\trading-research-factory\walk forward engine\.venv\lib\site-packages\optuna\distributions.py:685: UserWarning: The distribution is specified by [1.5, 4.0] and step=1.0, but the range is not divisible by `step`. It will be replaced by [1.5, 3.5].
  warnings.warn(
[I 2026-06-02 00:20:58,764] Trial 4 finished with value: -9.9 and parameters: {'atr_period': 10, 'pre_event_lookback': 4, 'reaction_bars': 1, 'min_reaction_return': 0.0003, 'pre_range_atr_mult_max': 39.0, 'volume_lookback': 48, 'volume_ratio_max': 75.5, 'max_hold_bars': 12, 'sl_atr_mult': 2.0, 'tp_atr_mult': 1.5, 'direction_mode': 'fade', 'release_hour_mode': 'fixed_12_utc'}. Best is trial 0 with value: -9.6.
[I 2026-06-02 00:20:58,764] Trial 6 finished with value: -9.9 and parameters: {'atr_period': 18, 'pre_event_lookback': 12, 'reaction_bars': 1, 'min_reaction_return': 0.0003, 'pre_range_atr_mult_max': 93.0, 'volume_lookback': 192, 'volume_ratio_max': 96.5, 'max_hold_bars': 2, 'sl_atr_mult': 2.0, 'tp_atr_mult': 3.5, 'direction_mode': 'fade', 'release_hour_mode': 'fixed_12_utc'}. Best is trial 0 with value: -9.6.
C:\Users\הלל\Desktop\algo projects\trading-research-factory\walk forward engine\.venv\lib\site-packages\optuna\distributions.py:700: UserWarning: The distribution is specified by [10, 20] and step=4, but the range is not divisible by `step`. It will be replaced by [10, 18].
  warnings.warn(
C:\Users\הלל\Desktop\algo projects\trading-research-factory\walk forward engine\.venv\lib\site-packages\optuna\distributions.py:700: UserWarning: The distribution is specified by [10, 20] and step=4, but the range is not divisible by `step`. It will be replaced by [10, 18].
  warnings.warn(
[I 2026-06-02 00:20:58,851] Trial 7 finished with value: -9.6 and parameters: {'atr_period': 10, 'pre_event_lookback': 12, 'reaction_bars': 2, 'min_reaction_return': 0.00045, 'pre_range_atr_mult_max': 27.0, 'volume_lookback': 144, 'volume_ratio_max': 79.5, 'max_hold_bars': 6, 'sl_atr_mult': 1.0, 'tp_atr_mult': 2.5, 'direction_mode': 'fade', 'release_hour_mode': 'fixed_13_utc'}. Best is trial 0 with value: -9.6.
C:\Users\הלל\Desktop\algo projects\trading-research-factory\walk forward engine\.venv\lib\site-packages\optuna\distributions.py:685: UserWarning: The distribution is specified by [0.0, 0.0005] and step=0.00015, but the range is not divisible by `step`. It will be replaced by [0.0, 0.00045].
  warnings.warn(
C:\Users\הלל\Desktop\algo projects\trading-research-factory\walk forward engine\.venv\lib\site-packages\optuna\distributions.py:685: UserWarning: The distribution is specified by [1.5, 99.0] and step=1.0, but the range is not divisible by `step`. It will be replaced by [1.5, 98.5].
  warnings.warn(
C:\Users\הלל\Desktop\algo projects\trading-research-factory\walk forward engine\.venv\lib\site-packages\optuna\distributions.py:685: UserWarning: The distribution is specified by [1.5, 4.0] and step=1.0, but the range is not divisible by `step`. It will be replaced by [1.5, 3.5].
  warnings.warn(
[I 2026-06-02 00:20:58,907] Trial 1 finished with value: 0.9430583225738398 and parameters: {'atr_period': 18, 'pre_event_lookback': 4, 'reaction_bars': 1, 'min_reaction_return': 0.0, 'pre_range_atr_mult_max': 14.0, 'volume_lookback': 96, 'volume_ratio_max': 74.5, 'max_hold_bars': 10, 'sl_atr_mult': 2.0, 'tp_atr_mult': 3.5, 'direction_mode': 'fade', 'release_hour_mode': 'fixed_12_utc'}. Best is trial 1 with value: 0.9430583225738398.
[I 2026-06-02 00:20:58,939] Trial 5 finished with value: -9.6 and parameters: {'atr_period': 10, 'pre_event_lookback': 4, 'reaction_bars': 2, 'min_reaction_return': 0.0003, 'pre_range_atr_mult_max': 57.0, 'volume_lookback': 48, 'volume_ratio_max': 62.5, 'max_hold_bars': 6, 'sl_atr_mult': 2.0, 'tp_atr_mult': 1.5, 'direction_mode': 'continuation', 'release_hour_mode': 'fixed_13_utc'}. Best is trial 1 with value: 0.9430583225738398.
[I 2026-06-02 00:20:58,971] Trial 2 finished with value: -3.156589018822907 and parameters: {'atr_period': 14, 'pre_event_lookback': 4, 'reaction_bars': 2, 'min_reaction_return': 0.00015, 'pre_range_atr_mult_max': 13.0, 'volume_lookback': 48, 'volume_ratio_max': 81.5, 'max_hold_bars': 6, 'sl_atr_mult': 1.0, 'tp_atr_mult': 1.5, 'direction_mode': 'fade', 'release_hour_mode': 'us_dst_approx'}. Best is trial 1 with value: 0.9430583225738398.
[I 2026-06-02 00:20:59,217] Trial 8 finished with value: -9.8 and parameters: {'atr_period': 18, 'pre_event_lookback': 12, 'reaction_bars': 2, 'min_reaction_return': 0.00045, 'pre_range_atr_mult_max': 16.0, 'volume_lookback': 96, 'volume_ratio_max': 71.5, 'max_hold_bars': 8, 'sl_atr_mult': 1.5, 'tp_atr_mult': 3.5, 'direction_mode': 'continuation', 'release_hour_mode': 'fixed_12_utc'}. Best is trial 1 with value: 0.9430583225738398.
[I 2026-06-02 00:20:59,334] Trial 9 finished with value: -9.9 and parameters: {'atr_period': 10, 'pre_event_lookback': 8, 'reaction_bars': 1, 'min_reaction_return': 0.00045, 'pre_range_atr_mult_max': 66.0, 'volume_lookback': 48, 'volume_ratio_max': 96.5, 'max_hold_bars': 10, 'sl_atr_mult': 1.5, 'tp_atr_mult': 1.5, 'direction_mode': 'continuation', 'release_hour_mode': 'us_dst_approx'}. Best is trial 1 with value: 0.9430583225738398.
[I 2026-06-02 00:20:59,344] Trial 11 finished with value: 0.4714215686295313 and parameters: {'atr_period': 18, 'pre_event_lookback': 8, 'reaction_bars': 1, 'min_reaction_return': 0.00015, 'pre_range_atr_mult_max': 53.0, 'volume_lookback': 48, 'volume_ratio_max': 15.5, 'max_hold_bars': 4, 'sl_atr_mult': 1.0, 'tp_atr_mult': 3.5, 'direction_mode': 'continuation', 'release_hour_mode': 'fixed_13_utc'}. Best is trial 1 with value: 0.9430583225738398.
[I 2026-06-02 00:20:59,370] Trial 10 finished with value: -9.9 and parameters: {'atr_period': 18, 'pre_event_lookback': 12, 'reaction_bars': 1, 'min_reaction_return': 0.00045, 'pre_range_atr_mult_max': 6.0, 'volume_lookback': 48, 'volume_ratio_max': 14.5, 'max_hold_bars': 4, 'sl_atr_mult': 1.5, 'tp_atr_mult': 3.5, 'direction_mode': 'continuation', 'release_hour_mode': 'us_dst_approx'}. Best is trial 1 with value: 0.9430583225738398.
C:\Users\הלל\Desktop\algo projects\trading-research-factory\walk forward engine\.venv\lib\site-packages\optuna\samplers\_tpe\sampler.py:319: ExperimentalWarning: ``multivariate`` option is an experimental feature. The interface can change in the future.
  warnings.warn(
[I 2026-06-02 00:20:59,577] A new study created in memory with name: no-name-72e7f8f6-5492-4793-a652-4ae0aa368544
C:\Users\הלל\Desktop\algo projects\trading-research-factory\walk forward engine\.venv\lib\site-packages\optuna\distributions.py:700: UserWarning: The distribution is specified by [10, 20] and step=4, but the range is not divisible by `step`. It will be replaced by [10, 18].
  warnings.warn(
C:\Users\הלל\Desktop\algo projects\trading-research-factory\walk forward engine\.venv\lib\site-packages\optuna\distributions.py:685: UserWarning: The distribution is specified by [0.0, 0.0005] and step=0.00015, but the range is not divisible by `step`. It will be replaced by [0.0, 0.00045].
  warnings.warn(
C:\Users\הלל\Desktop\algo projects\trading-research-factory\walk forward engine\.venv\lib\site-packages\optuna\distributions.py:685: UserWarning: The distribution is specified by [1.5, 99.0] and step=1.0, but the range is not divisible by `step`. It will be replaced by [1.5, 98.5].
  warnings.warn(
C:\Users\הלל\Desktop\algo projects\trading-research-factory\walk forward engine\.venv\lib\site-packages\optuna\distributions.py:685: UserWarning: The distribution is specified by [1.5, 4.0] and step=1.0, but the range is not divisible by `step`. It will be replaced by [1.5, 3.5].
  warnings.warn(
C:\Users\הלל\Desktop\algo projects\trading-research-factory\walk forward engine\.venv\lib\site-packages\optuna\distributions.py:685: UserWarning: The distribution is specified by [1.5, 4.0] and step=1.0, but the range is not divisible by `step`. It will be replaced by [1.5, 3.5].
  warnings.warn(
C:\Users\הלל\Desktop\algo projects\trading-research-factory\walk forward engine\.venv\lib\site-packages\optuna\distributions.py:685: UserWarning: The distribution is specified by [0.0, 0.0005] and step=0.00015, but the range is not divisible by `step`. It will be replaced by [0.0, 0.00045].
  warnings.warn(
C:\Users\הלל\Desktop\algo projects\trading-research-factory\walk forward engine\.venv\lib\site-packages\optuna\distributions.py:685: UserWarning: The distribution is specified by [1.5, 99.0] and step=1.0, but the range is not divisible by `step`. It will be replaced by [1.5, 98.5].
  warnings.warn(
C:\Users\הלל\Desktop\algo projects\trading-research-factory\walk forward engine\.venv\lib\site-packages\optuna\distributions.py:685: UserWarning: The distribution is specified by [0.0, 0.0005] and step=0.00015, but the range is not divisible by `step`. It will be replaced by [0.0, 0.00045].
  warnings.warn(
C:\Users\הלל\Desktop\algo projects\trading-research-factory\walk forward engine\.venv\lib\site-packages\optuna\distributions.py:685: UserWarning: The distribution is specified by [1.5, 99.0] and step=1.0, but the range is not divisible by `step`. It will be replaced by [1.5, 98.5].
  warnings.warn(
C:\Users\הלל\Desktop\algo projects\trading-research-factory\walk forward engine\.venv\lib\site-packages\optuna\distributions.py:685: UserWarning: The distribution is specified by [1.5, 99.0] and step=1.0, but the range is not divisible by `step`. It will be replaced by [1.5, 98.5].
  warnings.warn(
C:\Users\הלל\Desktop\algo projects\trading-research-factory\walk forward engine\.venv\lib\site-packages\optuna\distributions.py:685: UserWarning: The distribution is specified by [1.5, 4.0] and step=1.0, but the range is not divisible by `step`. It will be replaced by [1.5, 3.5].
  warnings.warn(
C:\Users\הלל\Desktop\algo projects\trading-research-factory\walk forward engine\.venv\lib\site-packages\optuna\distributions.py:685: UserWarning: The distribution is specified by [1.5, 4.0] and step=1.0, but the range is not divisible by `step`. It will be replaced by [1.5, 3.5].
  warnings.warn(
[I 2026-06-02 00:21:00,166] Trial 0 finished with value: -2.644560613327904 and parameters: {'atr_period': 18, 'pre_event_lookback': 12, 'reaction_bars': 1, 'min_reaction_return': 0.0, 'pre_range_atr_mult_max': 80.0, 'volume_lookback': 96, 'volume_ratio_max': 24.5, 'max_hold_bars': 8, 'sl_atr_mult': 1.5, 'tp_atr_mult': 3.5, 'direction_mode': 'fade', 'release_hour_mode': 'fixed_13_utc'}. Best is trial 0 with value: -2.644560613327904.
C:\Users\הלל\Desktop\algo projects\trading-research-factory\walk forward engine\.venv\lib\site-packages\optuna\distributions.py:700: UserWarning: The distribution is specified by [10, 20] and step=4, but the range is not divisible by `step`. It will be replaced by [10, 18].
  warnings.warn(
C:\Users\הלל\Desktop\algo projects\trading-research-factory\walk forward engine\.venv\lib\site-packages\optuna\distributions.py:685: UserWarning: The distribution is specified by [0.0, 0.0005] and step=0.00015, but the range is not divisible by `step`. It will be replaced by [0.0, 0.00045].
  warnings.warn(
C:\Users\הלל\Desktop\algo projects\trading-research-factory\walk forward engine\.venv\lib\site-packages\optuna\distributions.py:685: UserWarning: The distribution is specified by [1.5, 99.0] and step=1.0, but the range is not divisible by `step`. It will be replaced by [1.5, 98.5].
  warnings.warn(
C:\Users\הלל\Desktop\algo projects\trading-research-factory\walk forward engine\.venv\lib\site-packages\optuna\distributions.py:685: UserWarning: The distribution is specified by [1.5, 4.0] and step=1.0, but the range is not divisible by `step`. It will be replaced by [1.5, 3.5].
  warnings.warn(
[I 2026-06-02 00:21:00,239] Trial 2 finished with value: -1.8499054628968798 and parameters: {'atr_period': 18, 'pre_event_lookback': 12, 'reaction_bars': 1, 'min_reaction_return': 0.00015, 'pre_range_atr_mult_max': 93.0, 'volume_lookback': 192, 'volume_ratio_max': 30.5, 'max_hold_bars': 12, 'sl_atr_mult': 2.0, 'tp_atr_mult': 2.5, 'direction_mode': 'fade', 'release_hour_mode': 'us_dst_approx'}. Best is trial 2 with value: -1.8499054628968798.
C:\Users\הלל\Desktop\algo projects\trading-research-factory\walk forward engine\.venv\lib\site-packages\optuna\distributions.py:700: UserWarning: The distribution is specified by [10, 20] and step=4, but the range is not divisible by `step`. It will be replaced by [10, 18].
  warnings.warn(
C:\Users\הלל\Desktop\algo projects\trading-research-factory\walk forward engine\.venv\lib\site-packages\optuna\distributions.py:685: UserWarning: The distribution is specified by [0.0, 0.0005] and step=0.00015, but the range is not divisible by `step`. It will be replaced by [0.0, 0.00045].
  warnings.warn(
C:\Users\הלל\Desktop\algo projects\trading-research-factory\walk forward engine\.venv\lib\site-packages\optuna\distributions.py:685: UserWarning: The distribution is specified by [1.5, 99.0] and step=1.0, but the range is not divisible by `step`. It will be replaced by [1.5, 98.5].
  warnings.warn(
C:\Users\הלל\Desktop\algo projects\trading-research-factory\walk forward engine\.venv\lib\site-packages\optuna\distributions.py:685: UserWarning: The distribution is specified by [1.5, 4.0] and step=1.0, but the range is not divisible by `step`. It will be replaced by [1.5, 3.5].
  warnings.warn(
