[I 2026-06-02 00:21:00,507] Trial 4 finished with value: -9.7 and parameters: {'atr_period': 14, 'pre_event_lookback': 12, 'reaction_bars': 2, 'min_reaction_return': 0.0003, 'pre_range_atr_mult_max': 60.0, 'volume_lookback': 48, 'volume_ratio_max': 35.5, 'max_hold_bars': 10, 'sl_atr_mult': 1.5, 'tp_atr_mult': 3.5, 'direction_mode': 'fade', 'release_hour_mode': 'fixed_12_utc'}. Best is trial 2 with value: -1.8499054628968798.
[I 2026-06-02 00:21:00,530] Trial 5 finished with value: -9.6 and parameters: {'atr_period': 18, 'pre_event_lookback': 12, 'reaction_bars': 2, 'min_reaction_return': 0.00045, 'pre_range_atr_mult_max': 84.0, 'volume_lookback': 192, 'volume_ratio_max': 47.5, 'max_hold_bars': 6, 'sl_atr_mult': 1.0, 'tp_atr_mult': 1.5, 'direction_mode': 'fade', 'release_hour_mode': 'fixed_13_utc'}. Best is trial 2 with value: -1.8499054628968798.
C:\Users\הלל\Desktop\algo projects\trading-research-factory\walk forward engine\.venv\lib\site-packages\optuna\distributions.py:700: UserWarning: The distribution is specified by [10, 20] and step=4, but the range is not divisible by `step`. It will be replaced by [10, 18].
  warnings.warn(
C:\Users\הלל\Desktop\algo projects\trading-research-factory\walk forward engine\.venv\lib\site-packages\optuna\distributions.py:685: UserWarning: The distribution is specified by [0.0, 0.0005] and step=0.00015, but the range is not divisible by `step`. It will be replaced by [0.0, 0.00045].
  warnings.warn(
[I 2026-06-02 00:21:00,547] Trial 3 finished with value: 1.451730940199744 and parameters: {'atr_period': 10, 'pre_event_lookback': 8, 'reaction_bars': 1, 'min_reaction_return': 0.00015, 'pre_range_atr_mult_max': 66.0, 'volume_lookback': 144, 'volume_ratio_max': 88.5, 'max_hold_bars': 6, 'sl_atr_mult': 1.0, 'tp_atr_mult': 2.5, 'direction_mode': 'continuation', 'release_hour_mode': 'fixed_13_utc'}. Best is trial 3 with value: 1.451730940199744.
C:\Users\הלל\Desktop\algo projects\trading-research-factory\walk forward engine\.venv\lib\site-packages\optuna\distributions.py:685: UserWarning: The distribution is specified by [1.5, 99.0] and step=1.0, but the range is not divisible by `step`. It will be replaced by [1.5, 98.5].
  warnings.warn(
C:\Users\הלל\Desktop\algo projects\trading-research-factory\walk forward engine\.venv\lib\site-packages\optuna\distributions.py:685: UserWarning: The distribution is specified by [1.5, 4.0] and step=1.0, but the range is not divisible by `step`. It will be replaced by [1.5, 3.5].
  warnings.warn(
[I 2026-06-02 00:21:00,547] Trial 7 finished with value: -1.7333177076117576 and parameters: {'atr_period': 18, 'pre_event_lookback': 12, 'reaction_bars': 2, 'min_reaction_return': 0.00015, 'pre_range_atr_mult_max': 34.0, 'volume_lookback': 96, 'volume_ratio_max': 56.5, 'max_hold_bars': 6, 'sl_atr_mult': 1.0, 'tp_atr_mult': 2.5, 'direction_mode': 'fade', 'release_hour_mode': 'fixed_13_utc'}. Best is trial 3 with value: 1.451730940199744.
C:\Users\הלל\Desktop\algo projects\trading-research-factory\walk forward engine\.venv\lib\site-packages\optuna\distributions.py:685: UserWarning: The distribution is specified by [0.0, 0.0005] and step=0.00015, but the range is not divisible by `step`. It will be replaced by [0.0, 0.00045].
  warnings.warn(
C:\Users\הלל\Desktop\algo projects\trading-research-factory\walk forward engine\.venv\lib\site-packages\optuna\distributions.py:685: UserWarning: The distribution is specified by [1.5, 99.0] and step=1.0, but the range is not divisible by `step`. It will be replaced by [1.5, 98.5].
  warnings.warn(
C:\Users\הלל\Desktop\algo projects\trading-research-factory\walk forward engine\.venv\lib\site-packages\optuna\distributions.py:685: UserWarning: The distribution is specified by [1.5, 4.0] and step=1.0, but the range is not divisible by `step`. It will be replaced by [1.5, 3.5].
  warnings.warn(
[I 2026-06-02 00:21:00,659] Trial 6 finished with value: 0.5187524908628075 and parameters: {'atr_period': 18, 'pre_event_lookback': 12, 'reaction_bars': 1, 'min_reaction_return': 0.00015, 'pre_range_atr_mult_max': 29.0, 'volume_lookback': 96, 'volume_ratio_max': 96.5, 'max_hold_bars': 4, 'sl_atr_mult': 1.0, 'tp_atr_mult': 2.5, 'direction_mode': 'continuation', 'release_hour_mode': 'us_dst_approx'}. Best is trial 3 with value: 1.451730940199744.
[I 2026-06-02 00:21:00,668] Trial 1 finished with value: -0.6934590153477085 and parameters: {'atr_period': 14, 'pre_event_lookback': 8, 'reaction_bars': 2, 'min_reaction_return': 0.0, 'pre_range_atr_mult_max': 56.0, 'volume_lookback': 96, 'volume_ratio_max': 67.5, 'max_hold_bars': 12, 'sl_atr_mult': 1.0, 'tp_atr_mult': 3.5, 'direction_mode': 'fade', 'release_hour_mode': 'fixed_12_utc'}. Best is trial 3 with value: 1.451730940199744.
[I 2026-06-02 00:21:00,992] Trial 9 finished with value: -9.7 and parameters: {'atr_period': 18, 'pre_event_lookback': 4, 'reaction_bars': 2, 'min_reaction_return': 0.00015, 'pre_range_atr_mult_max': 39.0, 'volume_lookback': 192, 'volume_ratio_max': 46.5, 'max_hold_bars': 10, 'sl_atr_mult': 1.0, 'tp_atr_mult': 3.5, 'direction_mode': 'continuation', 'release_hour_mode': 'fixed_12_utc'}. Best is trial 3 with value: 1.451730940199744.
[I 2026-06-02 00:21:00,992] Trial 8 finished with value: -9.7 and parameters: {'atr_period': 10, 'pre_event_lookback': 8, 'reaction_bars': 2, 'min_reaction_return': 0.00045, 'pre_range_atr_mult_max': 26.0, 'volume_lookback': 48, 'volume_ratio_max': 84.5, 'max_hold_bars': 2, 'sl_atr_mult': 2.0, 'tp_atr_mult': 2.5, 'direction_mode': 'continuation', 'release_hour_mode': 'fixed_12_utc'}. Best is trial 3 with value: 1.451730940199744.
[I 2026-06-02 00:21:01,096] Trial 10 finished with value: 0.8130342900770396 and parameters: {'atr_period': 10, 'pre_event_lookback': 12, 'reaction_bars': 1, 'min_reaction_return': 0.0, 'pre_range_atr_mult_max': 92.0, 'volume_lookback': 144, 'volume_ratio_max': 42.5, 'max_hold_bars': 8, 'sl_atr_mult': 1.5, 'tp_atr_mult': 3.5, 'direction_mode': 'continuation', 'release_hour_mode': 'us_dst_approx'}. Best is trial 3 with value: 1.451730940199744.
[I 2026-06-02 00:21:01,129] Trial 11 finished with value: -1.0836827697872986 and parameters: {'atr_period': 14, 'pre_event_lookback': 12, 'reaction_bars': 1, 'min_reaction_return': 0.0, 'pre_range_atr_mult_max': 91.0, 'volume_lookback': 192, 'volume_ratio_max': 17.5, 'max_hold_bars': 12, 'sl_atr_mult': 1.5, 'tp_atr_mult': 1.5, 'direction_mode': 'fade', 'release_hour_mode': 'fixed_12_utc'}. Best is trial 3 with value: 1.451730940199744.
C:\Users\הלל\Desktop\algo projects\trading-research-factory\walk forward engine\.venv\lib\site-packages\optuna\samplers\_tpe\sampler.py:319: ExperimentalWarning: ``multivariate`` option is an experimental feature. The interface can change in the future.
  warnings.warn(
[I 2026-06-02 00:21:01,338] A new study created in memory with name: no-name-733a4a33-a333-44f8-a1d6-cf3255632258
C:\Users\הלל\Desktop\algo projects\trading-research-factory\walk forward engine\.venv\lib\site-packages\optuna\distributions.py:700: UserWarning: The distribution is specified by [10, 20] and step=4, but the range is not divisible by `step`. It will be replaced by [10, 18].
  warnings.warn(
C:\Users\הלל\Desktop\algo projects\trading-research-factory\walk forward engine\.venv\lib\site-packages\optuna\distributions.py:685: UserWarning: The distribution is specified by [0.0, 0.0005] and step=0.00015, but the range is not divisible by `step`. It will be replaced by [0.0, 0.00045].
  warnings.warn(
C:\Users\הלל\Desktop\algo projects\trading-research-factory\walk forward engine\.venv\lib\site-packages\optuna\distributions.py:685: UserWarning: The distribution is specified by [1.5, 99.0] and step=1.0, but the range is not divisible by `step`. It will be replaced by [1.5, 98.5].
  warnings.warn(
C:\Users\הלל\Desktop\algo projects\trading-research-factory\walk forward engine\.venv\lib\site-packages\optuna\distributions.py:685: UserWarning: The distribution is specified by [1.5, 4.0] and step=1.0, but the range is not divisible by `step`. It will be replaced by [1.5, 3.5].
  warnings.warn(
C:\Users\הלל\Desktop\algo projects\trading-research-factory\walk forward engine\.venv\lib\site-packages\optuna\distributions.py:685: UserWarning: The distribution is specified by [1.5, 99.0] and step=1.0, but the range is not divisible by `step`. It will be replaced by [1.5, 98.5].
  warnings.warn(
C:\Users\הלל\Desktop\algo projects\trading-research-factory\walk forward engine\.venv\lib\site-packages\optuna\distributions.py:685: UserWarning: The distribution is specified by [1.5, 4.0] and step=1.0, but the range is not divisible by `step`. It will be replaced by [1.5, 3.5].
  warnings.warn(
[I 2026-06-02 00:21:01,948] Trial 0 finished with value: 1.3863341002632892 and parameters: {'atr_period': 14, 'pre_event_lookback': 12, 'reaction_bars': 1, 'min_reaction_return': 0.0, 'pre_range_atr_mult_max': 94.0, 'volume_lookback': 192, 'volume_ratio_max': 2.5, 'max_hold_bars': 4, 'sl_atr_mult': 2.0, 'tp_atr_mult': 1.5, 'direction_mode': 'continuation', 'release_hour_mode': 'fixed_13_utc'}. Best is trial 0 with value: 1.3863341002632892.
C:\Users\הלל\Desktop\algo projects\trading-research-factory\walk forward engine\.venv\lib\site-packages\optuna\distributions.py:700: UserWarning: The distribution is specified by [10, 20] and step=4, but the range is not divisible by `step`. It will be replaced by [10, 18].
  warnings.warn(
C:\Users\הלל\Desktop\algo projects\trading-research-factory\walk forward engine\.venv\lib\site-packages\optuna\distributions.py:685: UserWarning: The distribution is specified by [0.0, 0.0005] and step=0.00015, but the range is not divisible by `step`. It will be replaced by [0.0, 0.00045].
  warnings.warn(
C:\Users\הלל\Desktop\algo projects\trading-research-factory\walk forward engine\.venv\lib\site-packages\optuna\distributions.py:685: UserWarning: The distribution is specified by [1.5, 99.0] and step=1.0, but the range is not divisible by `step`. It will be replaced by [1.5, 98.5].
  warnings.warn(
C:\Users\הלל\Desktop\algo projects\trading-research-factory\walk forward engine\.venv\lib\site-packages\optuna\distributions.py:685: UserWarning: The distribution is specified by [1.5, 4.0] and step=1.0, but the range is not divisible by `step`. It will be replaced by [1.5, 3.5].
  warnings.warn(
[I 2026-06-02 00:21:02,192] Trial 1 finished with value: -1.5059601588470792 and parameters: {'atr_period': 14, 'pre_event_lookback': 12, 'reaction_bars': 1, 'min_reaction_return': 0.0, 'pre_range_atr_mult_max': 98.0, 'volume_lookback': 144, 'volume_ratio_max': 17.5, 'max_hold_bars': 12, 'sl_atr_mult': 1.0, 'tp_atr_mult': 3.5, 'direction_mode': 'continuation', 'release_hour_mode': 'us_dst_approx'}. Best is trial 0 with value: 1.3863341002632892.
[I 2026-06-02 00:21:02,212] Trial 7 finished with value: -9.7 and parameters: {'atr_period': 18, 'pre_event_lookback': 12, 'reaction_bars': 1, 'min_reaction_return': 0.00045, 'pre_range_atr_mult_max': 88.0, 'volume_lookback': 96, 'volume_ratio_max': 49.5, 'max_hold_bars': 12, 'sl_atr_mult': 1.5, 'tp_atr_mult': 1.5, 'direction_mode': 'fade', 'release_hour_mode': 'fixed_13_utc'}. Best is trial 0 with value: 1.3863341002632892.
C:\Users\הלל\Desktop\algo projects\trading-research-factory\walk forward engine\.venv\lib\site-packages\optuna\distributions.py:700: UserWarning: The distribution is specified by [10, 20] and step=4, but the range is not divisible by `step`. It will be replaced by [10, 18].
  warnings.warn(
C:\Users\הלל\Desktop\algo projects\trading-research-factory\walk forward engine\.venv\lib\site-packages\optuna\distributions.py:685: UserWarning: The distribution is specified by [0.0, 0.0005] and step=0.00015, but the range is not divisible by `step`. It will be replaced by [0.0, 0.00045].
  warnings.warn(
C:\Users\הלל\Desktop\algo projects\trading-research-factory\walk forward engine\.venv\lib\site-packages\optuna\distributions.py:685: UserWarning: The distribution is specified by [1.5, 99.0] and step=1.0, but the range is not divisible by `step`. It will be replaced by [1.5, 98.5].
  warnings.warn(
C:\Users\הלל\Desktop\algo projects\trading-research-factory\walk forward engine\.venv\lib\site-packages\optuna\distributions.py:685: UserWarning: The distribution is specified by [1.5, 4.0] and step=1.0, but the range is not divisible by `step`. It will be replaced by [1.5, 3.5].
  warnings.warn(
C:\Users\הלל\Desktop\algo projects\trading-research-factory\walk forward engine\.venv\lib\site-packages\optuna\distributions.py:700: UserWarning: The distribution is specified by [10, 20] and step=4, but the range is not divisible by `step`. It will be replaced by [10, 18].
  warnings.warn(
[I 2026-06-02 00:21:02,317] Trial 2 finished with value: -9.6 and parameters: {'atr_period': 18, 'pre_event_lookback': 8, 'reaction_bars': 2, 'min_reaction_return': 0.00045, 'pre_range_atr_mult_max': 79.0, 'volume_lookback': 144, 'volume_ratio_max': 73.5, 'max_hold_bars': 4, 'sl_atr_mult': 1.0, 'tp_atr_mult': 3.5, 'direction_mode': 'fade', 'release_hour_mode': 'us_dst_approx'}. Best is trial 0 with value: 1.3863341002632892.
C:\Users\הלל\Desktop\algo projects\trading-research-factory\walk forward engine\.venv\lib\site-packages\optuna\distributions.py:685: UserWarning: The distribution is specified by [0.0, 0.0005] and step=0.00015, but the range is not divisible by `step`. It will be replaced by [0.0, 0.00045].
  warnings.warn(
[I 2026-06-02 00:21:02,327] Trial 3 finished with value: -2.740099230162726 and parameters: {'atr_period': 10, 'pre_event_lookback': 12, 'reaction_bars': 1, 'min_reaction_return': 0.0, 'pre_range_atr_mult_max': 50.0, 'volume_lookback': 48, 'volume_ratio_max': 30.5, 'max_hold_bars': 2, 'sl_atr_mult': 1.5, 'tp_atr_mult': 2.5, 'direction_mode': 'continuation', 'release_hour_mode': 'us_dst_approx'}. Best is trial 0 with value: 1.3863341002632892.
[I 2026-06-02 00:21:02,341] Trial 5 finished with value: -2.4060221039344345 and parameters: {'atr_period': 14, 'pre_event_lookback': 12, 'reaction_bars': 2, 'min_reaction_return': 0.00015, 'pre_range_atr_mult_max': 72.0, 'volume_lookback': 192, 'volume_ratio_max': 18.5, 'max_hold_bars': 8, 'sl_atr_mult': 1.0, 'tp_atr_mult': 3.5, 'direction_mode': 'fade', 'release_hour_mode': 'fixed_13_utc'}. Best is trial 0 with value: 1.3863341002632892.
C:\Users\הלל\Desktop\algo projects\trading-research-factory\walk forward engine\.venv\lib\site-packages\optuna\distributions.py:685: UserWarning: The distribution is specified by [1.5, 99.0] and step=1.0, but the range is not divisible by `step`. It will be replaced by [1.5, 98.5].
  warnings.warn(
C:\Users\הלל\Desktop\algo projects\trading-research-factory\walk forward engine\.venv\lib\site-packages\optuna\distributions.py:685: UserWarning: The distribution is specified by [1.5, 4.0] and step=1.0, but the range is not divisible by `step`. It will be replaced by [1.5, 3.5].
  warnings.warn(
C:\Users\הלל\Desktop\algo projects\trading-research-factory\walk forward engine\.venv\lib\site-packages\optuna\distributions.py:685: UserWarning: The distribution is specified by [1.5, 99.0] and step=1.0, but the range is not divisible by `step`. It will be replaced by [1.5, 98.5].
  warnings.warn(
C:\Users\הלל\Desktop\algo projects\trading-research-factory\walk forward engine\.venv\lib\site-packages\optuna\distributions.py:685: UserWarning: The distribution is specified by [1.5, 4.0] and step=1.0, but the range is not divisible by `step`. It will be replaced by [1.5, 3.5].
  warnings.warn(
[I 2026-06-02 00:21:02,417] Trial 4 finished with value: -9.6 and parameters: {'atr_period': 14, 'pre_event_lookback': 12, 'reaction_bars': 1, 'min_reaction_return': 0.00045, 'pre_range_atr_mult_max': 64.0, 'volume_lookback': 48, 'volume_ratio_max': 28.5, 'max_hold_bars': 10, 'sl_atr_mult': 1.5, 'tp_atr_mult': 3.5, 'direction_mode': 'fade', 'release_hour_mode': 'fixed_12_utc'}. Best is trial 0 with value: 1.3863341002632892.
[I 2026-06-02 00:21:02,449] Trial 6 finished with value: -9.6 and parameters: {'atr_period': 14, 'pre_event_lookback': 8, 'reaction_bars': 2, 'min_reaction_return': 0.00045, 'pre_range_atr_mult_max': 69.0, 'volume_lookback': 192, 'volume_ratio_max': 68.5, 'max_hold_bars': 2, 'sl_atr_mult': 1.5, 'tp_atr_mult': 1.5, 'direction_mode': 'fade', 'release_hour_mode': 'us_dst_approx'}. Best is trial 0 with value: 1.3863341002632892.
[I 2026-06-02 00:21:02,744] Trial 8 finished with value: 0.8420314350670903 and parameters: {'atr_period': 14, 'pre_event_lookback': 4, 'reaction_bars': 2, 'min_reaction_return': 0.0, 'pre_range_atr_mult_max': 92.0, 'volume_lookback': 96, 'volume_ratio_max': 20.5, 'max_hold_bars': 10, 'sl_atr_mult': 2.0, 'tp_atr_mult': 2.5, 'direction_mode': 'continuation', 'release_hour_mode': 'fixed_12_utc'}. Best is trial 0 with value: 1.3863341002632892.
[I 2026-06-02 00:21:02,847] Trial 9 finished with value: -9.6 and parameters: {'atr_period': 10, 'pre_event_lookback': 4, 'reaction_bars': 1, 'min_reaction_return': 0.00015, 'pre_range_atr_mult_max': 88.0, 'volume_lookback': 96, 'volume_ratio_max': 32.5, 'max_hold_bars': 12, 'sl_atr_mult': 2.0, 'tp_atr_mult': 2.5, 'direction_mode': 'continuation', 'release_hour_mode': 'fixed_13_utc'}. Best is trial 0 with value: 1.3863341002632892.
[I 2026-06-02 00:21:02,890] Trial 11 finished with value: -9.6 and parameters: {'atr_period': 18, 'pre_event_lookback': 4, 'reaction_bars': 2, 'min_reaction_return': 0.00015, 'pre_range_atr_mult_max': 61.0, 'volume_lookback': 192, 'volume_ratio_max': 32.5, 'max_hold_bars': 6, 'sl_atr_mult': 1.0, 'tp_atr_mult': 3.5, 'direction_mode': 'continuation', 'release_hour_mode': 'fixed_12_utc'}. Best is trial 0 with value: 1.3863341002632892.
[I 2026-06-02 00:21:02,919] Trial 10 finished with value: -9.6 and parameters: {'atr_period': 10, 'pre_event_lookback': 12, 'reaction_bars': 1, 'min_reaction_return': 0.00045, 'pre_range_atr_mult_max': 34.0, 'volume_lookback': 192, 'volume_ratio_max': 66.5, 'max_hold_bars': 4, 'sl_atr_mult': 1.5, 'tp_atr_mult': 2.5, 'direction_mode': 'continuation', 'release_hour_mode': 'us_dst_approx'}. Best is trial 0 with value: 1.3863341002632892.
C:\Users\הלל\Desktop\algo projects\trading-research-factory\walk forward engine\.venv\lib\site-packages\optuna\samplers\_tpe\sampler.py:319: ExperimentalWarning: ``multivariate`` option is an experimental feature. The interface can change in the future.
  warnings.warn(
[I 2026-06-02 00:21:03,134] A new study created in memory with name: no-name-58be8498-a4db-47cd-ba37-59928769f57d
C:\Users\הלל\Desktop\algo projects\trading-research-factory\walk forward engine\.venv\lib\site-packages\optuna\distributions.py:700: UserWarning: The distribution is specified by [10, 20] and step=4, but the range is not divisible by `step`. It will be replaced by [10, 18].
  warnings.warn(
C:\Users\הלל\Desktop\algo projects\trading-research-factory\walk forward engine\.venv\lib\site-packages\optuna\distributions.py:685: UserWarning: The distribution is specified by [0.0, 0.0005] and step=0.00015, but the range is not divisible by `step`. It will be replaced by [0.0, 0.00045].
  warnings.warn(
C:\Users\הלל\Desktop\algo projects\trading-research-factory\walk forward engine\.venv\lib\site-packages\optuna\distributions.py:685: UserWarning: The distribution is specified by [1.5, 99.0] and step=1.0, but the range is not divisible by `step`. It will be replaced by [1.5, 98.5].
  warnings.warn(
C:\Users\הלל\Desktop\algo projects\trading-research-factory\walk forward engine\.venv\lib\site-packages\optuna\distributions.py:685: UserWarning: The distribution is specified by [1.5, 4.0] and step=1.0, but the range is not divisible by `step`. It will be replaced by [1.5, 3.5].
  warnings.warn(
C:\Users\הלל\Desktop\algo projects\trading-research-factory\walk forward engine\.venv\lib\site-packages\optuna\distributions.py:685: UserWarning: The distribution is specified by [0.0, 0.0005] and step=0.00015, but the range is not divisible by `step`. It will be replaced by [0.0, 0.00045].
  warnings.warn(
C:\Users\הלל\Desktop\algo projects\trading-research-factory\walk forward engine\.venv\lib\site-packages\optuna\distributions.py:685: UserWarning: The distribution is specified by [1.5, 99.0] and step=1.0, but the range is not divisible by `step`. It will be replaced by [1.5, 98.5].
  warnings.warn(
C:\Users\הלל\Desktop\algo projects\trading-research-factory\walk forward engine\.venv\lib\site-packages\optuna\distributions.py:685: UserWarning: The distribution is specified by [1.5, 99.0] and step=1.0, but the range is not divisible by `step`. It will be replaced by [1.5, 98.5].
  warnings.warn(
C:\Users\הלל\Desktop\algo projects\trading-research-factory\walk forward engine\.venv\lib\site-packages\optuna\distributions.py:685: UserWarning: The distribution is specified by [1.5, 4.0] and step=1.0, but the range is not divisible by `step`. It will be replaced by [1.5, 3.5].
  warnings.warn(
C:\Users\הלל\Desktop\algo projects\trading-research-factory\walk forward engine\.venv\lib\site-packages\optuna\distributions.py:685: UserWarning: The distribution is specified by [1.5, 4.0] and step=1.0, but the range is not divisible by `step`. It will be replaced by [1.5, 3.5].
  warnings.warn(
