[I 2026-06-02 00:20:29,497] Trial 0 finished with value: -9.6 and parameters: {'atr_period': 10, 'pre_event_lookback': 4, 'reaction_bars': 2, 'min_reaction_return': 0.00045, 'pre_range_atr_mult_max': 39.0, 'volume_lookback': 96, 'volume_ratio_max': 22.5, 'max_hold_bars': 4, 'sl_atr_mult': 1.0, 'tp_atr_mult': 2.5, 'direction_mode': 'fade', 'release_hour_mode': 'us_dst_approx'}. Best is trial 0 with value: -9.6.
C:\Users\הלל\Desktop\algo projects\trading-research-factory\walk forward engine\.venv\lib\site-packages\optuna\distributions.py:685: UserWarning: The distribution is specified by [0.0, 0.0005] and step=0.00015, but the range is not divisible by `step`. It will be replaced by [0.0, 0.00045].
  warnings.warn(
C:\Users\הלל\Desktop\algo projects\trading-research-factory\walk forward engine\.venv\lib\site-packages\optuna\distributions.py:685: UserWarning: The distribution is specified by [1.5, 99.0] and step=1.0, but the range is not divisible by `step`. It will be replaced by [1.5, 98.5].
  warnings.warn(
C:\Users\הלל\Desktop\algo projects\trading-research-factory\walk forward engine\.venv\lib\site-packages\optuna\distributions.py:685: UserWarning: The distribution is specified by [1.5, 4.0] and step=1.0, but the range is not divisible by `step`. It will be replaced by [1.5, 3.5].
  warnings.warn(
C:\Users\הלל\Desktop\algo projects\trading-research-factory\walk forward engine\.venv\lib\site-packages\optuna\distributions.py:700: UserWarning: The distribution is specified by [10, 20] and step=4, but the range is not divisible by `step`. It will be replaced by [10, 18].
  warnings.warn(
C:\Users\הלל\Desktop\algo projects\trading-research-factory\walk forward engine\.venv\lib\site-packages\optuna\distributions.py:685: UserWarning: The distribution is specified by [0.0, 0.0005] and step=0.00015, but the range is not divisible by `step`. It will be replaced by [0.0, 0.00045].
  warnings.warn(
C:\Users\הלל\Desktop\algo projects\trading-research-factory\walk forward engine\.venv\lib\site-packages\optuna\distributions.py:685: UserWarning: The distribution is specified by [1.5, 99.0] and step=1.0, but the range is not divisible by `step`. It will be replaced by [1.5, 98.5].
  warnings.warn(
C:\Users\הלל\Desktop\algo projects\trading-research-factory\walk forward engine\.venv\lib\site-packages\optuna\distributions.py:685: UserWarning: The distribution is specified by [1.5, 4.0] and step=1.0, but the range is not divisible by `step`. It will be replaced by [1.5, 3.5].
  warnings.warn(
[I 2026-06-02 00:20:29,698] Trial 6 finished with value: -0.2329088789451719 and parameters: {'atr_period': 14, 'pre_event_lookback': 4, 'reaction_bars': 1, 'min_reaction_return': 0.0, 'pre_range_atr_mult_max': 53.0, 'volume_lookback': 96, 'volume_ratio_max': 73.5, 'max_hold_bars': 6, 'sl_atr_mult': 1.0, 'tp_atr_mult': 1.5, 'direction_mode': 'fade', 'release_hour_mode': 'fixed_12_utc'}. Best is trial 6 with value: -0.2329088789451719.
[I 2026-06-02 00:20:29,714] Trial 5 finished with value: -2.4673708646072785 and parameters: {'atr_period': 18, 'pre_event_lookback': 8, 'reaction_bars': 1, 'min_reaction_return': 0.00015, 'pre_range_atr_mult_max': 17.0, 'volume_lookback': 48, 'volume_ratio_max': 27.5, 'max_hold_bars': 6, 'sl_atr_mult': 1.0, 'tp_atr_mult': 2.5, 'direction_mode': 'continuation', 'release_hour_mode': 'us_dst_approx'}. Best is trial 6 with value: -0.2329088789451719.
C:\Users\הלל\Desktop\algo projects\trading-research-factory\walk forward engine\.venv\lib\site-packages\optuna\distributions.py:700: UserWarning: The distribution is specified by [10, 20] and step=4, but the range is not divisible by `step`. It will be replaced by [10, 18].
  warnings.warn(
C:\Users\הלל\Desktop\algo projects\trading-research-factory\walk forward engine\.venv\lib\site-packages\optuna\distributions.py:685: UserWarning: The distribution is specified by [0.0, 0.0005] and step=0.00015, but the range is not divisible by `step`. It will be replaced by [0.0, 0.00045].
  warnings.warn(
[I 2026-06-02 00:20:29,768] Trial 2 finished with value: -9.6 and parameters: {'atr_period': 10, 'pre_event_lookback': 4, 'reaction_bars': 2, 'min_reaction_return': 0.0003, 'pre_range_atr_mult_max': 12.0, 'volume_lookback': 192, 'volume_ratio_max': 81.5, 'max_hold_bars': 10, 'sl_atr_mult': 1.5, 'tp_atr_mult': 3.5, 'direction_mode': 'fade', 'release_hour_mode': 'fixed_13_utc'}. Best is trial 6 with value: -0.2329088789451719.
C:\Users\הלל\Desktop\algo projects\trading-research-factory\walk forward engine\.venv\lib\site-packages\optuna\distributions.py:685: UserWarning: The distribution is specified by [1.5, 99.0] and step=1.0, but the range is not divisible by `step`. It will be replaced by [1.5, 98.5].
  warnings.warn(
[I 2026-06-02 00:20:29,793] Trial 3 finished with value: -9.6 and parameters: {'atr_period': 10, 'pre_event_lookback': 4, 'reaction_bars': 2, 'min_reaction_return': 0.00045, 'pre_range_atr_mult_max': 60.0, 'volume_lookback': 144, 'volume_ratio_max': 82.5, 'max_hold_bars': 6, 'sl_atr_mult': 1.5, 'tp_atr_mult': 2.5, 'direction_mode': 'fade', 'release_hour_mode': 'fixed_12_utc'}. Best is trial 6 with value: -0.2329088789451719.
C:\Users\הלל\Desktop\algo projects\trading-research-factory\walk forward engine\.venv\lib\site-packages\optuna\distributions.py:685: UserWarning: The distribution is specified by [1.5, 4.0] and step=1.0, but the range is not divisible by `step`. It will be replaced by [1.5, 3.5].
  warnings.warn(
[I 2026-06-02 00:20:29,797] Trial 4 finished with value: -9.6 and parameters: {'atr_period': 18, 'pre_event_lookback': 8, 'reaction_bars': 2, 'min_reaction_return': 0.0003, 'pre_range_atr_mult_max': 61.0, 'volume_lookback': 144, 'volume_ratio_max': 16.5, 'max_hold_bars': 4, 'sl_atr_mult': 2.0, 'tp_atr_mult': 3.5, 'direction_mode': 'fade', 'release_hour_mode': 'fixed_13_utc'}. Best is trial 6 with value: -0.2329088789451719.
[I 2026-06-02 00:20:29,842] Trial 7 finished with value: -1.935161913712723 and parameters: {'atr_period': 14, 'pre_event_lookback': 8, 'reaction_bars': 2, 'min_reaction_return': 0.00015, 'pre_range_atr_mult_max': 16.0, 'volume_lookback': 144, 'volume_ratio_max': 18.5, 'max_hold_bars': 4, 'sl_atr_mult': 2.0, 'tp_atr_mult': 2.5, 'direction_mode': 'continuation', 'release_hour_mode': 'fixed_12_utc'}. Best is trial 6 with value: -0.2329088789451719.
[I 2026-06-02 00:20:30,063] Trial 8 finished with value: -9.7 and parameters: {'atr_period': 18, 'pre_event_lookback': 8, 'reaction_bars': 1, 'min_reaction_return': 0.00045, 'pre_range_atr_mult_max': 13.0, 'volume_lookback': 48, 'volume_ratio_max': 52.5, 'max_hold_bars': 8, 'sl_atr_mult': 2.0, 'tp_atr_mult': 3.5, 'direction_mode': 'continuation', 'release_hour_mode': 'us_dst_approx'}. Best is trial 6 with value: -0.2329088789451719.
[I 2026-06-02 00:20:30,199] Trial 9 finished with value: -0.7765382914882832 and parameters: {'atr_period': 14, 'pre_event_lookback': 8, 'reaction_bars': 2, 'min_reaction_return': 0.0, 'pre_range_atr_mult_max': 80.0, 'volume_lookback': 48, 'volume_ratio_max': 22.5, 'max_hold_bars': 12, 'sl_atr_mult': 1.0, 'tp_atr_mult': 2.5, 'direction_mode': 'continuation', 'release_hour_mode': 'fixed_12_utc'}. Best is trial 6 with value: -0.2329088789451719.
[I 2026-06-02 00:20:30,267] Trial 10 finished with value: -0.8619860044880244 and parameters: {'atr_period': 18, 'pre_event_lookback': 4, 'reaction_bars': 1, 'min_reaction_return': 0.0003, 'pre_range_atr_mult_max': 67.0, 'volume_lookback': 48, 'volume_ratio_max': 26.5, 'max_hold_bars': 12, 'sl_atr_mult': 1.0, 'tp_atr_mult': 1.5, 'direction_mode': 'fade', 'release_hour_mode': 'fixed_13_utc'}. Best is trial 6 with value: -0.2329088789451719.
[I 2026-06-02 00:20:30,303] Trial 11 finished with value: -9.6 and parameters: {'atr_period': 10, 'pre_event_lookback': 12, 'reaction_bars': 2, 'min_reaction_return': 0.00045, 'pre_range_atr_mult_max': 43.0, 'volume_lookback': 48, 'volume_ratio_max': 19.5, 'max_hold_bars': 4, 'sl_atr_mult': 1.5, 'tp_atr_mult': 1.5, 'direction_mode': 'fade', 'release_hour_mode': 'us_dst_approx'}. Best is trial 6 with value: -0.2329088789451719.
C:\Users\הלל\Desktop\algo projects\trading-research-factory\walk forward engine\.venv\lib\site-packages\optuna\samplers\_tpe\sampler.py:319: ExperimentalWarning: ``multivariate`` option is an experimental feature. The interface can change in the future.
  warnings.warn(
[I 2026-06-02 00:20:30,486] A new study created in memory with name: no-name-75c75590-c71e-4cee-8286-2ec39fabde88
C:\Users\הלל\Desktop\algo projects\trading-research-factory\walk forward engine\.venv\lib\site-packages\optuna\distributions.py:700: UserWarning: The distribution is specified by [10, 20] and step=4, but the range is not divisible by `step`. It will be replaced by [10, 18].
  warnings.warn(
C:\Users\הלל\Desktop\algo projects\trading-research-factory\walk forward engine\.venv\lib\site-packages\optuna\distributions.py:685: UserWarning: The distribution is specified by [0.0, 0.0005] and step=0.00015, but the range is not divisible by `step`. It will be replaced by [0.0, 0.00045].
  warnings.warn(
C:\Users\הלל\Desktop\algo projects\trading-research-factory\walk forward engine\.venv\lib\site-packages\optuna\distributions.py:685: UserWarning: The distribution is specified by [1.5, 99.0] and step=1.0, but the range is not divisible by `step`. It will be replaced by [1.5, 98.5].
  warnings.warn(
C:\Users\הלל\Desktop\algo projects\trading-research-factory\walk forward engine\.venv\lib\site-packages\optuna\distributions.py:685: UserWarning: The distribution is specified by [1.5, 4.0] and step=1.0, but the range is not divisible by `step`. It will be replaced by [1.5, 3.5].
  warnings.warn(
C:\Users\הלל\Desktop\algo projects\trading-research-factory\walk forward engine\.venv\lib\site-packages\optuna\distributions.py:685: UserWarning: The distribution is specified by [1.5, 4.0] and step=1.0, but the range is not divisible by `step`. It will be replaced by [1.5, 3.5].
  warnings.warn(
C:\Users\הלל\Desktop\algo projects\trading-research-factory\walk forward engine\.venv\lib\site-packages\optuna\distributions.py:685: UserWarning: The distribution is specified by [1.5, 4.0] and step=1.0, but the range is not divisible by `step`. It will be replaced by [1.5, 3.5].
  warnings.warn(
[I 2026-06-02 00:20:31,087] Trial 0 finished with value: -9.7 and parameters: {'atr_period': 10, 'pre_event_lookback': 4, 'reaction_bars': 2, 'min_reaction_return': 0.00045, 'pre_range_atr_mult_max': 93.0, 'volume_lookback': 144, 'volume_ratio_max': 96.5, 'max_hold_bars': 8, 'sl_atr_mult': 1.5, 'tp_atr_mult': 1.5, 'direction_mode': 'fade', 'release_hour_mode': 'fixed_13_utc'}. Best is trial 0 with value: -9.7.
C:\Users\הלל\Desktop\algo projects\trading-research-factory\walk forward engine\.venv\lib\site-packages\optuna\distributions.py:700: UserWarning: The distribution is specified by [10, 20] and step=4, but the range is not divisible by `step`. It will be replaced by [10, 18].
  warnings.warn(
C:\Users\הלל\Desktop\algo projects\trading-research-factory\walk forward engine\.venv\lib\site-packages\optuna\distributions.py:685: UserWarning: The distribution is specified by [0.0, 0.0005] and step=0.00015, but the range is not divisible by `step`. It will be replaced by [0.0, 0.00045].
  warnings.warn(
C:\Users\הלל\Desktop\algo projects\trading-research-factory\walk forward engine\.venv\lib\site-packages\optuna\distributions.py:685: UserWarning: The distribution is specified by [1.5, 99.0] and step=1.0, but the range is not divisible by `step`. It will be replaced by [1.5, 98.5].
  warnings.warn(
C:\Users\הלל\Desktop\algo projects\trading-research-factory\walk forward engine\.venv\lib\site-packages\optuna\distributions.py:685: UserWarning: The distribution is specified by [1.5, 4.0] and step=1.0, but the range is not divisible by `step`. It will be replaced by [1.5, 3.5].
  warnings.warn(
[I 2026-06-02 00:20:31,252] Trial 4 finished with value: -9.6 and parameters: {'atr_period': 10, 'pre_event_lookback': 4, 'reaction_bars': 1, 'min_reaction_return': 0.0003, 'pre_range_atr_mult_max': 52.0, 'volume_lookback': 96, 'volume_ratio_max': 69.5, 'max_hold_bars': 2, 'sl_atr_mult': 2.0, 'tp_atr_mult': 1.5, 'direction_mode': 'continuation', 'release_hour_mode': 'fixed_12_utc'}. Best is trial 4 with value: -9.6.
[I 2026-06-02 00:20:31,253] Trial 1 finished with value: -9.7 and parameters: {'atr_period': 18, 'pre_event_lookback': 12, 'reaction_bars': 2, 'min_reaction_return': 0.00045, 'pre_range_atr_mult_max': 31.0, 'volume_lookback': 144, 'volume_ratio_max': 19.5, 'max_hold_bars': 8, 'sl_atr_mult': 1.0, 'tp_atr_mult': 2.5, 'direction_mode': 'continuation', 'release_hour_mode': 'fixed_13_utc'}. Best is trial 4 with value: -9.6.
C:\Users\הלל\Desktop\algo projects\trading-research-factory\walk forward engine\.venv\lib\site-packages\optuna\distributions.py:700: UserWarning: The distribution is specified by [10, 20] and step=4, but the range is not divisible by `step`. It will be replaced by [10, 18].
  warnings.warn(
C:\Users\הלל\Desktop\algo projects\trading-research-factory\walk forward engine\.venv\lib\site-packages\optuna\distributions.py:685: UserWarning: The distribution is specified by [0.0, 0.0005] and step=0.00015, but the range is not divisible by `step`. It will be replaced by [0.0, 0.00045].
  warnings.warn(
[I 2026-06-02 00:20:31,332] Trial 3 finished with value: -9.7 and parameters: {'atr_period': 10, 'pre_event_lookback': 4, 'reaction_bars': 2, 'min_reaction_return': 0.0003, 'pre_range_atr_mult_max': 8.0, 'volume_lookback': 96, 'volume_ratio_max': 12.5, 'max_hold_bars': 4, 'sl_atr_mult': 1.0, 'tp_atr_mult': 3.5, 'direction_mode': 'fade', 'release_hour_mode': 'fixed_13_utc'}. Best is trial 4 with value: -9.6.
C:\Users\הלל\Desktop\algo projects\trading-research-factory\walk forward engine\.venv\lib\site-packages\optuna\distributions.py:685: UserWarning: The distribution is specified by [1.5, 99.0] and step=1.0, but the range is not divisible by `step`. It will be replaced by [1.5, 98.5].
  warnings.warn(
C:\Users\הלל\Desktop\algo projects\trading-research-factory\walk forward engine\.venv\lib\site-packages\optuna\distributions.py:685: UserWarning: The distribution is specified by [1.5, 4.0] and step=1.0, but the range is not divisible by `step`. It will be replaced by [1.5, 3.5].
  warnings.warn(
C:\Users\הלל\Desktop\algo projects\trading-research-factory\walk forward engine\.venv\lib\site-packages\optuna\distributions.py:685: UserWarning: The distribution is specified by [1.5, 4.0] and step=1.0, but the range is not divisible by `step`. It will be replaced by [1.5, 3.5].
  warnings.warn(
[I 2026-06-02 00:20:31,408] Trial 2 finished with value: 1.8315868034708322 and parameters: {'atr_period': 14, 'pre_event_lookback': 4, 'reaction_bars': 1, 'min_reaction_return': 0.0, 'pre_range_atr_mult_max': 19.0, 'volume_lookback': 48, 'volume_ratio_max': 9.5, 'max_hold_bars': 4, 'sl_atr_mult': 2.0, 'tp_atr_mult': 1.5, 'direction_mode': 'fade', 'release_hour_mode': 'fixed_13_utc'}. Best is trial 2 with value: 1.8315868034708322.
[I 2026-06-02 00:20:31,440] Trial 7 finished with value: -0.6956734965161481 and parameters: {'atr_period': 10, 'pre_event_lookback': 12, 'reaction_bars': 2, 'min_reaction_return': 0.0, 'pre_range_atr_mult_max': 13.0, 'volume_lookback': 144, 'volume_ratio_max': 95.5, 'max_hold_bars': 10, 'sl_atr_mult': 2.0, 'tp_atr_mult': 1.5, 'direction_mode': 'fade', 'release_hour_mode': 'fixed_12_utc'}. Best is trial 2 with value: 1.8315868034708322.
[I 2026-06-02 00:20:31,480] Trial 5 finished with value: -9.6 and parameters: {'atr_period': 10, 'pre_event_lookback': 12, 'reaction_bars': 2, 'min_reaction_return': 0.00015, 'pre_range_atr_mult_max': 57.0, 'volume_lookback': 96, 'volume_ratio_max': 62.5, 'max_hold_bars': 12, 'sl_atr_mult': 1.0, 'tp_atr_mult': 3.5, 'direction_mode': 'continuation', 'release_hour_mode': 'fixed_12_utc'}. Best is trial 2 with value: 1.8315868034708322.
[I 2026-06-02 00:20:31,488] Trial 6 finished with value: -0.4358832409494872 and parameters: {'atr_period': 14, 'pre_event_lookback': 8, 'reaction_bars': 2, 'min_reaction_return': 0.0, 'pre_range_atr_mult_max': 20.0, 'volume_lookback': 96, 'volume_ratio_max': 49.5, 'max_hold_bars': 2, 'sl_atr_mult': 1.5, 'tp_atr_mult': 3.5, 'direction_mode': 'fade', 'release_hour_mode': 'fixed_13_utc'}. Best is trial 2 with value: 1.8315868034708322.
[I 2026-06-02 00:20:31,726] Trial 8 finished with value: 1.4960812859630523 and parameters: {'atr_period': 10, 'pre_event_lookback': 12, 'reaction_bars': 1, 'min_reaction_return': 0.0, 'pre_range_atr_mult_max': 26.0, 'volume_lookback': 48, 'volume_ratio_max': 27.5, 'max_hold_bars': 2, 'sl_atr_mult': 1.5, 'tp_atr_mult': 2.5, 'direction_mode': 'fade', 'release_hour_mode': 'fixed_13_utc'}. Best is trial 2 with value: 1.8315868034708322.
[I 2026-06-02 00:20:31,846] Trial 9 finished with value: -9.9 and parameters: {'atr_period': 14, 'pre_event_lookback': 12, 'reaction_bars': 1, 'min_reaction_return': 0.00045, 'pre_range_atr_mult_max': 14.0, 'volume_lookback': 144, 'volume_ratio_max': 45.5, 'max_hold_bars': 6, 'sl_atr_mult': 1.5, 'tp_atr_mult': 1.5, 'direction_mode': 'continuation', 'release_hour_mode': 'fixed_12_utc'}. Best is trial 2 with value: 1.8315868034708322.
[I 2026-06-02 00:20:31,894] Trial 11 finished with value: -9.6 and parameters: {'atr_period': 10, 'pre_event_lookback': 8, 'reaction_bars': 2, 'min_reaction_return': 0.00045, 'pre_range_atr_mult_max': 88.0, 'volume_lookback': 192, 'volume_ratio_max': 46.5, 'max_hold_bars': 12, 'sl_atr_mult': 1.5, 'tp_atr_mult': 3.5, 'direction_mode': 'continuation', 'release_hour_mode': 'fixed_12_utc'}. Best is trial 2 with value: 1.8315868034708322.
[I 2026-06-02 00:20:31,912] Trial 10 finished with value: -0.27294824395367445 and parameters: {'atr_period': 10, 'pre_event_lookback': 4, 'reaction_bars': 2, 'min_reaction_return': 0.0, 'pre_range_atr_mult_max': 22.0, 'volume_lookback': 144, 'volume_ratio_max': 37.5, 'max_hold_bars': 6, 'sl_atr_mult': 1.5, 'tp_atr_mult': 3.5, 'direction_mode': 'continuation', 'release_hour_mode': 'us_dst_approx'}. Best is trial 2 with value: 1.8315868034708322.
C:\Users\הלל\Desktop\algo projects\trading-research-factory\walk forward engine\.venv\lib\site-packages\optuna\samplers\_tpe\sampler.py:319: ExperimentalWarning: ``multivariate`` option is an experimental feature. The interface can change in the future.
  warnings.warn(
[I 2026-06-02 00:20:32,111] A new study created in memory with name: no-name-e1b96667-255d-4a1b-94af-deae85c7409c
C:\Users\הלל\Desktop\algo projects\trading-research-factory\walk forward engine\.venv\lib\site-packages\optuna\distributions.py:700: UserWarning: The distribution is specified by [10, 20] and step=4, but the range is not divisible by `step`. It will be replaced by [10, 18].
  warnings.warn(
C:\Users\הלל\Desktop\algo projects\trading-research-factory\walk forward engine\.venv\lib\site-packages\optuna\distributions.py:685: UserWarning: The distribution is specified by [0.0, 0.0005] and step=0.00015, but the range is not divisible by `step`. It will be replaced by [0.0, 0.00045].
  warnings.warn(
C:\Users\הלל\Desktop\algo projects\trading-research-factory\walk forward engine\.venv\lib\site-packages\optuna\distributions.py:685: UserWarning: The distribution is specified by [1.5, 99.0] and step=1.0, but the range is not divisible by `step`. It will be replaced by [1.5, 98.5].
  warnings.warn(
C:\Users\הלל\Desktop\algo projects\trading-research-factory\walk forward engine\.venv\lib\site-packages\optuna\distributions.py:685: UserWarning: The distribution is specified by [1.5, 4.0] and step=1.0, but the range is not divisible by `step`. It will be replaced by [1.5, 3.5].
  warnings.warn(
C:\Users\הלל\Desktop\algo projects\trading-research-factory\walk forward engine\.venv\lib\site-packages\optuna\distributions.py:685: UserWarning: The distribution is specified by [0.0, 0.0005] and step=0.00015, but the range is not divisible by `step`. It will be replaced by [0.0, 0.00045].
  warnings.warn(
C:\Users\הלל\Desktop\algo projects\trading-research-factory\walk forward engine\.venv\lib\site-packages\optuna\distributions.py:685: UserWarning: The distribution is specified by [1.5, 99.0] and step=1.0, but the range is not divisible by `step`. It will be replaced by [1.5, 98.5].
  warnings.warn(
C:\Users\הלל\Desktop\algo projects\trading-research-factory\walk forward engine\.venv\lib\site-packages\optuna\distributions.py:685: UserWarning: The distribution is specified by [1.5, 4.0] and step=1.0, but the range is not divisible by `step`. It will be replaced by [1.5, 3.5].
  warnings.warn(
C:\Users\הלל\Desktop\algo projects\trading-research-factory\walk forward engine\.venv\lib\site-packages\optuna\distributions.py:685: UserWarning: The distribution is specified by [1.5, 4.0] and step=1.0, but the range is not divisible by `step`. It will be replaced by [1.5, 3.5].
  warnings.warn(
C:\Users\הלל\Desktop\algo projects\trading-research-factory\walk forward engine\.venv\lib\site-packages\optuna\distributions.py:685: UserWarning: The distribution is specified by [1.5, 4.0] and step=1.0, but the range is not divisible by `step`. It will be replaced by [1.5, 3.5].
  warnings.warn(
