[I 2026-06-02 00:20:06,246] Trial 0 finished with value: -9.9 and parameters: {'atr_period': 10, 'pre_event_lookback': 8, 'reaction_bars': 1, 'min_reaction_return': 0.0003, 'pre_range_atr_mult_max': 66.0, 'volume_lookback': 48, 'volume_ratio_max': 88.5, 'max_hold_bars': 8, 'sl_atr_mult': 2.0, 'tp_atr_mult': 3.5, 'direction_mode': 'fade', 'release_hour_mode': 'fixed_13_utc'}. Best is trial 0 with value: -9.9.
C:\Users\הלל\Desktop\algo projects\trading-research-factory\walk forward engine\.venv\lib\site-packages\optuna\distributions.py:700: UserWarning: The distribution is specified by [10, 20] and step=4, but the range is not divisible by `step`. It will be replaced by [10, 18].
  warnings.warn(
C:\Users\הלל\Desktop\algo projects\trading-research-factory\walk forward engine\.venv\lib\site-packages\optuna\distributions.py:685: UserWarning: The distribution is specified by [0.0, 0.0005] and step=0.00015, but the range is not divisible by `step`. It will be replaced by [0.0, 0.00045].
  warnings.warn(
C:\Users\הלל\Desktop\algo projects\trading-research-factory\walk forward engine\.venv\lib\site-packages\optuna\distributions.py:685: UserWarning: The distribution is specified by [1.5, 99.0] and step=1.0, but the range is not divisible by `step`. It will be replaced by [1.5, 98.5].
  warnings.warn(
C:\Users\הלל\Desktop\algo projects\trading-research-factory\walk forward engine\.venv\lib\site-packages\optuna\distributions.py:685: UserWarning: The distribution is specified by [1.5, 4.0] and step=1.0, but the range is not divisible by `step`. It will be replaced by [1.5, 3.5].
  warnings.warn(
[I 2026-06-02 00:20:06,460] Trial 1 finished with value: -9.7 and parameters: {'atr_period': 18, 'pre_event_lookback': 8, 'reaction_bars': 2, 'min_reaction_return': 0.00015, 'pre_range_atr_mult_max': 28.0, 'volume_lookback': 96, 'volume_ratio_max': 96.5, 'max_hold_bars': 6, 'sl_atr_mult': 1.0, 'tp_atr_mult': 2.5, 'direction_mode': 'fade', 'release_hour_mode': 'us_dst_approx'}. Best is trial 1 with value: -9.7.
[I 2026-06-02 00:20:06,460] Trial 4 finished with value: -9.9 and parameters: {'atr_period': 10, 'pre_event_lookback': 12, 'reaction_bars': 2, 'min_reaction_return': 0.00015, 'pre_range_atr_mult_max': 22.0, 'volume_lookback': 96, 'volume_ratio_max': 1.5, 'max_hold_bars': 2, 'sl_atr_mult': 2.0, 'tp_atr_mult': 1.5, 'direction_mode': 'fade', 'release_hour_mode': 'fixed_12_utc'}. Best is trial 1 with value: -9.7.
C:\Users\הלל\Desktop\algo projects\trading-research-factory\walk forward engine\.venv\lib\site-packages\optuna\distributions.py:700: UserWarning: The distribution is specified by [10, 20] and step=4, but the range is not divisible by `step`. It will be replaced by [10, 18].
  warnings.warn(
C:\Users\הלל\Desktop\algo projects\trading-research-factory\walk forward engine\.venv\lib\site-packages\optuna\distributions.py:685: UserWarning: The distribution is specified by [0.0, 0.0005] and step=0.00015, but the range is not divisible by `step`. It will be replaced by [0.0, 0.00045].
  warnings.warn(
C:\Users\הלל\Desktop\algo projects\trading-research-factory\walk forward engine\.venv\lib\site-packages\optuna\distributions.py:685: UserWarning: The distribution is specified by [1.5, 99.0] and step=1.0, but the range is not divisible by `step`. It will be replaced by [1.5, 98.5].
  warnings.warn(
C:\Users\הלל\Desktop\algo projects\trading-research-factory\walk forward engine\.venv\lib\site-packages\optuna\distributions.py:685: UserWarning: The distribution is specified by [1.5, 4.0] and step=1.0, but the range is not divisible by `step`. It will be replaced by [1.5, 3.5].
  warnings.warn(
[I 2026-06-02 00:20:06,551] Trial 5 finished with value: -9.6 and parameters: {'atr_period': 18, 'pre_event_lookback': 8, 'reaction_bars': 2, 'min_reaction_return': 0.0, 'pre_range_atr_mult_max': 66.0, 'volume_lookback': 192, 'volume_ratio_max': 21.5, 'max_hold_bars': 2, 'sl_atr_mult': 1.0, 'tp_atr_mult': 2.5, 'direction_mode': 'continuation', 'release_hour_mode': 'fixed_12_utc'}. Best is trial 5 with value: -9.6.
[I 2026-06-02 00:20:06,551] Trial 6 finished with value: -9.6 and parameters: {'atr_period': 10, 'pre_event_lookback': 4, 'reaction_bars': 2, 'min_reaction_return': 0.0, 'pre_range_atr_mult_max': 68.0, 'volume_lookback': 48, 'volume_ratio_max': 76.5, 'max_hold_bars': 8, 'sl_atr_mult': 2.0, 'tp_atr_mult': 2.5, 'direction_mode': 'fade', 'release_hour_mode': 'fixed_12_utc'}. Best is trial 5 with value: -9.6.
C:\Users\הלל\Desktop\algo projects\trading-research-factory\walk forward engine\.venv\lib\site-packages\optuna\distributions.py:700: UserWarning: The distribution is specified by [10, 20] and step=4, but the range is not divisible by `step`. It will be replaced by [10, 18].
  warnings.warn(
C:\Users\הלל\Desktop\algo projects\trading-research-factory\walk forward engine\.venv\lib\site-packages\optuna\distributions.py:685: UserWarning: The distribution is specified by [0.0, 0.0005] and step=0.00015, but the range is not divisible by `step`. It will be replaced by [0.0, 0.00045].
  warnings.warn(
C:\Users\הלל\Desktop\algo projects\trading-research-factory\walk forward engine\.venv\lib\site-packages\optuna\distributions.py:685: UserWarning: The distribution is specified by [1.5, 99.0] and step=1.0, but the range is not divisible by `step`. It will be replaced by [1.5, 98.5].
  warnings.warn(
C:\Users\הלל\Desktop\algo projects\trading-research-factory\walk forward engine\.venv\lib\site-packages\optuna\distributions.py:685: UserWarning: The distribution is specified by [1.5, 4.0] and step=1.0, but the range is not divisible by `step`. It will be replaced by [1.5, 3.5].
  warnings.warn(
[I 2026-06-02 00:20:06,630] Trial 3 finished with value: -9.7 and parameters: {'atr_period': 14, 'pre_event_lookback': 12, 'reaction_bars': 1, 'min_reaction_return': 0.00045, 'pre_range_atr_mult_max': 85.0, 'volume_lookback': 48, 'volume_ratio_max': 72.5, 'max_hold_bars': 10, 'sl_atr_mult': 1.0, 'tp_atr_mult': 2.5, 'direction_mode': 'fade', 'release_hour_mode': 'fixed_12_utc'}. Best is trial 5 with value: -9.6.
[I 2026-06-02 00:20:06,667] Trial 7 finished with value: -9.6 and parameters: {'atr_period': 18, 'pre_event_lookback': 4, 'reaction_bars': 2, 'min_reaction_return': 0.00045, 'pre_range_atr_mult_max': 56.0, 'volume_lookback': 96, 'volume_ratio_max': 61.5, 'max_hold_bars': 2, 'sl_atr_mult': 1.0, 'tp_atr_mult': 3.5, 'direction_mode': 'fade', 'release_hour_mode': 'fixed_13_utc'}. Best is trial 5 with value: -9.6.
[I 2026-06-02 00:20:06,677] Trial 2 finished with value: -9.7 and parameters: {'atr_period': 18, 'pre_event_lookback': 4, 'reaction_bars': 2, 'min_reaction_return': 0.00015, 'pre_range_atr_mult_max': 12.0, 'volume_lookback': 144, 'volume_ratio_max': 29.5, 'max_hold_bars': 2, 'sl_atr_mult': 2.0, 'tp_atr_mult': 3.5, 'direction_mode': 'fade', 'release_hour_mode': 'us_dst_approx'}. Best is trial 5 with value: -9.6.
[I 2026-06-02 00:20:06,862] Trial 8 finished with value: -9.7 and parameters: {'atr_period': 10, 'pre_event_lookback': 8, 'reaction_bars': 2, 'min_reaction_return': 0.0003, 'pre_range_atr_mult_max': 82.0, 'volume_lookback': 48, 'volume_ratio_max': 55.5, 'max_hold_bars': 4, 'sl_atr_mult': 1.0, 'tp_atr_mult': 1.5, 'direction_mode': 'continuation', 'release_hour_mode': 'fixed_12_utc'}. Best is trial 5 with value: -9.6.
[I 2026-06-02 00:20:07,069] Trial 11 finished with value: -9.6 and parameters: {'atr_period': 14, 'pre_event_lookback': 4, 'reaction_bars': 2, 'min_reaction_return': 0.0003, 'pre_range_atr_mult_max': 90.0, 'volume_lookback': 96, 'volume_ratio_max': 78.5, 'max_hold_bars': 6, 'sl_atr_mult': 1.0, 'tp_atr_mult': 3.5, 'direction_mode': 'fade', 'release_hour_mode': 'fixed_13_utc'}. Best is trial 5 with value: -9.6.
[I 2026-06-02 00:20:07,069] Trial 9 finished with value: -9.9 and parameters: {'atr_period': 10, 'pre_event_lookback': 12, 'reaction_bars': 1, 'min_reaction_return': 0.0003, 'pre_range_atr_mult_max': 33.0, 'volume_lookback': 144, 'volume_ratio_max': 80.5, 'max_hold_bars': 2, 'sl_atr_mult': 2.0, 'tp_atr_mult': 1.5, 'direction_mode': 'continuation', 'release_hour_mode': 'fixed_13_utc'}. Best is trial 5 with value: -9.6.
[I 2026-06-02 00:20:07,085] Trial 10 finished with value: -9.7 and parameters: {'atr_period': 14, 'pre_event_lookback': 12, 'reaction_bars': 2, 'min_reaction_return': 0.0003, 'pre_range_atr_mult_max': 23.0, 'volume_lookback': 144, 'volume_ratio_max': 82.5, 'max_hold_bars': 12, 'sl_atr_mult': 2.0, 'tp_atr_mult': 1.5, 'direction_mode': 'continuation', 'release_hour_mode': 'us_dst_approx'}. Best is trial 5 with value: -9.6.
C:\Users\הלל\Desktop\algo projects\trading-research-factory\walk forward engine\.venv\lib\site-packages\optuna\samplers\_tpe\sampler.py:319: ExperimentalWarning: ``multivariate`` option is an experimental feature. The interface can change in the future.
  warnings.warn(
[I 2026-06-02 00:20:07,255] A new study created in memory with name: no-name-bc558531-7ad9-4ef6-a8c4-08a4f2b6803e
C:\Users\הלל\Desktop\algo projects\trading-research-factory\walk forward engine\.venv\lib\site-packages\optuna\distributions.py:700: UserWarning: The distribution is specified by [10, 20] and step=4, but the range is not divisible by `step`. It will be replaced by [10, 18].
  warnings.warn(
C:\Users\הלל\Desktop\algo projects\trading-research-factory\walk forward engine\.venv\lib\site-packages\optuna\distributions.py:685: UserWarning: The distribution is specified by [0.0, 0.0005] and step=0.00015, but the range is not divisible by `step`. It will be replaced by [0.0, 0.00045].
  warnings.warn(
C:\Users\הלל\Desktop\algo projects\trading-research-factory\walk forward engine\.venv\lib\site-packages\optuna\distributions.py:685: UserWarning: The distribution is specified by [1.5, 99.0] and step=1.0, but the range is not divisible by `step`. It will be replaced by [1.5, 98.5].
  warnings.warn(
C:\Users\הלל\Desktop\algo projects\trading-research-factory\walk forward engine\.venv\lib\site-packages\optuna\distributions.py:685: UserWarning: The distribution is specified by [1.5, 4.0] and step=1.0, but the range is not divisible by `step`. It will be replaced by [1.5, 3.5].
  warnings.warn(
C:\Users\הלל\Desktop\algo projects\trading-research-factory\walk forward engine\.venv\lib\site-packages\optuna\distributions.py:685: UserWarning: The distribution is specified by [0.0, 0.0005] and step=0.00015, but the range is not divisible by `step`. It will be replaced by [0.0, 0.00045].
  warnings.warn(
C:\Users\הלל\Desktop\algo projects\trading-research-factory\walk forward engine\.venv\lib\site-packages\optuna\distributions.py:685: UserWarning: The distribution is specified by [1.5, 99.0] and step=1.0, but the range is not divisible by `step`. It will be replaced by [1.5, 98.5].
  warnings.warn(
C:\Users\הלל\Desktop\algo projects\trading-research-factory\walk forward engine\.venv\lib\site-packages\optuna\distributions.py:685: UserWarning: The distribution is specified by [1.5, 4.0] and step=1.0, but the range is not divisible by `step`. It will be replaced by [1.5, 3.5].
  warnings.warn(
C:\Users\הלל\Desktop\algo projects\trading-research-factory\walk forward engine\.venv\lib\site-packages\optuna\distributions.py:685: UserWarning: The distribution is specified by [1.5, 4.0] and step=1.0, but the range is not divisible by `step`. It will be replaced by [1.5, 3.5].
  warnings.warn(
C:\Users\הלל\Desktop\algo projects\trading-research-factory\walk forward engine\.venv\lib\site-packages\optuna\distributions.py:685: UserWarning: The distribution is specified by [1.5, 4.0] and step=1.0, but the range is not divisible by `step`. It will be replaced by [1.5, 3.5].
  warnings.warn(
[I 2026-06-02 00:20:07,898] Trial 0 finished with value: -0.23507969003080148 and parameters: {'atr_period': 14, 'pre_event_lookback': 12, 'reaction_bars': 2, 'min_reaction_return': 0.00015, 'pre_range_atr_mult_max': 99.0, 'volume_lookback': 48, 'volume_ratio_max': 44.5, 'max_hold_bars': 6, 'sl_atr_mult': 1.5, 'tp_atr_mult': 1.5, 'direction_mode': 'continuation', 'release_hour_mode': 'fixed_12_utc'}. Best is trial 0 with value: -0.23507969003080148.
C:\Users\הלל\Desktop\algo projects\trading-research-factory\walk forward engine\.venv\lib\site-packages\optuna\distributions.py:700: UserWarning: The distribution is specified by [10, 20] and step=4, but the range is not divisible by `step`. It will be replaced by [10, 18].
  warnings.warn(
C:\Users\הלל\Desktop\algo projects\trading-research-factory\walk forward engine\.venv\lib\site-packages\optuna\distributions.py:685: UserWarning: The distribution is specified by [0.0, 0.0005] and step=0.00015, but the range is not divisible by `step`. It will be replaced by [0.0, 0.00045].
  warnings.warn(
C:\Users\הלל\Desktop\algo projects\trading-research-factory\walk forward engine\.venv\lib\site-packages\optuna\distributions.py:685: UserWarning: The distribution is specified by [1.5, 99.0] and step=1.0, but the range is not divisible by `step`. It will be replaced by [1.5, 98.5].
  warnings.warn(
C:\Users\הלל\Desktop\algo projects\trading-research-factory\walk forward engine\.venv\lib\site-packages\optuna\distributions.py:685: UserWarning: The distribution is specified by [1.5, 4.0] and step=1.0, but the range is not divisible by `step`. It will be replaced by [1.5, 3.5].
  warnings.warn(
[I 2026-06-02 00:20:07,962] Trial 5 finished with value: -10.0 and parameters: {'atr_period': 18, 'pre_event_lookback': 8, 'reaction_bars': 1, 'min_reaction_return': 0.0003, 'pre_range_atr_mult_max': 2.0, 'volume_lookback': 48, 'volume_ratio_max': 19.5, 'max_hold_bars': 6, 'sl_atr_mult': 1.5, 'tp_atr_mult': 1.5, 'direction_mode': 'continuation', 'release_hour_mode': 'us_dst_approx'}. Best is trial 0 with value: -0.23507969003080148.
C:\Users\הלל\Desktop\algo projects\trading-research-factory\walk forward engine\.venv\lib\site-packages\optuna\distributions.py:700: UserWarning: The distribution is specified by [10, 20] and step=4, but the range is not divisible by `step`. It will be replaced by [10, 18].
  warnings.warn(
C:\Users\הלל\Desktop\algo projects\trading-research-factory\walk forward engine\.venv\lib\site-packages\optuna\distributions.py:685: UserWarning: The distribution is specified by [0.0, 0.0005] and step=0.00015, but the range is not divisible by `step`. It will be replaced by [0.0, 0.00045].
  warnings.warn(
[I 2026-06-02 00:20:08,015] Trial 1 finished with value: -9.6 and parameters: {'atr_period': 14, 'pre_event_lookback': 4, 'reaction_bars': 1, 'min_reaction_return': 0.0003, 'pre_range_atr_mult_max': 44.0, 'volume_lookback': 96, 'volume_ratio_max': 78.5, 'max_hold_bars': 10, 'sl_atr_mult': 2.0, 'tp_atr_mult': 2.5, 'direction_mode': 'continuation', 'release_hour_mode': 'fixed_13_utc'}. Best is trial 0 with value: -0.23507969003080148.
C:\Users\הלל\Desktop\algo projects\trading-research-factory\walk forward engine\.venv\lib\site-packages\optuna\distributions.py:685: UserWarning: The distribution is specified by [1.5, 99.0] and step=1.0, but the range is not divisible by `step`. It will be replaced by [1.5, 98.5].
  warnings.warn(
C:\Users\הלל\Desktop\algo projects\trading-research-factory\walk forward engine\.venv\lib\site-packages\optuna\distributions.py:685: UserWarning: The distribution is specified by [1.5, 4.0] and step=1.0, but the range is not divisible by `step`. It will be replaced by [1.5, 3.5].
  warnings.warn(
C:\Users\הלל\Desktop\algo projects\trading-research-factory\walk forward engine\.venv\lib\site-packages\optuna\distributions.py:700: UserWarning: The distribution is specified by [10, 20] and step=4, but the range is not divisible by `step`. It will be replaced by [10, 18].
  warnings.warn(
C:\Users\הלל\Desktop\algo projects\trading-research-factory\walk forward engine\.venv\lib\site-packages\optuna\distributions.py:685: UserWarning: The distribution is specified by [0.0, 0.0005] and step=0.00015, but the range is not divisible by `step`. It will be replaced by [0.0, 0.00045].
  warnings.warn(
C:\Users\הלל\Desktop\algo projects\trading-research-factory\walk forward engine\.venv\lib\site-packages\optuna\distributions.py:685: UserWarning: The distribution is specified by [1.5, 99.0] and step=1.0, but the range is not divisible by `step`. It will be replaced by [1.5, 98.5].
  warnings.warn(
C:\Users\הלל\Desktop\algo projects\trading-research-factory\walk forward engine\.venv\lib\site-packages\optuna\distributions.py:685: UserWarning: The distribution is specified by [1.5, 4.0] and step=1.0, but the range is not divisible by `step`. It will be replaced by [1.5, 3.5].
  warnings.warn(
[I 2026-06-02 00:20:08,121] Trial 3 finished with value: -9.7 and parameters: {'atr_period': 14, 'pre_event_lookback': 8, 'reaction_bars': 2, 'min_reaction_return': 0.00045, 'pre_range_atr_mult_max': 79.0, 'volume_lookback': 96, 'volume_ratio_max': 59.5, 'max_hold_bars': 4, 'sl_atr_mult': 1.5, 'tp_atr_mult': 3.5, 'direction_mode': 'continuation', 'release_hour_mode': 'fixed_12_utc'}. Best is trial 0 with value: -0.23507969003080148.
[I 2026-06-02 00:20:08,144] Trial 2 finished with value: -9.6 and parameters: {'atr_period': 10, 'pre_event_lookback': 8, 'reaction_bars': 1, 'min_reaction_return': 0.0003, 'pre_range_atr_mult_max': 3.0, 'volume_lookback': 144, 'volume_ratio_max': 21.5, 'max_hold_bars': 10, 'sl_atr_mult': 2.0, 'tp_atr_mult': 2.5, 'direction_mode': 'fade', 'release_hour_mode': 'us_dst_approx'}. Best is trial 0 with value: -0.23507969003080148.
[I 2026-06-02 00:20:08,153] Trial 7 finished with value: -9.7 and parameters: {'atr_period': 18, 'pre_event_lookback': 4, 'reaction_bars': 2, 'min_reaction_return': 0.00045, 'pre_range_atr_mult_max': 92.0, 'volume_lookback': 144, 'volume_ratio_max': 36.5, 'max_hold_bars': 10, 'sl_atr_mult': 2.0, 'tp_atr_mult': 1.5, 'direction_mode': 'fade', 'release_hour_mode': 'fixed_12_utc'}. Best is trial 0 with value: -0.23507969003080148.
C:\Users\הלל\Desktop\algo projects\trading-research-factory\walk forward engine\.venv\lib\site-packages\optuna\distributions.py:685: UserWarning: The distribution is specified by [0.0, 0.0005] and step=0.00015, but the range is not divisible by `step`. It will be replaced by [0.0, 0.00045].
  warnings.warn(
[I 2026-06-02 00:20:08,185] Trial 4 finished with value: -1.1661233747978659 and parameters: {'atr_period': 10, 'pre_event_lookback': 8, 'reaction_bars': 1, 'min_reaction_return': 0.0, 'pre_range_atr_mult_max': 47.0, 'volume_lookback': 96, 'volume_ratio_max': 32.5, 'max_hold_bars': 4, 'sl_atr_mult': 1.0, 'tp_atr_mult': 1.5, 'direction_mode': 'fade', 'release_hour_mode': 'us_dst_approx'}. Best is trial 0 with value: -0.23507969003080148.
C:\Users\הלל\Desktop\algo projects\trading-research-factory\walk forward engine\.venv\lib\site-packages\optuna\distributions.py:685: UserWarning: The distribution is specified by [1.5, 99.0] and step=1.0, but the range is not divisible by `step`. It will be replaced by [1.5, 98.5].
  warnings.warn(
C:\Users\הלל\Desktop\algo projects\trading-research-factory\walk forward engine\.venv\lib\site-packages\optuna\distributions.py:685: UserWarning: The distribution is specified by [1.5, 4.0] and step=1.0, but the range is not divisible by `step`. It will be replaced by [1.5, 3.5].
  warnings.warn(
[I 2026-06-02 00:20:08,220] Trial 6 finished with value: -1.0818559348550647 and parameters: {'atr_period': 10, 'pre_event_lookback': 4, 'reaction_bars': 2, 'min_reaction_return': 0.0, 'pre_range_atr_mult_max': 22.0, 'volume_lookback': 144, 'volume_ratio_max': 49.5, 'max_hold_bars': 8, 'sl_atr_mult': 2.0, 'tp_atr_mult': 1.5, 'direction_mode': 'continuation', 'release_hour_mode': 'fixed_12_utc'}. Best is trial 0 with value: -0.23507969003080148.
[I 2026-06-02 00:20:08,338] Trial 8 finished with value: -9.7 and parameters: {'atr_period': 18, 'pre_event_lookback': 4, 'reaction_bars': 2, 'min_reaction_return': 0.00045, 'pre_range_atr_mult_max': 52.0, 'volume_lookback': 144, 'volume_ratio_max': 49.5, 'max_hold_bars': 8, 'sl_atr_mult': 1.5, 'tp_atr_mult': 1.5, 'direction_mode': 'continuation', 'release_hour_mode': 'us_dst_approx'}. Best is trial 0 with value: -0.23507969003080148.
[I 2026-06-02 00:20:08,605] Trial 9 finished with value: 0.5180083884950616 and parameters: {'atr_period': 10, 'pre_event_lookback': 8, 'reaction_bars': 2, 'min_reaction_return': 0.0, 'pre_range_atr_mult_max': 32.0, 'volume_lookback': 144, 'volume_ratio_max': 55.5, 'max_hold_bars': 10, 'sl_atr_mult': 1.0, 'tp_atr_mult': 3.5, 'direction_mode': 'fade', 'release_hour_mode': 'fixed_12_utc'}. Best is trial 9 with value: 0.5180083884950616.
[I 2026-06-02 00:20:08,605] Trial 10 finished with value: -2.356764736801138 and parameters: {'atr_period': 10, 'pre_event_lookback': 8, 'reaction_bars': 2, 'min_reaction_return': 0.0, 'pre_range_atr_mult_max': 12.0, 'volume_lookback': 48, 'volume_ratio_max': 57.5, 'max_hold_bars': 6, 'sl_atr_mult': 2.0, 'tp_atr_mult': 1.5, 'direction_mode': 'fade', 'release_hour_mode': 'us_dst_approx'}. Best is trial 9 with value: 0.5180083884950616.
